pmid,title,abstract,authors,first_author_affiliation,journal,pub_date,doi,score,matched_keywords,api_keywords
39780094,A network analysis of depression and anxiety symptoms among Chinese elderly living alone: based on the 2017-2018 Chinese Longitudinal Healthy Longevity Survey (CLHLS).,"<h4>Background</h4>Elderly individuals living alone represent a vulnerable group with limited family support, making them more susceptible to mental health issues such as depression and anxiety. This study aims to construct a network model of depression and anxiety symptoms among older adults living alone, exploring the correlations and centrality of different symptoms. The goal is to identify core and bridging symptoms to inform clinical interventions.<h4>Methods</h4>Using data from the 2018 Chinese Longitudinal Healthy Longevity Survey (CLHLS), this study constructed a network model of depression and anxiety symptoms among elderly individuals living alone. Depression and anxiety symptoms were assessed using the Center for Epidemiologic Studies Depression Scale-10 (CESD-10) and the Generalized Anxiety Disorder Scale-7 (GAD-7), respectively. A Gaussian Graphical Model (GGM) was employed to build the symptom network, and the Fruchterman-Reingold algorithm was used for visualization, with the thickness and color of the edges representing partial correlations between symptoms. To minimize spurious correlations, the Least Absolute Shrinkage and Selection Operator (LASSO) method was applied for regularization, and the optimal regularization parameters were selected using the Extended Bayesian Information Criterion (EBIC). We further calculated Expected Influence (EI) and Bridge Expected Influence (Bridge EI) to evaluate the importance of symptoms. Non-parametric bootstrap methods were used to assess the stability and accuracy of the network.<h4>Results</h4>The Network centrality analysis revealed that GAD2 (Uncontrollable worry) and GAD4 (Trouble relaxing) exhibited the highest strength centrality (1.128 and 1.102, respectively), indicating their significant direct associations with other symptoms and their roles as core nodes in the anxiety symptom network. Other highly central nodes, such as GAD1 (Nervousness or anxiety) and GAD3 (Generalized worry), further underscore the dominance of anxiety symptoms in the overall network. Betweenness centrality results highlighted GAD1 (Nervousness or anxiety) and GAD2 (Uncontrollable worry) as critical bridge nodes facilitating information flow between different symptoms, while CESD3 (Feeling depressed) demonstrated a bridging role across modules. Weighted analyses further confirmed the central importance of GAD2 (Uncontrollable worry) and GAD4 (Trouble relaxing). Additionally, the analysis showed gender differences in the depression-anxiety networks of elderly individuals living alone.<h4>Conclusion</h4>This study, through network analysis, uncovered the complex relationships between depression and anxiety symptoms among elderly individuals living alone, identifying GAD2 (Uncontrollable worry) and GAD4 (Trouble relaxing) as core symptoms. These findings provide essential insights for targeted interventions. Future research should explore intervention strategies for these symptoms to improve the mental health of elderly individuals living alone.",Chang Z; Zhang Y; Liang X; Chen Y; Guo C; Chi X; Wang L; Wang X; Chen H; Zhang Z; Liu L; Miao L; Zhang Y,"Xiyuan Hospital of China Academy of Traditional Chinese Medicine, Beijing, 100091, China.",BMC psychiatry,2025-01-08,10.1186/s12888-024-06443-2,3.0,visualization(abstract); visual(abstract); data(abstract),Depression And Anxiety; Network Analysis; Elderly Living Alone; Core Symptoms
39786447,Reduction of ischemic time using the pull-through technique for scapular free flap.,"<h4>Purpose</h4>Current scapular free flap (SFF) harvest in mandibular reconstruction often requires repositioning, hindering simultaneous harvest and resection and potentially increasing ischemic time. This study evaluated the efficacy of the pull-through technique (PTT) for SFF harvest, aiming to reduce ischemic time during mandibular segmental resection.<h4>Methods</h4>A retrospective analysis was conducted on 24 patients who underwent mandibular reconstruction using SFF at two maxillofacial surgery departments between January 2015 and May 2022. In total, 13 patients received PTT, while the remaining 11 underwent non-PTT. Demographic and clinical data were collected, including age, sex, diagnosis, resected mandibular segments, operative time, and ischemic time. Statistical analysis was performed to compare these variables between the PTT and non-PTT groups.<h4>Results</h4>The study found no significant differences between the groups in terms of age, sex, diagnosis, number of resected segments, or total operative time. However, ischemic time was significantly shorter in the PTT group than in the non-PTT group. PTT also allowed for minimal position changes during surgery compared with non-PTT.<h4>Conclusion</h4>Our study investigated the impact of the PTT on SFF reconstruction during mandibular segmental resection. We found that utilizing PTT-SFF significantly reduced ischemic time compared with the traditional method. This technique offers a potential advantage by facilitating stable blood flow visualization and potentially improving flap viability.<h4>Clinical trial number</h4>Not applicable.",Ohyama Y; Hasegawa K; Uzawa N; Sawada T; Sano M; Yamashiro M; Michi Y; Inaba Y; Myo K; Iwasaki T; Terauchi M; Yoda T,"Department of Oral and Maxillofacial Surgery, Shizuoka City Shizuoka Hospital, 10-93, Outemachi, Aoi-ku, Shizuoka-shi, Shizuoka, 420-8690, Japan. yohyama1219@gmail.com.",Oral and maxillofacial surgery,2025-01-09,10.1007/s10006-024-01323-1,3.0,visualization(abstract); visual(abstract); data(abstract),Mandibular Reconstruction; Pull-through Technique; Ischemic Time; Scapular Free Flap
39775539,A Domain Adaptive Interpretable Substructure-Aware Graph Attention Network for Drug-Drug Interaction Prediction.,"Accurate prediction of drug-drug interaction (DDI) is essential to improve clinical efficacy, avoid adverse effects of drug combination therapy, and enhance drug safety. Recently researchers have developed several computer-aided methods for DDI prediction. However, these methods lack the substructural features that are critical to drug interactions and are not effective in generalizing across domains and different distribution data. In this work, we present SAGAN, a domain adaptive interpretable substructure-aware graph attention network for DDI prediction. Based on attention mechanism and unsupervised clustering algorithm, we propose a new substructure segmentation method, which segments the drug molecule into multiple substructures, learns the mechanism of drug interaction from the perspective of interaction, and identifies important interaction regions between drugs. To enhance the generalization ability of the model, we improve and apply a conditional domain adversarial network to achieve cross-domain generalization by alternately optimizing the cross-entropy loss on the source domain and the adversarial loss of the domain discriminator. We evaluate and compare SAGAN with the state-of-the-art DDI prediction model on four real-world datasets for both in-domain and cross-domain scenarios, and show that SAGAN achieves the best overall performance. Moreover, the visualization results of the model show that SAGAN has achieved pharmacologically significant substructure extraction, which can help drug developers screen for some undiscovered local interaction sites, and provide important information for further drug structure optimization. The codes and datasets are available online at https://github.com/wyx2012/SAGAN .",Zhang Q; Wei Y; Liu L,"College of Science, Dalian Jiaotong University, Dalian, 116028, China.","Interdisciplinary sciences, computational life sciences",2025-01-07,10.1007/s12539-024-00680-5,3.0,visualization(abstract); visual(abstract); data(abstract),Drug–drug Interaction; Graph Neural Network; Substructure Extraction; Conditional Domain Adversarial Network
39779740,Biopsy location and tumor-associated macrophages in predicting malignant glioma recurrence using an in-silico model.,"Predicting the biological behavior and time to recurrence (TTR) of high-grade diffuse gliomas (HGG) after maximum safe neurosurgical resection and combined radiation and chemotherapy plays a pivotal role in planning clinical follow-up, selecting potentially necessary second-line treatment and improving the quality of life for patients diagnosed with a malignant brain tumor. The current standard-of-care (SoC) for HGG includes follow-up neuroradiological imaging to detect recurrence as early as possible and relies on several clinical, neuropathological, and radiological prognostic factors, which have limited accuracy in predicting TTR. In this study, using an in-silico analysis, we aim to improve predictive power for TTR by considering the role of (i) prognostically relevant information available through diagnostics used in the current SoC, (ii) advanced image-based information not currently part of the standard diagnostic workup, such as tumor-normal tissue interface (edge) features and quantitative data specific to biopsy positions within the tumor, and (iii) information on tumor-associated macrophages. In particular, we introduced a state-of-the-art spatio-temporal model of tumor-immune interactions, emphasizing the interplay between macrophages and glioma cells. This model serves as a synthetic reality for assessing the predictive value of various features. We generated a cohort of virtual patients based on our mathematical model. Each patient's dataset includes simulated T1Gd and Fluid-attenuated inversion recovery (FLAIR) MRI volumes. T1-weighted imaging highlights anatomical structures with high contrast, providing clear detail on brain morphology, whereas FLAIR suppresses fluid signals, improving the visualization of lesions near fluid-filled spaces, which is particularly helpful for identifying peritumoral edema. Additionally, we simulated results on macrophage density and proliferative activity, either in a specified part of the tumor, namely the tumor core or edge (""localized""), or unspecified (""non-localized""). To enhance the realism of our synthetic data, we imposed different levels of noise. Our findings reveal that macrophage density at the tumor edge contributed to a high predictive value of feature importance for the selected regression model. Moreover, there are lower MSE values for the ""localized"" biopsy in prediction accuracy toward recurrence post-resection compared with ""non-localized"" specimens in the noisy data. In conclusion, the results show that localized biopsies provided more information about tumor behavior, especially at the interface of tumor and normal tissue (Edge).",Shojaee P; Weinholtz E; Schaadt NS; Feuerhake F; Hatzikirou H,"Center for Interdisciplinary Digital Sciences (CIDS), Department Information Services and High-Performance Computing (ZIH), Dresden University of Technology, 01062, Dresden, Germany.",NPJ systems biology and applications,2025-01-08,10.1038/s41540-024-00478-7,3.0,visualization(abstract); visual(abstract); data(abstract),
39788629,"The ""Outline Sign"": Thin Hyperenhancing Perimeter as an MR Imaging Feature of Meningioma. A Useful Tool in the Temporal Bone Region for Differentiating Meningiomas from Schwannomas and Paragangliomas.","<h4>Background and purpose</h4>This study investigates the practicality and utility of the ""outline sign,"" which refers to the thin curvilinear hyperenhancing line that may be seen along the margin of a meningioma on a spin-echo postcontrast T1-weighted image. For cases in which the differential diagnosis may include other tumors, visualization of the outline sign may help to increase the diagnostic confidence for a meningioma. Therefore, in the temporal bone region such as the cerebellopontine angle or jugular foramen, where differential considerations may include a schwannoma or paraganglioma, we additionally investigated whether the outline sign may be observed in these nonmeningioma lesions.<h4>Materials and methods</h4>A total of 39 clinical MRIs of meningiomas, schwannomas, and paragangliomas with confirmed histopathologic data were studied retrospectively. Two experienced head and neck radiologists independently assessed for the presence or absence of an outline sign and subsequently formed a consensus opinion while blinded to patient information and histopathologic data. Interreader reliability was assessed by Cohen κ statistics. Simple bivariate comparisons were performed on the consensus opinions to assess for statistical differences in presence of the sign in meningiomas versus schwannomas and paragangliomas. Sensitivity, specificity, and accuracy of the sign with respect to identifying an underlying meningioma were calculated.<h4>Results</h4>Both readers displayed identical opinions in assessment of the outline sign in 34 of the 39 cases (87%), including 13 of the 14 meningiomas (93%), with substantial agreement (Cohen κ of 0.74). The outline sign was present in 12 of 14 meningiomas (86%), which was significantly greater in frequency compared with schwannomas (3 of 22, 14%) and paragangliomas (1 of 3, 33%). The outline sign demonstrated high sensitivity (86%), specificity (84%), and accuracy (85%) in identifying an underlying meningioma.<h4>Conclusions</h4>The outline sign can serve as a useful tool for diagnosing meningiomas. It may help distinguish meningiomas from other enhancing tumors, for example schwannomas and paragangliomas in the temporal bone region.",Vasireddi AK; Reinshagen KL; Shin D; Romo LV; Juliano AF,"From the Department of Radiology (A.K.V., D.S.), Massachusetts General Hospital, Harvard Medical School, Boston, Massachusetts.",AJNR. American journal of neuroradiology,2025-01-09,10.3174/ajnr.a8452,3.0,visualization(abstract); visual(abstract); data(abstract),
39774782,Multi-dimensional scaling for space-time transformation to achieve sustainable planning and management of water resource under changing land use pattern.,"The land use transition plays an important role for terrestrial environmental services, which had a mixed impact of positive and negative on the groundwater and terrestrial water resource. The health of ecological systems and groundwater depends on the mapping and management of land use. The Ganga basin is one of the most densely populated and agriculture-intensive river systems in the South Asia and the world. The multi-temporal spatial database includes land use (ESA-CCI), satellite-based gravity anomaly (GRACE/GRACE-FO), and well log (CGWB) adopted in this study for assessment of the impact of land use transition on groundwater depth, groundwater drought, and terrestrial water storage. The methodology includes the computation of land use transition, trend magnitude by Sen's slope, Innovative Trend Analysis (ITA) for graphical visualization, clustering techniques employ to identify pattern & structure, and finally space-time transformation was assessed based on multi-dimensional scaling using Alternating Least Squares Scaling (ALSCAL). The land use transition over two decades shows an increase in forest (2.23%), wetland (2.2%), settlement (208.4%), bare area (3.18%), water (5.18%), and a decrease in agriculture (-1.16%), grassland (-4.5%), & vegetation (-2.8%). The non-parametric climatological trend of groundwater depth, drought, and terrestrial water loss was maximally observed during the post-monsoon season in the Ganga basin. The seasonal climatological trend statistics shows that, the upper Ganga and northern (left) of the Ganga basin shows an alarming rate of groundwater depletion, with increased in the severity of groundwater drought in near future with the loss in terrestrial water storage. The ITA shows the monotonic decreasing trend depicting loss of groundwater and terrestrial water resources. Bi-dimensional regression, ALSCAL shows that the model is efficient based on the input data having stress value and RSQ (proportion of variance) of 0.09 and 0.97 with excellent linear fit. The impact assessment of land use transition was obtained in low dimensional space showing that the conversion from sparse vegetation, agriculture, grassland, wetland and forest to settlement has the maximum impact on groundwater and TWSA loss, although the persistent settlement area is also responsible. The results are extremely useful for the policymakers, scientists, concern Govt. section, and local communities must work together to manage groundwater sustainably. Water resource management can also help to lessen the effects of climate change on groundwater and terrestrial water loss by focusing on the environmental, economic, social, and institutional dimensions of UN-SDG.",Ul Hasan MS; Rai AK; Momin AH; Khan MA; Alfaisal FM; Alam S; Al-Sareji OJ; Majdi A,"Centre for Ocean, River, Atmosphere and Land Sciences (CORAL), Indian Institute of Technology Kharagpur, Kharagpur, West Bengal, 721302, India.",Scientific reports,2025-01-07,10.1038/s41598-024-82207-y,3.0,visualization(abstract); visual(abstract); data(abstract),GIS; UPGMA; Multi-dimensional Scaling; Innovative Trend Analysis; Alscal
39781627,Presence of Fragmented Intratumoral Thrombosed Microvasculature in the Necrotic and Peri-Necrotic Regions on SWI Differentiates IDH Wild-Type Glioblastoma From IDH Mutant Grade 4 Astrocytoma.,"<h4>Background</h4>Isocitrate dehydrogenase (IDH) wild-type (IDH<sub>wt</sub>) glioblastomas (GB) are more aggressive and have a poorer prognosis than IDH mutant (IDH<sub>mt</sub>) tumors, emphasizing the need for accurate preoperative differentiation. However, a distinct imaging biomarker for differentiation mostly lacking. Intratumoral thrombosis has been reported as a histopathological biomarker for GB.<h4>Purpose</h4>To evaluate the fragmented intratumoral thrombosed microvasculature (FTV) signs on susceptibility-weighted imaging (SWI) for distinguishing IDH<sub>wt</sub> and IDH<sub>mt</sub> tumors.<h4>Study type</h4>Retrospective.<h4>Subjects</h4>Ninety-seven treatment-naïve patients with histopathologically confirmed IDH<sub>wt</sub> GB (54 males, 26 females) and IDH<sub>mt</sub> grade 4 astrocytoma (13 males, 4 females).<h4>Field strength/sequence</h4>3-T, SWI, fluid-attenuated-inversion-recovery (FLAIR), T<sub>1</sub>-weighted, T<sub>2</sub>-weighted, PD-weighted, post-contrast T<sub>1</sub>-weighted and dynamic-contrast-enhanced (DCE)-MRI.<h4>Assessment</h4>SWI data were evaluated by three experienced neuroradiologists (S.S., 11 years; J.S., 15 years; R.K.G., 40 years of experience), who assessed FTV presence in necrotic and peri-necrotic regions. FTV was identified as intratumoral susceptibility signal having minimal or no interslice connections. Quantitative DCE-MRI parameters were derived using first-pass-analysis and extended Tofts model. FLAIR abnormal, contrast-enhancing, and necrotic regions were segmented using in-house developed U-Net architecture.<h4>Statistical tests</h4>Fleiss' Kappa, Cohen's Kappa, Shapiro-Wilk test, t tests or Mann-Whitney U test, receiver-operating characteristic (ROC) analysis, confusion matrix. A P-value <0.05 was considered statistically significant.<h4>Results</h4>Fleiss' kappa test provided 91% inter-rater agreement, and Cohen's kappa provided intrarater agreement ranged from 81% to 97%. The raters' accuracy in distinguishing IDH<sub>wt</sub> from IDH<sub>mt</sub> ranged from 92% to 94%. Some of the quantitative DCE-MRI parameters (CBV, Ve, and K<sup>trans</sup>) provided statistically significant differences in differentiating IDH<sub>wt</sub> and IDH<sub>mt</sub>. K<sup>trans</sup> demonstrated 80.3% sensitivity and 81.2% specificity, with ROC analysis showing an AUC of 0.77.<h4>Data conclusion</h4>FTV signs in necrotic and peri-necrotic regions on SWI demonstrated a high accuracy in distinguishing IDH<sub>wt</sub> from IDH<sub>mt</sub>. Qualitative assessment of FTV signs showed almost perfect inter-rater and intrarater agreement. Quantitative DCE-MRI metrics also showed statistically significant differentiation of IDH<sub>wt</sub> and IDH<sub>mt</sub>.<h4>Plain language summary</h4>This study demonstrates that preoperative imaging, particularly the visualization of the fragmented thrombosed vasculature (FTV) sign on susceptibility-weighted imaging (SWI), effectively differentiates isocitrate dehydrogenase (IDH) wild-type (IDH<sub>wt</sub>) glioblastoma (GB) from IDH mutant (IDH<sub>mt</sub>) grade 4 astrocytomas. Over 90% of IDH<sub>wt</sub> GB patients displayed the FTV sign, a specific imaging biomarker absent in IDH<sub>mt</sub> cases. Perfusion parameters such as cerebral blood volume, Ve, and K<sup>trans</sup> were elevated in IDH<sub>wt</sub> gliomas, reflecting distinct vascular profiles. SWI offers a noninvasive and accurate diagnostic method, overcoming limitations of histopathology. Despite limitations like unequal sample sizes and retrospective analysis, this study underscores the clinical potential of SWI in improving glioma characterization and aiding treatment planning.<h4>Level of evidence</h4>4 TECHNICAL EFFICACY: Stage 2.",Yadav VK; Sharma S; Maurya S; Singh RK; Saini J; Jain P; Patir R; Ahlawat S; Das S; Vaishya S; Agarwal S; Singh A; Gupta RK,"Centre for Biomedical Engineering, Indian Institute of Technology Delhi, New Delhi, India.",Journal of magnetic resonance imaging : JMRI,2025-01-09,10.1002/jmri.29695,3.0,visualization(abstract); visual(abstract); data(abstract),Glioblastomas; Imaging Biomarker; Tumor Classification; Dynamic Contrast‐enhanced Mri; Susceptibility‐weighted Imaging
39774098,Trochlear Nerve Decompression by Endoscopic Suboccipital Supracerebellar Infratentorial Approach: A Technical Note: 2-Dimensional Operative Video.,"<h4>Background and importance</h4>Superior oblique myokymia (SOM) is a rare, acquired aberration of the innervation of the superior oblique, resulting in episodic monocular contraction of the superior oblique muscle characterized by intermittent rotatory eye movement causing diplopia and oscillopsia. Several treatment modalities have been described to treat SOM, including medication and surgical interventions. There is a paucity of reports describing microvascular decompression (MVD) of the trochlear nerve near the root entry zone for the treatment of a neurovascular conflict. The authors describe a case report of a patient who presented with SOM by a supracerebellar infratentorial approach using microscopic and endoscopic visualization.<h4>Clinical presentation</h4>A 40-year-old woman presented with an 8-month history of rhythmic contractions of her right orbit with worsening double vision and occasional balance issues. Neuro-ophthalmological evaluation which revealed a right-sided SOM. MRI evaluation demonstrated a potential vascular compression by the superior cerebellar artery near the origin of the trochlear nerve. She underwent MVD by a supracerebellar infratentorial approach using microscopic and endoscopic visualization. The patient experienced resolution of her SOM in the immediate postoperative period and a Trochlear nerve palsy that resolved within 6 months.<h4>Conclusion</h4>The endoscopic supracerebellar infratentorial approach for MVD of the trochlear nerve is a safe and efficacious approach that provides superior visualization of the trochlear nerve at its origin and in the setting of SOM. This approach shows outcomes comparable with those used in previously described cases.",Vignolles-Jeong J; Finger G; Damante M; Weber MD; Wu KC; Prevedello DM,"College of Medicine, The Ohio State University, Columbus, Ohio, USA.","Operative neurosurgery (Hagerstown, Md.)",2025-01-08,10.1227/ons.0000000000001494,2.5,visualization(abstract); visual(abstract),
39773400,Nuances of the Minimally Invasive Transforaminal Lumbar Interbody Fusion: A Technical Review.,"<h4>Background</h4>Transforaminal lumbar interbody fusion (TLIF) achieves anterior and posterior spinal arthrodesis through a single approach. Minimally invasive surgery (MIS) methods reduce surgical morbidity while achieving positive outcomes.<h4>Methods</h4>The major MIS-TLIF techniques, from tubular to endoscopic approaches, are reviewed with a discussion on the incorporation of new technologies and a comparative review of their outcomes.<h4>Results</h4>MIS-TLIF approaches span a spectrum of visualization methods, with technical nuances related to patient and surgeon-specific factors determining optimal fit. To date, the superiority of 1 technique has yet to be definitively determined. Existing techniques may be integrated in a personalized manner to optimize surgical utility.<h4>Conclusions</h4>Selection of an MIS-TLIF modality relies on a calculus between patient characteristics and surgeon faculty; proper selection can offer significant benefits to patients with spine disease.<h4>Clinical relevance</h4>Emerging technologies for MIS-TLIF comprise a major source of development and clinical translation, while the safe and effective use of these techniques promises greater patient benefit in the right populations.",Vyas DB; Park BJ; Wang MY,"Department of Neurosurgery, Miller School of Medicine, University of Miami, Miami, FL, USA.",International journal of spine surgery,2025-01-07,10.14444/8713,2.5,visualization(abstract); visual(abstract),Endoscopy; Tlif (Transforaminal Lumbar Interbody Fusion); Mis (Minimally Invasive Surgery)
