pmid,title,abstract,authors,first_author_affiliation,journal,pub_date,doi,score,matched_keywords,api_keywords
41586915,Efficacy of intraoperative indocyanine green videoangiography (ICG-VA) and FLOW 800 in the surgical management of intracranial aneurysms: a systematic review and meta-analysis.,"<h4>Background</h4>Intraoperative assessment of aneurysm clipping remains technically challenging, particularly in identifying misclippings, aneurysmal remnants, and vessel compromise. Indocyanine green videoangiography (ICG-VA) provides real-time visualization but lacks hemodynamic quantification. FLOW 800 is a semi quantitative analysis tool that enhances blood flow evaluation. This meta-analysis aims to evaluate the combined diagnostic efficacy of ICG-VA and FLOW 800 in intracranial aneurysm surgery, focusing on intraoperative outcomes.<h4>Methods</h4>A systematic review was conducted in five databases (PubMed, Embase, Scopus, Web of Science, CENTRAL). The protocol was registered in PROSPERO (CRD420251014600). Twelve studies were included in the qualitative synthesis (344 aneurysms), of which eight contributed quantitative data to the meta-analysis (277 aneurysms). Pooled proportions of misclipping, aneurysmal remnant, vascular stenosis/occlusion, and clip repositioning were calculated using a random-effects model. Subgroup analyses, meta-regression, leave-one-out sensitivity analysis, and assessment of publication bias (funnel plot) were performed. Risk of bias was assessed using the QUADAS-2 tool.<h4>Results</h4>The pooled intraoperative detection rates using ICG-VA and FLOW 800 were: misclipping 9.36% (95% CI: 4.75-17.64), aneurysm remnant 6.55% (95% CI: 3.29-12.65), vessel stenosis or occlusion 6.90% (95% CI: 3.28-13.96), and clip repositioning 8.13% (95% CI: 4.05-15.63). Retrospective studies showed higher detection rates than prospective ones. Meta-regression identified study design as a significant predictor for all outcomes (p < 0.0001), while older patient age was associated with increased remnant detection (p = 0.0247) and clip repositioning (p = 0.0073). Funnel plots revealed slight asymmetry, and GRADE evaluation indicated moderate certainty for misclipping and clip repositioning, and low certainty for remnants and stenosis.<h4>Conclusions</h4>The combined use of ICG-VA and FLOW 800 enhances the intraoperative detection of misclipping, residual aneurysm, and flow disturbances not evident with ICG-VA alone. These findings support its role as a complementary intraoperative tool. However, due to limited validation against angiographic standards, it should not replace DSA. Further prospective studies are warranted to confirm its clinical utility and encourage broader adoption in neurosurgical practice.",Turpo-Pequeña AG; Santos-Vargas SA; Loza-Chipa HR; Lamas FM; Espinoza-Laura GA; Núñez-Basurco CS; Medina-Neira DN; Benites-Bustamante VA; Osorio-Pacheco RR; Turpo-Peqqueña JR; Huanca-Quispe G; Vizcarra-Vizcarra CA; Gómez B; Rivillas JA; Hernández-Mayori R,"Faculty of Human Medicine, Center for Research and Medical Studies (CIEM), Universidad Católica de Santa María, Arequipa, Perú. albert.turpo@estudiante.ucsm.edu.pe.",Acta neurochirurgica,2026-01-26,10.1007/s00701-026-06779-6,3.0,visualization(abstract); visual(abstract); data(abstract),Intracranial aneurysm; Indocyanine green; Intraoperative Imaging; Flow 800
41588820,Dual-Window Broadband Near-Infrared Mechanoluminescence in MgO-Based Phosphors.,"Near-infrared (NIR) mechanoluminescence (ML) offers a self-powered and non-invasive route for stress visualization and biomechanical imaging, yet most NIR ML materials remain constrained by narrow emission bandwidths and reliance on dark-field conditions. Here, we report two complementary MgO-based ML systems spanning the NIR-I and NIR-II windows, establishing MgO as a robust platform for broadband mechanoresponsive emission. MgO:Cr<sup>3+</sup> delivers tunable NIR-I ML (700-1000 nm; full width at half maximum, FWHM, 94-188 nm) under diverse mechanical stimuli, including friction, impact, tension, compression, bending, and twisting, while MgO:Ni<sup>2+</sup> produces ultrabroadband NIR-II ML (1000-1700 nm; FWHM 225 nm) readily detectable under ambient lighting. Mechanistic studies reveal that ML arises from the synergistic interplay of local piezoelectric polarization, dislocation-mediated charge separation, and triboelectric effects at organic-inorganic interfaces, whereas the observed spectral variations stem from crystal-field modulation and lattice distortions. Co-doping of Cr<sup>3+</sup> and Ni<sup>2+</sup> further differentiates optical and mechanical excitation pathways-optical excitation induces Cr<sup>3+</sup>-sensitized Ni<sup>2+</sup> emission, whereas mechanical excitation directly activates their low-lying levels. These insights unify mechano-to-photon conversion in centrosymmetric oxides and provide design principles for broadband, durable, and environmentally adaptive ML materials, advancing applications in multimodal sensing, structural health monitoring, and noninvasive biomechanical imaging.",Cai Y; Chang J; Zhang J; Liu J; Wang S; Wu M; Zhang JC,"College of Physics and Optoelectronic Engineering, Faculty of Information Science and Engineering, Ocean University of China, Qingdao, China.","Advanced materials (Deerfield Beach, Fla.)",2026-01-26,10.1002/adma.202522739,2.5,visualization(abstract); visual(abstract),Biomechanical Imaging; Broadband Emission; Mgo Phosphor; Multiple Mechanical Sensing; Near‐infrared Mechanoluminescence
41587227,"Central Neuromuscular Reactivation Using Digital Mindfulness and Motor Imagery Intervention for Chronic Knee Pain in Patients With Obesity: Prospective, Single-Center Study.","<h4>Background</h4>Chronic musculoskeletal pain, particularly in patients with obesity, poses significant challenges due to increased pain sensitivity, reduced mobility, and systemic inflammation. Obesity aggravates mechanical constraints on the joints and increases systemic inflammation, exacerbating certain medical conditions and making conventional therapeutic approaches less likely to succeed. Conventional therapies often show limited efficacy, necessitating innovative approaches.<h4>Objective</h4>This pilot study evaluated the short-term effectiveness of a mindfulness and motor imagery-based intervention delivered via an app (SAS YUZIT), on the pain, functionality, and quality of life of patients with obesity and chronic knee pain.<h4>Methods</h4>A prospective, single-center study was conducted over 1 month by including 30 patients (BMI >30 kg/m2) experiencing chronic knee pain (≥3 months) who did not need surgery. Patients underwent two video-guided motor imagery sessions, focusing on neuromuscular reactivation. Functional scores, including the Single Assessment Numeric Evaluation (SANE) score, Knee Injury and Osteoarthritis Outcome Score (KOOS), and 36-Item Short Form Health Survey (SF-36) score, were assessed before and after intervention. Paired t tests were used to analyze score improvements, with P<.05 deemed significant.<h4>Results</h4>Significant improvements were observed across all parameters. The mean overall SANE score improved by 51% (P<.001). The minimal clinically important difference was therefore approximately 6.7 points. The observed mean improvement (25 points) exceeded this threshold by more than threefold, indicating a clinically meaningful improvement in functional status. The mean (SD) KOOS score increased by 56% (P<.001) from 40.89 (16.7) to 63.79 (14.6). The mean (SD) SF-36 scores showed substantial enhancements in both physical (from 39.7 [20.8] to 65.9 [18.8]; +66%; P<.001) and mental components (from 47.2 [23.1] to 64 [21]; +36%; P<.001). Patient satisfaction with this method was rated 4.5/5, and no adverse effects were reported.<h4>Conclusions</h4>Video-guided motor imagery demonstrated significant efficacy in reducing pain and improving the functionality and quality of life of patients with obesity and chronic knee pain. By targeting central neuromuscular circuits through guided visualization exercises, this non-invasive intervention addresses central activation dysfunction, a proposed novel concept in neuromuscular disorders that originates from hypotheses derived from clinical observations. This interesting concept requires further exploration to ensure its neurophysiological validation through future studies with larger sample sizes, control groups, and long-term follow-ups, all of which could explore CAD as a therapeutic target.",Murgier J; Garet B; Murgier S; Zunzarren G,"Aguilera Private Clinic, Rue de l'estagnas, Biarritz, 64100, France, +33 0973032124.",JMIR formative research,2026-01-26,10.2196/82270,2.5,visualization(abstract); visual(abstract),Obesity; Motor imagery; Knee Pain; Digital Mindfulness; Central Neuromuscular Reactivation
41586987,CT-based deep learning signatures associated with transcriptomic heterogeneity and combined with nutritional biomarkers improve prediction of 3-year overall survival in esophageal squamous cell carcinoma.,"<h4>Objective</h4>Deep learning signatures (DLS) extracted from CT images can noninvasively reflect tumor heterogeneity and have shown promise in prognostic modeling for esophageal squamous cell carcinoma (ESCC). To develop and validate a CT-based DL model combined with nutritional biomarkers to predict 3-year overall survival (OS) in ESCC, and to investigate transcriptomic differences between DLS-based risk groups.<h4>Materials and methods</h4>This retrospective multicenter study included 662 postoperative ESCC patients from three hospitals and 16 additional patients from The Cancer Genome Atlas (TCGA). DL features extraction from CT images based on the Crossformer architecture. Skeletal muscle index was measured at the L3 vertebra to assess low skeletal muscle mass (LSMM). Cox regression was used to build clinical, DL, and combined models. Model performance was evaluated using the concordance index (C-index). Transcriptomic analysis of the TCGA cohort was performed to identify metabolic pathway differences between DLS-based risk groups.<h4>Results</h4>The DL model achieved a C-index of 0.743 (95% CI: 0.683-0.803) in the internal validation cohort and 0.692 (95% CI: 0.576-0.809) in the external cohort. Pathological T and N stages, Neuroaggression, Vascular invasion, and LSMM were identified as independent clinical predictors. The combined model achieved a C-index of 0.753 (95% CI: 0.697-0.808) internally and 0.725 (95% CI: 0.613-0.838) externally. DLS-based risk stratification revealed significant differences in metabolic activity between groups, supporting its biological relevance.<h4>Conclusion</h4>The combined model enables preoperative OS prediction in ESCC. DLS-based stratification reflects transcriptomic metabolic heterogeneity and enhances the biological interpretability of imaging features.<h4>Critical relevance statement</h4>This study developed a CT-based DLS and combined it with nutritional markers for prognostic modeling in ESCC. Transcriptomic analysis of DLS-based groups revealed metabolic heterogeneity, enhancing the biological interpretability of the DL model.<h4>Key points</h4>A combined DLS and nutritional model enables individualized preoperative survival prediction in ESCC. DLS-based risk groups defined by the DLS exhibited transcriptomic differences in key metabolic pathways, revealing biological underpinnings of imaging-based phenotypes. Attention map visualization revealed consistent spatial focus on morphologically distinct tumor regions, enhancing the interpretability of deep learning predictions.",Jia J; Cheng Y; Wang J; Bai G; Han L; Xu L; Niu Y,"Department of Radiology, Beijing Friendship Hospital, Capital Medical University, Beijing, China.",Insights into imaging,2026-01-26,10.1186/s13244-025-02189-x,2.5,visualization(abstract); visual(abstract),esophageal squamous cell carcinoma; Tumor Microenvironment; Overall Survival; Deep Learning; Enhanced-Ct
41604719,Preclinical magnetic resonance imaging in the presence of Alpha-DaRT seeds: mitigation of metal artifacts. ,"Diffusing alpha-emitters radiation therapy (Alpha-DaRT) involves implanting stainless steel seeds containing 70-200 kBq of224Ra into solid tumors. The decay of224Ra generates alpha particles and short-lived alpha-emitting atoms, which diffuse and deposit absorbed dose up to millimeters from the seed. The investigation of diffusion length from the alpha-emitting daughters is ongoing through magnetic resonance imaging (MRI)-guided pre-clinicalin-vivostudies. However, the metallic seeds cause metal artifacts in MRI, distorting signals and degrading images. Overcoming these artifacts is essential for accurate tumor assessment and treatment planning. This study aimed to reduce metal artifacts in images acquired with 7 T preclinical MRI in the presence of Alpha-DaRT seeds using an orthotopic colorectal adenocarcinoma animal model.&#xD;Approach: Inert seeds were placed in gelatin phantoms and the dorsal cavity of a mouse carcass. For thein-vivoanimal model, NOD scid gamma mice with HT-29 colorectal adenocarcinoma tumors (∽5-7 mm) were injected with inert seeds. MRI sequence parameters such as echo and repetition times, slice thickness, and readout bandwidth were tested using the phantom and refined with carcass imaging, leading toin-vivoimaging.&#xD;Main results: Multiple sequence protocols were tested on gelatin phantoms and compared to the original T2w rapid acquisition relaxation enhanced sequence protocol. A T2-weighted turbo spin echo sequence reduced metal artifacts in the gelatin phantom from 2.910 ± 0.001 mm to 1.426 ± 0.001 mm in the sagittal reformat, resulting in a 51% reduction. Validation in the mouse carcass confirmed high-quality soft-tissue imaging.In-vivoimages with live mice showed a statistically significant reduction (p<0.05) in metal artifact volume with the optimized sequence.&#xD;Significance: A T2-weighted turbo spin echo protocol effectively minimized metal artifacts from Alpha-DaRT seeds in a colorectal adenocarcinoma animal model, allowing for clearer visualization of seed placement within the tumor and improving the accuracy of pre-clinical studies.",Cyr M; Rudko D; Behmand B; Enger SA; Levesque IR,"Department of Oncology, McGill University Faculty of Medicine, 845 Sherbrooke Street W, Montreal, Quebec, H3A0G4, CANADA.",Biomedical physics & engineering express,2026-01-28,10.1088/2057-1976/ae3e9e,2.5,visualization(abstract); visual(abstract),
41588632,MRI Analysis of the Axial Plane Orientation of the Achilles Tendon: Implications for Level-Specific Percutaneous Repair Trajectories.,"<h4>Background</h4>Percutaneous Achilles tendon repair has become increasingly favored because of its lower rate of wound complications compared with open techniques. However, its success rates are limited and rely on precise tendon capture, which can be challenging because of limited intraoperative visualization. Previous clinical and cadaveric studies have reported frequent cases of incomplete or eccentric suture placement with this approach. Although not the only factor in improving the results of percutaneous Achilles repair, understanding the positional anatomy of the Achilles could be helpful in improving capture of the tendon. This study aimed to characterize the level-dependent axial orientation of the distal Achilles tendon using magnetic resonance imaging (MRI), focusing on levels relevant to percutaneous needle passage to improve the accuracy of repair.<h4>Methods</h4>A retrospective review of MRI scans from 82 individuals without Achilles pathology was performed. The axial orientation of the tendon was measured at 3, 5, 7, 9, and 11 cm proximal to its calcaneal insertion, relative to both the transmalleolar (TM) axis and the insertional tendon axis. Tendon width was also measured at each level. All measurements were performed using multiplanar reconstructed images, and differences across levels were analyzed using a linear mixed effects model with Bonferroni correction for multiple comparisons. A separate age-matched cohort of patients with acute Achilles rupture (n = 82) was also analyzed to compare orientation patterns between normal and ruptured tendons.<h4>Results</h4>The Achilles tendon orientation exhibited level-dependent variation in external rotation proximally when measured relative to the TM axis, increasing from 2.1 degrees (95% CI, 0.8-3.4) at 3 cm to a peak of 11.2 degrees at 7 cm (95% CI, 9.3-13.1) and 9 cm (95% CI, 9.6-12.8), with a slight decrease at 11 cm. When referenced to the insertional axis, a transition from internal to external rotation was observed between 5 and 7 cm (Δ = +6.6 degrees, <i>P</i> < .001). The narrowest tendon width was also noted at 5 cm (13.3 mm), with greater width observed both proximally and distally. In the ruptured cohort, the tendon demonstrated a more externally rotated configuration at the rupture zone compared with normal tendons.<h4>Conclusion</h4>The Achilles tendon demonstrates level-dependent variation in axial orientation along its length, with a general tendency toward external rotation at more proximal levels. Although there are currently no established guidelines regarding needle trajectory during percutaneous repair, these findings suggest that a uniform axial needle path may not align with native tendon anatomy at all levels. Adjusting the direction of suture passage based on the specific level of repair may enhance procedural accuracy during percutaneous Achilles repair. Notably, these MRI-based recommendations have not been validated with cadaveric or other biomechanical testing.<h4>Level of evidence</h4>Level III, diagnostic retrospective study.",Kim J; Sacks J; Masry SE; Ward L; Ellis S; Deland J,"Foot and ankle service, Hospital for Special Surgery, New York, NY, USA.",Foot & ankle international,2026-01-26,10.1177/10711007251398000,2.5,visualization(abstract); visual(abstract),MRI; Rotation; Percutaneous; repair; Tendon; Achilles; Minimal Invasive; Axial
