pmid,title,abstract,authors,first_author_affiliation,journal,pub_date,doi,score,matched_keywords,api_keywords
41037765,Interactive Use of Cox Model-Predicted Survival Curves: An Application Using ACS10 Score and Age to Personalize Treatment of Pediatric AML.,"<h4>Purpose</h4>Analyses in oncology frequently include Cox proportional hazards models for survival outcomes, but reported results typically only include hazard ratios and respective inference. Cox model predictions of survival functions may help to provide a greater clinical meaning from fitted Cox models for precision oncology research.<h4>Patients and methods</h4>We created a publicly available software library, shinyCox, that can generate user-friendly interactive applications to visualize survival outcome predictions of fitted Cox models. To illustrate the benefits of this software, we analyzed data from AML02 and AML08, randomized clinical trials for pediatric patients with AML. Building on a recent article, we assessed how baseline factors and a pharmacogenomics score (ACS10) can affect the predicted overall survival (OS) and event-free survival (EFS) between patients assigned to induction regimens of clofarabine plus cytarabine or daunorubicin and etoposide combined with low-dose cytarabine or high-dose cytarabine.<h4>Results</h4>Our model outcome prediction visualization application highlights previously reported associations of ACS10 with EFS and OS, while also providing a better understanding of how other prognostic factors amplify or mitigate prognostic implications of ACS10. It is informative to better understand the practical clinical outcomes in terms of predicted survival probabilities to complement the insights gained from hazard ratio tables.<h4>Conclusion</h4>Using shinyCox, we generated visualization applications that let us identify complex relationships between the ACS10 score, age, and the predicted OS and EFS probabilities after AML therapy. This article shows how shinyCox will facilitate model interpretation and accelerate the development of personalized therapies in oncology.",Selukar S; Clement H; Ni Y; Wu H; Patni T; Seffernick AE; Inaba H; Ribeiro R; Lamba J; Li Y; Pounds S,"Department of Biostatistics, St Jude Children's Research Hospital, Memphis, TN.",JCO precision oncology,2025-10-02,10.1200/po-25-00634,3.0,visualization(abstract); visual(abstract); data(abstract),
41042687,Evaluating the Implementation of Public Health Strategies to Address COVID-19 Disparities in a Community Setting: A Qualitative Study Using the RE-AIM Framework.,"<h4>Background</h4>Health disparities, particularly among racial and ethnic minority populations, were exacerbated by the COVID-19 pandemic due to factors like social determinants of health, vaccine hesitancy, and pre-existing health conditions. Local government leaders within an urban city received federal funds to address these disparities by improving health literacy and engaging in culturally responsive outreach and education among Black and Latinx communities within a mid-sized city in the southeastern United States.<h4>Objective</h4>To identify facilitators and barriers to implementing public health strategies aimed at addressing COVID-19 health disparities in a community guided by the RE-AIM (reach, effectiveness, adoption, implementation, and maintenance) framework.<h4>Design</h4>The research team conducted qualitative, semi-structured interviews via telephone, Zoom, or in person between March 20th and April 12th, 2024.<h4>Participants/setting</h4>Fifteen participants, including local governmental health office staff (e.g., nurse navigators, administrative staff) and employees from community center partner sites, were included in the study.<h4>Analysis</h4>Two coders applied both a priori codes guided by the RE-AIM framework and data-driven inductive codes to transcripts in NVivo 14. A final interrater reliability measurement, Cohen's kappa coefficient (k = 0.74), was calculated, indicating a moderate level of agreement between coders. NVivo 14 data visualization tools (e.g., coding matrices) were used to inform thematic content analysis.<h4>Results</h4>Themes were identified within each RE-AIM dimension, highlighting various facilitators and barriers to implementing the selected public health strategies. Working in synergy with community center staff and other community partners to create tailored services and resources was vital for successful implementation. Transparency and timely communication, additional full-time program implementers (i.e., nurse navigators), and sustainable funding sources were identified as key elements to enhance effective implementation.<h4>Conclusions</h4>Insights from the local governmental health office and community center staff's experiences in this study highlight recommendations for effective implementation of locally tailored public health strategies to address COVID-19 health disparities in similar community-based settings. Future research should capture the perceptions and experiences of community members to better understand acceptability, accessibility, and utilization in similar initiatives.",McElrone M; Holden E; Brown C; Ballew J,"Department of Health and Human Performance, University of Tennessee at Chattanooga, Chattanooga, Tennessee, USA.","Public health nursing (Boston, Mass.)",2025-10-03,10.1111/phn.70021,3.0,visualization(abstract); visual(abstract); data(abstract),
41042484,Initial clinical use of the intraocular endoscope holding robot in pars plana vitrectomy.,"<h4>Purpose</h4>OQrimo<sup>®</sup> is a robotic assistant system that supports vitreoretinal surgery by holding an intraocular endoscope or illumination device to assist the surgeon. In April 2023, Japan approved this system, and as the world's first clinical institution to implement OQrimo<sup>®</sup>, we aimed to evaluate its safety and clinical utility.<h4>Research design</h4>Retrospective case series METHODS: The study analyzed all vitreoretinal surgery utilizing OQrimo<sup>®</sup> at Kyushu University Hospital between December 1, 2023 and November 31, 2024. Data collection included patient demographics, preoperative diagnoses, surgical procedures, equipment used, surgical records, and perioperative complications. We analyzed OQrimo's safety profile and patterns of clinical use based on these data.<h4>Results</h4>Eight eyes from eight patients were included. Preoperative diagnoses included proliferative vitreoretinopathy, panuveitis, acute retinal necrosis, macular hole, and secondary glaucoma due to uveitis. The purpose of pars plana vitrectomy included silicone oil removal, vitreous biopsy, internal limiting membrane peeling, and Ahmed valve implantation via pars plana. OQrimo<sup>®</sup> maintained stable endoscope positioning in all cases, enabling observation of the peripheral retina without scleral indentation. In seven cases, OQrimo's endoscopic visualization and a wide-viewing system were used simultaneously. No intraoperative or postoperative complications were observed in any case.<h4>Conclusion</h4>We confirmed the safety of OQrimo<sup>®</sup> during its initial clinical application. The system facilitated the observation of the peripheral retina using an intraocular endoscope without scleral indentation.",Kiyohara K; Ishikawa K; Yuge K; Yamana S; Nakao S; Sonoda KH,"Department of Ophthalmology, Graduate School of Medical Sciences, Kyushu University, Fukuoka, 812-8582, Japan.",Japanese journal of ophthalmology,2025-10-03,10.1007/s10384-025-01285-1,3.0,visualization(abstract); visual(abstract); data(abstract),Vitrectomy; Robot; Assistant; Intraocular Endoscope; Oqrimo®
41044309,Transfer learning-enhanced CNN model for integrative ultrasound and biomarker-based diagnosis of polycystic ovarian disease.,"Polycystic Ovarian Disease (PCOD), also known as Polycystic Ovary Syndrome (PCOS), is a prevalent hormonal and metabolic condition primarily affecting women of reproductive age worldwide. It is typically marked by disrupted ovulation, an increase in circulating androgen hormones, and the presence of multiple small ovarian follicles, which collectively result in menstrual irregularities, infertility challenges, and associated metabolic disturbances. This study presents an automated diagnostic framework for PCOD detection from transvaginal ultrasound images, leveraging an Enhanced [Formula: see text] convolutional neural network architecture. The model incorporates attention mechanisms, batch normalization, and dropout regularization to improve feature learning and generalization. Bayesian Optimization was employed to fine-tune critical hyperparameters, including learning rate, batch size, and dropout rate, ensuring optimal model performance. The proposed system was trained and validated on a curated ovarian ultrasound image dataset, applying data augmentation and SMOTE techniques to address class imbalance. Experimental evaluation demonstrated that the Enhanced [Formula: see text] model achieved a classification accuracy of 94.8%, sensitivity of 93.2%, specificity of 95.5%, precision of 94.0%, and an F1-score of 93.6% on the independent test set. Interpretability was enhanced through Grad-CAM visualization, which effectively localized diagnostically significant regions within the ultrasound images, corroborating clinical findings. These results highlight the potential of the proposed deep learning-based framework to serve as a reliable, scalable, and interpretable decision-support tool for PCOD diagnosis, offering improved diagnostic consistency and reducing operator dependency in clinical workflows.",Sundari MS; Sailaja NV; Swapna D; Vikkurty S; Jadala VC; Durga K; Thottempudi P,"BVRIT HYDERABAD College of Engineering for Women, Computer Science and Engineering, Hyderabad, 500090, India. sundari.m@bvrithyderabad.edu.in.",Scientific reports,2025-10-03,10.1038/s41598-025-17711-w,3.0,visualization(abstract); visual(abstract); data(abstract),[Formula: See Text]; Polycystic Ovarian Disease (Pcod); Ultrasound Image Classification; Bayesian Hyperparameter Optimization; Deep Learning In Medical Imaging
41028953,Laser Ultrasound Super-Resolution Imaging for Multi-Parametric Non-Invasive Volumetric Characterization of Brain Cancer.,"Accurate characterization of brain tumor heterogeneities and microvascular dynamics remains an unmet need in cancer research driving the development of innovative imaging methods. Here, laser ultrasound super-resolution imaging (LUSSI) is introduced, a hybrid modality combining laser-generated ultrasound with optoacoustic (OA) contrast to enable functional volumetric (3D) super-resolution imaging of vascular structures in vivo. The system integrates a laser ultrasound (LUS) emitter and a spherical array transducer to localize microbubble responses in 3D, further enabling concurrent acquisition of multi-spectral (multi-wavelength) OA data. The capabilities of LUSSI to assess tumor heterogeneities are demonstrated in a murine glioblastoma model, including visualization of intra-tumoral vasculature, identification of compressed vessels, and detection of functional abnormalities such as hemorrhages and hypoxic regions. OA imaging further enables resolving oxygenated and deoxygenated forms of hemoglobin, revealing heterogeneous perfusion within the tumor core. LUSSI is further shown to resolve whole-brain vascular networks with ≈35 µm resolution and quantify microvascular blood flow and oxygenation, supporting applications in neuroscience. With its non-invasive, multi-parametric capabilities and proven compatibility with clinical imaging components, LUSSI offers a promising platform for studying vascular pathology, monitoring therapy, and advancing translational imaging strategies.",Nozdriukhin D; Chen Y; Lyu S; Razansky D; Deán-Ben XL,"Institute for Biomedical Engineering and Institute of Pharmacology and Toxicology, Faculty of Medicine, University of Zürich, Winterthurerstrasse 190, Zurich, 8057, Switzerland.","Advanced science (Weinheim, Baden-Wurttemberg, Germany)",2025-09-30,10.1002/advs.202502298,3.0,visualization(abstract); visual(abstract); data(abstract),Glioblastoma; Microbubbles; Optoacoustic Imaging; Laser Ultrasound Imaging
41023480,The value of contrast-enhanced MRI in the selection of surgical approaches for recurrent lumbar disc herniation in full-endoscopic surgery.,"To assess the value of contrast-enhanced lumbar MRI in guiding the selection of surgical approaches for recurrent lumbar disc herniation (RLDH) treated with full-endoscopic surgery. Clinical data were retrospectively analyzed from 237 patients with RLDH who underwent preoperative contrast-enhanced lumbar MRI. Surgical approaches were selected based on the location and degree of nucleus pulposus extrusion observed on MRI. The disc levels involved were as follows: L2/3 (1 case), L3/4 (11 cases), L4/5 (111 cases), and L5/S1 (114 cases). Surgical duration, intraoperative blood loss, length of hospital stays, and surgical complications were recorded. Clinical outcomes were evaluated using the Oswestry Disability Index (ODI) and visual analog scale (VAS) scores for low back and leg pain. All patients successfully underwent full-endoscopic discectomy. At one month postoperatively and at the final follow-up, VAS and ODI scores showed significant improvement compared to preoperative values (final follow-up vs. preoperative: lower back pain VAS [0.34 ± 0.50 vs. 2.54 ± 1.82], leg pain VAS [0.06 ± 0.29 vs. 5.53 ± 1.65], and ODI [0.51 ± 0.98 vs. 66.08 ± 47.14]). According to the modified MacNab criteria, outcomes were rated as excellent in 195 cases, good in 35, fair in 5, and poor in 2, yielding an excellent-to-good rate of 97.0%. No serious intraoperative, postoperative, or follow-up complications were observed. Contrast-enhanced lumbar MRI provides clear visualization of intraspinal anatomical structures in patients with RLDH, facilitating accurate preoperative determination of decompression boundaries. By assessing the spatial relationship between the reherniated nucleus pulposus and the pedicle, and incorporating iliac crest height and surgical history, the optimal surgical approach can be selected. This enables safe and effective removal of herniated disc material, adequate nerve root decompression, and favorable clinical outcomes.",Xiao Q; Huang L; Chu F; Tang X; Wang W; Li Y,"Neck-shoulder and Lumbocrural Pain Division 1, Sichuan Orthopedic Hospital, Chengdu, 610041, China.",Neurosurgical review,2025-09-30,10.1007/s10143-025-03860-z,3.0,visualization(abstract); visual(abstract); data(abstract),Clinical Outcomes; Contrast-enhanced Mri; Surgical Approaches; Recurrent Lumbar Disc Herniation; Full-endoscopic
41032535,Cardiac Microanatomy Imaging Using Forward-viewing Optical Coherence Tomography Endoscope.,"<h4>Objective</h4>Due to limitations in current imaging technologies detecting subtle cardiac microstructural changes that can lead to sudden cardiac death is a significant clinical challenge. To address this problem, we developed a forward-viewing optical coherence tomography (OCT) endoscope for the detection of relevant cardiac microstructures in the subendocardium, including Purkinje fibers, scar tissue, surviving myocytes, and adipose tissue.<h4>Methods</h4>An endoscopic probe based on the scanning fiber principle was developed for OCT measurements in contact. The probe was evaluated in freshly excised ovine hearts exhibiting chronic myocardial infarction. Relevant regions within the cardiac chamber were measured, and distinctive microstructures were identified, characterized, and subsequently corroborated using Masson's trichrome staining. The volumetric imaging data were used to train a convolutional neural network (CNN) to detect Purkinje fibers, enabling the reconstruction of their 3D morphology.<h4>Results</h4>We were able to distinguish between healthy myocardium, fibrotic remodeling, and critical elements of the cardiac conduction system. Our findings demonstrate the capability of this technology to provide detailed images of cardiac microstructures in large mammal hearts.<h4>Conclusion</h4>A novel application of forward-viewing endoscopic OCT in cardiology is demonstrated by visualizing cardiac microstructures within the subendocardium at depths accessible by optical imaging modalities.<h4>Significance</h4>By enhancing visualization at the cellular level, this method may contribute to a better understanding of cardiac physiology and pathology, potentially extending future diagnostic and therapeutic strategies.",Vasquez DL; Einmuller F; Latka I; Kulkarni K; Pallares-Lupon N; Constantin M; Marchant J; Loyer V; Bloquet S; Hamrani DE; Naulin J; Drexler W; Popp J; Unterhuber A; Andreana M; Walton RD; Schie IW,,IEEE transactions on bio-medical engineering,2025-10-01,10.1109/tbme.2025.3616493,3.0,visualization(abstract); visual(abstract); data(abstract),
41037063,Evaluating Negative Margins in Foot Amputations for Diabetic Osteomyelitis: How Do We Decide?,"<h4>Background</h4>Amputation level in diabetic foot osteomyelitis (DFO) is most determined based on surgeon visualization of macroscopic criteria, leading to subjective variability. Wide variance in methods of bone histological analysis and culture are utilized to determine the presence of residual infection. We therefore conducted a systematic, qualitative review to evaluate the current available data on objective measures to delineate the appropriate level of resection in diabetic toe and forefoot amputations, as well as the accuracy of different methods to assess for persistent infection.<h4>Methods</h4>We performed a systematic review of studies from 1990 to 2023 performed on methods to determine margins in toe and forefoot amputations for DFO following PRISMA (Preferred Reporting Items for Systematic Reviews and Meta-Analyses) guidelines. Data were summarized to discuss the study main objectives, methods utilized to determine amputation level, and techniques used to assess margins for persistent deep infection.<h4>Results</h4>568 articles were identified, and 18 articles met the final inclusion criteria after review. All studies used plain radiographs for preoperative assessment. 13 used magnetic resonance imaging (MRI) as part of their algorithm to determine general amputation level and 3 used MRI to determine exact depth of resection. 15 studies used microbiological cultures and 13 used histopathological margins intraoperatively to assess margins for deep infection. Of those, 7 studies found that those with positive margins had higher rates of treatment failure.<h4>Conclusion</h4>Overall, majority of studies used combination of plain radiographs of MRI to determine amputation level. Patients who ultimately had positive margins correlated with longer antibiotic duration and higher rates of continued infection, impaired wound healing, reoperation, or readmission. Elucidating the optimal method of evaluating clean surgical margins is critical to lessen the burden on health care systems and improve patient care.<b>Level of Evidence:</b> Level III: Qualitative Review.",Anderson A; Choi S; McLellan M; Hsu A; Noori N,"Department of Orthopaedic Surgery, University of California, Irvine, Orange, California.",Foot & ankle specialist,2025-10-02,10.1177/19386400251364978,3.0,visualization(abstract); visual(abstract); data(abstract),Diabetes; amputation; Systematic review; Osteomyelitis
41039551,The effect of reversed screen orientation versus standard orientation in bedside ultrasound on vascular access skill acquisition: a cadaver study.,"<h4>Background</h4>Ultrasound-guided vascular access (USGVA) is an essential clinical skill, but novice learners often face difficulties in interpreting ultrasound images and achieving spatial alignment during procedures. To address this challenge, we hypothesized that using a reversed screen orientation could facilitate the learning process. Reversed screen orientation refers to an ultrasound image flipped in the transverse plane, producing a top-to-bottom mirror image by activating the ""reverse"" function on the ultrasound (US) device. We assumed that this configuration might help align the visual trajectory of the needle with the user's hand movements, potentially easing spatial perception during the early stages of learning.<h4>Metods</h4>The study was conducted in the Anatomy Laboratory of Ordu University Medical Faculty with 60 final-year medical students with no prior US experience. Participants were randomly divided into two groups (A and B), who performed femoral vein needle punctures on cadavers under US guidance with standard (Group A) and reverse (Group B) screen. Each group used both screen orientations across two attempts. Before the procedure, students received theoretical training. Data collected included demographic information, needle visibility, procedure duration, success rates, and complications. Statistical analyses were performed using Statistical Package for the Social Sciences (SPSS), and significance was set at p < 0.05.<h4>Results</h4>The results showed no significant differences in age or sex distribution between groups. In the first attempt, 83.3% of participants with posterior wall penetration were in Group A (standard screen orientation). Needle visualibity score was higher in Group B (reversed screen orientation). The perceived ease of the procedure showed a significant difference in favor of Group B in the second attempt. Overall, while the success rates and time taken were similar between groups, Group B exhibited improved needle visualization and fewer complications related to posterior wall penetration.<h4>Discussion</h4>The findings indicate that reversed screen orientation may facilitate learning and enhance procedural outcomes in USGVA. This orientation aligns better with the spatial perception of needle movement, potentially improving hand-eye coordination. The study supports the integration of reversed screen techniques in US training to improve skill acquisition and reduce complication rates in vascular access procedures. However, limitations include the study being conducted at a single center and using only one cadaver, which may affect the generalizability of results. Future research should explore long-term effects and further validate these findings in diverse clinical settings.",Köksal A; Aygün A; Çaltekin İ; Tomakin M; Sarıbaş MS; Özkay İ; Tokpinar A; Baş O,"Department of Emergency Medicine, Ordu University Faculty of Medicine, Altınordu/Ordu, 52200, Turkey. ademkoksal@odu.edu.tr.",BMC medical education,2025-10-02,10.1186/s12909-025-07899-w,3.0,visualization(abstract); visual(abstract); data(abstract),Training; Ultrasonography; Cadaver; Education; Vascular Access
41023463,"Robotic versus laparoscopic gastrectomy for gastric cancer: a GRADE-assessed systematic review and meta-analysis of randomized controlled trials on operative metrics, lymphadenectomy, and postoperative complications.","<h4>Background</h4>Robotic gastrectomy has emerged as a potential advancement over laparoscopic surgery for gastric cancer, offering enhanced precision through three-dimensional visualization and articulated instrumentation. However, its clinical superiority remains controversial.<h4>Methods</h4>This review was prospectively registered in the PROSPERO database (ID: CRD420251133133). We conducted a systematic review and meta-analysis of randomized controlled trials comparing robotic gastrectomy (RG) with laparoscopic gastrectomy (LG) for gastric adenocarcinoma. Literature searches across six databases identified eligible RCTs until January 2025. The primary outcomes included operative time, postoperative complications, blood loss, and lymph node harvest. The secondary outcomes included recovery parameters and hospital stay. Evidence certainty was assessed using the GRADE methodology.<h4>Results</h4>Four RCTs encompassing 919 patients (480 RG, 439 LG) met the inclusion criteria. RG significantly reduced overall postoperative complications (OR 0.49, 95% CI 0.26-0.93, P = 0.03), shortened hospital stay (MD - 0.88 days, 95% CI - 1.21 to - 0.55, P < 0.00001), and accelerated bowel function recovery (MD - 0.52 days, 95% CI - 1.00 to - 0.05, P = 0.03) and oral intake (MD - 0.52 days, 95% CI - 1.01 to - 0.03, P = 0.04). However, operative time was significantly longer (MD + 16.95 min, 95% CI 10.93-22.98, P < 0.00001). Severe complications, anastomotic leakage, reoperation rates, blood loss, and lymph node yield were comparable between the approaches. GRADE assessment revealed moderate certainty for hospital stay reduction and low-to-very-low certainty for other outcomes due to heterogeneity and methodological limitations of the studies.<h4>Conclusions</h4>Across four RCTs conducted in high-volume East Asian centers, robotic gastrectomy demonstrates superior perioperative recovery with reduced overall complications and accelerated rehabilitation compared with laparoscopic surgery, despite longer operative times. Oncological adequacy remains equivalent across approaches. Generalizability to Western case-mix and perioperative pathways remains uncertain.",Mirza W; Cheema YI; Khan HM; Ahmad E; Dadan S; Nadeem MA,"Shifa College of Medicine, Shifa Tameer-E-Millat University, Sector H-8/4, Islamabad, Pakistan. wajahatmirza.clinicalresearch@gmail.com.",Journal of robotic surgery,2025-09-29,10.1007/s11701-025-02842-z,3.0,visualization(abstract); visual(abstract); data(abstract),Gastric cancer; Meta-analysis; Randomized controlled trials; Laparoscopic Gastrectomy; Perioperative Outcomes; Robotic Gastrectomy
