pmid,title,abstract,authors,first_author_affiliation,journal,pub_date,doi,score,matched_keywords,api_keywords
41056248,The rising burden of female cancer in Ethiopia (2000-2021) and projections to 2040: Insights from the global burden of disease study.,"<h4>Background</h4>Female cancers-breast, cervical, ovarian, and uterine-pose significant public health and socio-economic challenges, particularly in low- and middle-income countries like Ethiopia. However, detailed and geographically disaggregated data are limited, hindering effective policymaking. To address this gap, our study utilizes the Global Burden of Disease (GBD) methodology to analyze 21 years (2000-2021) of national and sub-national trends and risk factors for these cancers in Ethiopia, with projections to 2040, to support targeted cancer control and health system strengthening.<h4>Methods</h4>Using the 2021GBD data, we analyzed the national and sub-national prevalence, incidence, mortality, disability-adjusted life years (DALYs), years of life lost (YLLs), and years lived with disability (YLDs) for female specific cancer in Ethiopia. An Autoregressive Integrated Moving Average (ARIMA) model was employed for projecting epidemiological trajectories through 2040. All statistical analyses and data visualization were performed using Python.<h4>Results</h4>In 2021, the Ethiopian incidence of female breast, cervical, ovarian, and uterine cancer was 7,308 (95% uncertainty interval (UI): 5,794-9,199), 7,884 (95% UI: 5,759-11,765), 2,054 (95% UI: 1,034-2,929), and 669 (95% UI: 422-1,126), respectively. Cervical cancer accounts for the highest number of DALYs, 162,776 (95% UI: 119,900-239,116), followed by breast, ovarian, and uterine cancer at 155,931 (95% UI: 123,015-196,249), 40,430 (95% UI: 19,885-57,414), and 8,882 (95% UI: 5,579-15,240), respectively. Projections to 2040 indicate a continued rise in incidence for all female cancers.<h4>Conclusions</h4>Breast and ovarian cancers are emerging public health crises in Ethiopia, with significant increases in prevalence, incidence, and DALYs. While the cervical cancer burden is declining, rising YLDs indicate a growing need for long-term care. The projected rise in female cancer incidence calls for urgent, targeted interventions focused on early diagnosis, age-appropriate screening, and improved cancer care services to reduce the adverse impact on Ethiopian women's health.",Adisu MA; Habtie TE; Kitaw TA; Gessesse AD; Woreta BM; Derso YA; Zemariam AB,"Department of Pediatrics and child health Nursing, College of Health science, Woldia University, Woldia, Ethiopia.",PloS one,2025-10-07,10.1371/journal.pone.0333787,3.0,visualization(abstract); visual(abstract); data(abstract),
41061915,Four-dimensional (4D) virtual simulation for predicting soft tissue support and vertical dimension of occlusion in full-arch implant therapy - A proof of concept.,"<h4>Objective</h4>To describe a proof-of-concept digital workflow for four-dimensional (4D) virtual simulation of facial soft tissue support in edentulous patients, based on a real clinical case.<h4>Methods</h4>A non-invasive digital workflow was developed using intraoral, extraoral, and laboratory scans. These datasets were merged into a simulation three-dimensional (3D) model using finite element methods. Skeletal structures were represented by surface meshes, and soft tissues by volumetric tetrahedral elements. Simulations predicted changes in lip support, occlusal vertical dimension, and facial esthetics. The workflow required no additional radiographic imaging and utilized standard clinical scanning tools.<h4>Results</h4>The technique was demonstrated on a fully edentulous patient and proved clinically feasible. Accurate alignment of intraoral and facial scans enabled dynamic visualization of soft tissue changes, supporting both fixed and removable prosthetic scenarios. The patient could preview functional and esthetic outcomes before treatment initiation.<h4>Conclusions</h4>This approach improves treatment predictability, supports interdisciplinary collaboration, and reduces reliance on conventional methods. It enhances personalized prosthodontic planning, streamlines communication between clinician, technician, and patient, and shortens chairside time-aligning with the growing demand for patient-centered care.<h4>Clinical significance</h4>This proof-of-concept study demonstrates the feasibility of using 4D virtual simulation to visualize soft tissue changes in edentulous patients before treatment. The workflow offers a non-invasive, digital approach that may enhance communication, improve planning accuracy, and support clinical decision-making in full-arch prosthetic rehabilitation.",Pirc M; Wenk S; Peter D; Ioannidis A; Jung RE; Joda T,"Clinic of Reconstructive Dentistry, Center for Dental Medicine, University of Zurich, Zurich, Switzerland. Electronic address: miha.pirc@zzm.uzh.ch.",Journal of dentistry,2025-10-06,10.1016/j.jdent.2025.106142,3.0,visualization(abstract); visual(abstract); data(abstract),Prosthesis; Dental Implants; Edentulous Patients; Virtual Simulation
41065616,Photon-Counting Computed Tomography in Cardiac Imaging.,"Coronary computed tomography (CT) angiography plays a pivotal role in the diagnosis, risk stratification, and treatment of patients with known or suspected coronary artery disease. However, conventional CT technologies are limited by spatial resolution, artifact susceptibility, and radiation exposure. Photon-counting computed tomography (PCCT) introduces substantial technological improvements over conventional CT. This includes improved spatial and contrast resolution, energy discrimination, and reduction of various artifacts. As a result, PCCT enables superior coronary lumen and plaque evaluation, even in complex cases with severe calcification or smaller coronary stents. Beyond the coronary arteries, PCCT offers improved visualization of cardiac anatomy and myocardial tissue characterization with the potential to reduce downstream testing, improve diagnosis and treatment, and ultimately improve clinical outcomes. PCCT is poised to become the dominant technology for cardiovascular CT; however, challenges such as high costs, increased data demands, and a need for more validation, standardized image acquisition, and post-processing protocols remain. This review explores the technical principles of PCCT, its advantages over conventional CT, and its current and potential future applications in cardiac imaging, highlighting opportunities for future research.",Shiyovich A; Singh A; Blair CV; Cardoso R; Huck D; Peng G; Shaw LJ; Leipsic JA; Gräni C; Antoniades C; Maurovich-Horvat P; Williamson EE; Cademartiri F; Achenbach S; Blankstein R,"Division of Cardiovascular Medicine, Department of Medicine, Brigham and Women's Hospital, Harvard Medical School, Boston, Massachusetts, USA.",JACC. Cardiovascular imaging,2025-10-06,10.1016/j.jcmg.2025.07.022,3.0,visualization(abstract); visual(abstract); data(abstract),Diagnosis; coronary artery disease; Image Quality; Photon-counting Ct
41051922,Improving Procedural Efficiency in Direct Peroral Cholangioscopy: A Retrospective Analysis of Intubation Time and Success Rates Across Five Techniques.,"<b><i>Background:</i></b> Direct peroral cholangioscopy (DPOC) offers enhanced visualization and therapeutic capabilities in biliary tract procedures. However, comparative data on intubation methods and procedural efficiency remain limited. This study aimed to evaluate the success rate, complication rate, and intubation time across five different biliary intubation techniques used in DPOC. <b><i>Methods:</i></b> This retrospective study analyzed 36 consecutive patients who underwent DPOC between December 2021 and March 2024. Indications included cholelithiasis, cholangiocarcinoma, proximal migration of biliary prostheses, and self-expandable metallic stent (SEMS) occlusion. Five intubation methods were assessed: freehand, freehand with overtube, intraductal balloon, intraductal balloon with overtube, and intraductal balloon with overtube plus SEMS. Primary outcomes were technical success, intubation time, and complications. <b><i>Results:</i></b> All 36 procedures achieved successful biliary intubation (100% technical success) with no reported complications (0%). Mean intubation time differed significantly between methods (<i>P</i> < .001), with the shortest time observed in the intraductal balloon group (mean 73.3 seconds) and the longest in the freehand group (mean 202.25 seconds). No significant differences in intubation time were observed across clinical indications (<i>P</i> = .31). <b><i>Conclusions:</i></b> DPOC is a safe and effective procedure for various biliary pathologies, with accessory-assisted methods-particularly balloon-based techniques-demonstrating greater procedural efficiency. These findings support broader adoption of DPOC and tailored selection of intubation strategies based on anatomical and clinical context.",Ciesielski W; Klimczak T; Pawlak K; Sawina A; Kulig M; Cichończyk M; Durczyński A; Strzelczyk J; Hogendorf P,"Department of General and Transplant Surgery, Medical University of Lodz, Łódź, Poland.",Journal of laparoendoscopic & advanced surgical techniques. Part A,2025-10-06,10.1177/10926429251385767,3.0,visualization(abstract); visual(abstract); data(abstract),Direct Peroral Cholangioscopy; Endoscopic Techniques; Pancreatobiliary Disorders; Biliary Intubation; Intraductal Balloon
41068527,Global research landscape of PSMA-targeted radiopharmaceuticals: a two-decade multidimensional bibliometric analysis.,"<h4>Purpose</h4>This study aims to conduct a comprehensive bibliometric analysis of global research in prostate-specific-membrane-antigen (PSMA)-targeted radiopharmaceuticals to map the field's development, identify key contributors, and determine emerging research directions. PSMA-targeted radiopharmaceuticals have revolutionized prostate cancer theranostics, yet comprehensive bibliometric analyses examining the global research landscape remain absent. Understanding research trends, collaborative networks, and emerging directions is crucial for optimizing resource allocation and guiding future development in this rapidly evolving field.<h4>Materials and methods</h4>This study examined 3,249 publications related to PSMA-targeted radiopharmaceuticals from 2005 to 2025 using the Web of Science Core Collection database. Data visualization and analysis were conducted using VOSviewer (version 1.6.19), CiteSpace (version 6.2.R3), and the biblioshiny R package.<h4>Results</h4>The analysis included 77 countries, 3,350 institutions, and 13,976 researchers across 430 journals. Germany leads with 869 publications and 40,615 citations, with Technical University Munich identified as the most influential institution (n = 199). The European Journal of Nuclear Medicine and Molecular Imaging has the highest number of publications (n = 316), while Journal of Nuclear Medicine has the most co-citations (14,245). Matthias Eiber is the most prolific author with 153 publications and an H-index of 57, while A. Afshar-Oromieh has the highest number of co-citations (n = 2248). The citation patterns showed strong growth after 2018 (surpassing 14,000 citations by 2024), reflecting the field's impact. The current research hotspots mainly include ""<sup>68</sup> Ga-PSMA-PET/CT diagnostic imaging"", ""<sup>177</sup>Lu-based radioligand therapy"", ""translational clinical applications"", and ""AI-driven technological innovation"". Future research emphasizes ""AI-enhanced theranostic optimization"", ""immunotherapy-radiopharmaceutical combinations"", and ""precision biomarker-guided patient stratification"".<h4>Conclusions</h4>This analysis describes the evolution of PSMA radiopharmaceuticals research patterns and identifies emerging research directions that may inform future precision oncology development.",Yang ZL; Xu SQ; Huang CL; Tian J,"Department of Thoracic Surgery, Honghui Hospital, Xi'an Jiaotong University, Xi'an, 710000, China.",Japanese journal of radiology,2025-10-10,10.1007/s11604-025-01886-3,3.0,visualization(abstract); visual(abstract); data(abstract),prostate cancer; Theranostics; Bibliometric Analysis; Global Collaboration; Psma-targeted Radiopharmaceuticals
41057755,A retrospective analysis of the effects of moderate sedation on the degree of cardia exposure in overweight elderly patients.,"<h4>Background</h4>Gastric cancer is a type of malignant gastrointestinal tumor that poses a serious threat to human life and ranks as the second leading cause of cancer-related mortality worldwide. Although cardia-related diseases are rarely reported in the literature on gastrointestinal disorders, cardia lesions are not uncommon in clinical practice. The development of esophageal cancer may be associated with risk factors for esophageal adenocarcinoma, such as reflux esophagitis, high-fat diet, advanced age, and obesity. During gastroscopy, it is important to note that inadequate visualization of the esophagus may result from various factors, which can affect the diagnosis of esophageal lesions and lead to misdiagnosis or missed diagnoses. Currently, intravenous sedation using a combination of fentanyl and propofol is routinely administered during gastrointestinal endoscopy. The use of propofol in gastroscopy has been shown to improve procedural quality, enhance patient tolerance, and increase the accuracy of endoscopic diagnosis. However, the differences in esophageal exposure between moderate and deep sedation still require further clinical validation.<h4>Methods</h4>This study was a single-center retrospective clinical study. One hundred and twenty elderly overweight patients who underwent sedation for upper gastrointestinal endoscopy at our Gastrointestinal Endoscopy Center from May 2020 to August 2023 were retrospectively collected and divided into a moderate sedation group (Group A) and a deep sedation group (Group B) according to the anesthesia method. Primary outcome index: compare the sedation success rate and cardia exposure degree between the two groups. Secondary outcome indicators: compare the incidence of hypoxia during sedation between the two groups. Comparison of sedation recovery time, pain [visual analog scale (VAS)] and patient satisfaction.<h4>Results</h4>A total of 120 patients aged 60-75 years with body mass index ≧ 25 kg/m<sup>2</sup> were enrolled. The general data of the patients in the two groups were comparable (P > 0.05).The sedation success rate was comparable in Groups A and B (94.83% vs. 96.78%, P = 0.594).The degrees of cardia exposure in group A and group B were compared. The degrees of cardia exposure in Group A with scores of 1, 2, 3, and 4 were 12 cases (20.69%), 13 cases (22.41%), 19 cases (32.76%), and 14 cases (24.14%), respectively. The degrees of cardia exposure in group B were 21 cases (33.87%), 19 cases (30.65%), 18 cases (29.03%), and 4 cases (6.45%), respectively. Compared with group B, group A had a higher degree of cardia exposure, and the difference was statistically significant (p = 0.029). The total perioperative adverse reactions were relatively lower in group A compared with group B, and the difference was statistically significant (P = 0.049).The incidence of hypoxia (2%vs11%) and sedation recovery time (10.08 ± 2.18vs.15.38 ± 3.25) were significantly smaller in group A than in group B, and the differences were statistically significant (P < 0.05).The satisfaction with endoscopy was higher in both groups ( 98.28%vs.96.78%, P = 1.000), the difference was not statistically significant.The exposure of the cardia during gastroscopy was not significantly associated with patient gender, comorbidities such as diabetes, hypertension, or chronic obstructive pulmonary disease(COPD), or gastric or bile reflux, but was significantly associated with the depth of anesthesia (P < 0.05).<h4>Conclusion</h4>Both moderate and deep sedation are applicable for upper gastrointestinal endoscopy in elderly overweight patients. However, moderate sedation is more suitable than deep sedation for those with unstable cardiopulmonary function. Compared with deep sedation, moderate sedation provides better cardia exposure, a lower incidence of hypoxia, faster recovery time, improved safety, and comparable patient satisfaction, making it worthy of clinical promotion.",Qi L; Zhou Z; Peng K; Yu N; Wang L; Ji X; Zhang Y,"Department of Anesthesiology, Affiliated Hospital of Qingdao University, Qingdao, Shandong Province, 266061, China.",BMC anesthesiology,2025-10-07,10.1186/s12871-025-03387-2,3.0,visualization(abstract); visual(abstract); data(abstract),Elderly; Propofol; Overweight; Deep Sedation; sufentanil; Moderate Sedation; Upper Gastrointestinal Endoscopy; Cardia Exposure
41058044,Fluoroscopy Integration Module Enhanced Localization of Intramural Premature Ventricular Complex in Ethanol Ablation.,"<h4>Aims</h4>The Fluoroscopy Integration Module (FIM) is a novel feature in electroanatomic mapping systems that enhances real-time visualization of coronary venous anatomy during mapping and ablation of intramural premature ventricular complexes (PVCs). This report demonstrates the clinical utility of FIM in guiding side branch vein selection and precise ethanol ablation targeting for intramural PVCs.<h4>Methods and results</h4>The target venous branch was selected under FIM guidance in patients with intramural PVCs where RF ablation failed. Ethanol was applied to the venous branch extending to the center of the intersection of ablation tags or early activation areas where transient suppression occurred.<h4>Conclusion</h4>The fluoroscopy integration module significantly improves procedural precision in targeting intramural PVCs, facilitating effective ethanol ablation and optimizing clinical success.",Turan OE; Yilancioglu RY; Inevi U; Ozcan EE,"Heart Rhythm Management Center, Faculty of Medicine, Dokuz Eylul University, Balcova, Izmir, Turkiye.",Journal of cardiovascular electrophysiology,2025-10-07,10.1111/jce.70132,2.5,visualization(abstract); visual(abstract),Premature Ventricular Complex; Ethanol Ablation; Catheter Radiofrequency Ablation; Intramural Ventricular Arrhythmia
41073793,Postoperative assessment of fracture reduction and osteosynthesis materials using photon-counting detector CT in maxillofacial trauma - a pilot study.,"<h4>Purpose</h4>To assess postoperative fracture reduction and visualization of titanium-based and bioresorbable osteosynthesis materials in maxillofacial trauma surgery using ultra-high-resolution photon-counting detector computed tomography (PCD-CT) compared with cone-beam computed tomography (CBCT).<h4>Methods</h4>Fractures were induced in six cadaveric pig mandibles at the angle, body, and parasymphysis and were stabilized using various titanium and bioresorbable plate systems. Specimens were scanned with CBCT and dose-matched PCD-CT in the ultra-high resolution mode, applying standard and low-dose protocols. Two observers assessed fracture reduction and implant delineation using a 5-point visual analog scale. Fracture gap and osteosynthesis materials were quantitatively measured and compared to ground-truth values. Descriptive statistics and inter-reader agreement (weighted κ) were calculated.<h4>Results</h4>PCD-CT enabled excellent assessment of fracture reduction and visualization of osteosynthesis materials, with perfect inter-observer agreement (Median = 5, IQR, 5-5; κ = 1.0, p < 0.001), whereas low-dose CBCT showed reduced image quality and lower reproducibility (Median = 4, IQR, 4-4; κ = 0.92; p < 0.001). Bioresorbable plates were not directly visible using either scanner, but the associated screw drill holes were reliably delineated. PCD-CT achieved the smallest measurement deviations of fracture gap and osteosynthesis materials compared with ground truth, and with superior reproducibility (κ = 0.74-0.84; ICC = 0.95-0.99; all p < 0.001), outperforming CBCT across most parameters.<h4>Conclusions</h4>Ultra-high resolution PCD-CT combines superior visualization and precise measurements compared with CBCT even at low radiation dose. With further clinical validation, these findings highlight PCD-CT's strong potential for perioperative imaging in maxillofacial trauma, particularly benefiting younger patients who require repeated scans.",Al-Haj Husain A; Mergen V; Sandhu S; Wagner MEH; Demmert TT; Alkadhi H; Burian E; Flohr T; Stadlinger B; Kessler P; Lie SAN; Essig H,"Department of Cranio-Maxillofacial and Oral Surgery, University Hospital Zurich, University of Zurich, Rämistrasse 100, Zurich, 8091, Switzerland. adib.al-hajhusain@usz.ch.",Oral and maxillofacial surgery,2025-10-11,10.1007/s10006-025-01470-z,2.5,visualization(abstract); visual(abstract),Fractures; Surgical procedure; Maxillofacial Surgery; Photon-counting Detector Computed Tomography; Cone-beam Computed tomography
41052938,Advantages of 12° Endoscope in Unilateral Biportal Endoscopic Surgery for Lumbar Disc Herniation.,"<h4>Objective</h4>This study introduces the application of a 12° endoscope in unilateral biportal endoscopic (UBE) decompression surgery for lumbar disc herniation and discusses its advantages in UBE procedures.<h4>Methods</h4>From December 2019 to December 2020, 75 patients (33 men and 42 women) were treated with UBE decompression using a 12° endoscope. Patient ages ranged from 26 to 78 years (mean 53.2). Pre- and postoperative visual analog scale (VAS) scores for low back and leg pain were recorded. Surgical outcomes were evaluated using MacNab criteria, with operative time and complications documented.<h4>Results</h4>The 12° endoscope demonstrated superior maneuverability with a distortion-free visual field. Compared with 30° endoscopes, it showed better applicability within the anatomical working triangle while providing broader visualization than 0° endoscopes. This enabled effective decompression of the superior articular process medial edge, nerve root canal, and lateral recess. Low back pain VAS scores decreased from 7.3 ± 1.3 to 1.9 ± 1.2 (<i>P</i> < 0.001), while leg pain scores improved from 8.1 ± 1.8 to 1.6 ± 1.0 (<i>P</i> < 0.001). At the 12-month follow-up, MacNab criteria outcomes were excellent in 65.3%, good in 25.3%, and unsatisfactory in 9.3% of cases (<i>χ</i> <sup>2</sup> test, <i>P</i> = 0.002).<h4>Conclusion</h4>The 12° endoscope demonstrates clinical value as a feasible, safe, and effective option for UBE surgery in lumbar disc herniation treatment.<h4>Clinical relevance</h4>Key clinical advantages of the 12° endoscope include direct visualization of key anatomical structures, minimized bone resection (particularly at the medial spinous process base), and a reduction in instrument crowding. These technical benefits contribute to effective decompression, improved patient outcomes (as measured by VAS and MacNab criteria), and potentially a shorter learning curve for surgeons adopting the UBE technique.<h4>Level of evidence: 3</h4>",Wu W; Xie Y; Xue Y; Cui M; Zeng X; Zhang Y; Yang C; Wu Y,"Department of Orthopedics, Union Hospital, Tongji Medical College, Huazhong University of Science and Technology, Wuhan, China.",International journal of spine surgery,2025-10-06,10.14444/8771,2.5,visualization(abstract); visual(abstract),Lumbar disc herniation; Minimally Invasive Spinal Surgery; Unilateral Biportal Endoscopy; 12° Endoscope
41056268,Networks for treatment selection in psychotherapy: providing a manual for process-based perceived causal networks.,"Idiographic networks offer a transdiagnostic approach to case conceptualization and may aid in selecting the treatment focus. We provide a practical manual for constructing idiographic paper-pencil networks. These networks focus on a single main problem, delineate the maladaptive processes that perpetuate it, and thereby inform treatment recommendations. We tested the feasibility and clinical utility of the network construction. Eight therapists applied a manual to construct idiographic paper-pencil networks with twelve patients. Both therapists and patients assessed the feasibility of the manual, the clarity of the network visualization, and the perceived clinical utility of the networks. Additionally, they evaluated changes in common therapeutic factors due to network construction. Therapists and patients rated the manual as highly feasible, viewed the network visualizations favorably, and assessed the clinical utility of the networks positively. Both therapists and patients reported improvements in treatment expectations, therapeutic alliance, and therapy motivation due to network construction. This study provides a manual for developing idiographic process-based networks during the initial psychotherapy session. Both therapists and patients evaluated the manual and the resulting networks positively, suggesting their potential to enhance case conceptualization and treatment selections in psychotherapy.",Seewald A; Schummer SE; Franz S; Franz M; Rief W,"Department of Psychology, Clinical Psychology & Psychotherapy, University of Marburg, Gutenbergstr. 18, Marburg 35032, Germany.",Cognitive behaviour therapy,2025-10-07,10.1080/16506073.2025.2568000,2.5,visualization(abstract); visual(abstract),Feasibility; Network Theory; Common Factors; Personalized Treatment; Pecan; Perceived Causal Network
