pmid,title,abstract,authors,first_author_affiliation,journal,pub_date,doi,score,matched_keywords,api_keywords
39776214,Redefining the severity of orofacial tissue damage caused by noma: a novel classification approach.,"<h4>Background</h4>Noma is a severe orofacial disease with high mortality and morbidity. Although severity scales exist, they fail to fully capture the extent of damage caused by the disease.<h4>Methods</h4>This study analysed 404 photos of 260 noma cases from Facing Africa (n=228) and Project Harar (n=32) to create a new severity classification system. Photos were displayed on a large screen for better visualization. Tissue damage was assessed in terms of width, depth and surface area using the American Burn Association's grading system. A mathematical formula was also developed to quantify the extent of noma-induced orofacial damage.<h4>Results</h4>Fifteen orofacial anatomical units vulnerable to noma were identified, leading to the development of a new severity classification system that enhances the assessment of noma. This system evaluates tissue damage qualitatively as minor, moderate or major and quantitatively using a purpose-built mathematical formula.<h4>Conclusions</h4>Current classification systems inadequately capture noma severity due to vague definitions and limited consideration of the affected anatomical units. The new approach addresses these gaps by considering all tissue damage, including dentition, and allows for precise qualitative and quantitative assessment of disease severity. Continued research and validation are essential to refine this method, improving its clinical and research applications and enhancing outcomes for noma patients worldwide.",Gebretsadik HG,"Euclid University, Department of Global Health & Bioethics, Banjul, C74F+J4Q, Sukuta, Gambia.",Transactions of the Royal Society of Tropical Medicine and Hygiene,2025-01-08,10.1093/trstmh/trae137,2.5,visualization(abstract); visual(abstract),Classification; Noma; Tissue Damage; Severity; Orofacial Compartments
39760302,Clinical Feasibility of 3-D Acoustic Radiation Force Impulse (ARFI) Imaging for Targeted Prostate Biopsy Guidance.,"We have developed a 3-D acoustic radiation force impulse (ARFI) prostate imaging system to identify regions suspicious for cancer and guide a targeted prostate biopsy in a single visit. The system uses a side-fire transrectal probe and an automated rotation stage to acquire ARFI and B-mode image volumes, combined with 3-D visualization and targeting software to enable biopsy target identification and guide a transperineal (TP) biopsy. The system was tested in the first clinical trial of its kind, with subjects serially undergoing ARFI-guided targeted TP biopsy, multiparametric magnetic resonance imaging (mpMRI)-ultrasound fusion TP biopsy, and systematic sampling TP biopsy. The findings indicate that the ARFI system is feasible for guiding a targeted biopsy. For lower-grade cancer (grade groups [GG] 1-2), ARFI underperformed mpMRI and systematic sampling, detecting cancer in 54% of GG 2 subjects. However, ARFI performance improved with increasing cancer grade; for higher-grade cancer (GG 3-5), ARFI performed comparably to the other biopsy approaches, and detected cancer in all GG 4 and 5 subjects. The findings also suggest the benefit of using 2-D ARFI imaging to confirm target location during live B-mode imaging, which could improve existing ultrasonic fusion biopsy workflows. This study is registered with ClinicalTrials.gov as NCT04607135.",Chan DY; Moavenzadeh SR; Wightman WE; Palmeri ML; Polascik TJ; Nightingale KR,"Department of Biomedical Engineering, Duke University, Durham, NC, USA.",Ultrasonic imaging,2025-01-06,10.1177/01617346241311901,2.5,visualization(abstract); visual(abstract),prostate cancer; Acoustic Radiation Force; Elasticity Imaging; Image-guided Biopsy; Transperineal Biopsy
39782703,Evaluating the Use of a 3D Exoscope to Improve Ergonomics in Cleft Surgery.,"The aim of this study was to investigate and compare the technical feasibility, ergonomics, and educational value of the 3D exoscope in comparison with traditional and prism loupes in cleft surgery.A variety of cleft and pharyngeal operations were performed with the VITOM<sup>®</sup> 3D exoscope (Karl Storz GmbH, Tuttlingen, Germany), traditional/prism loupes, and microscope. The cervical neck angulation of the operating surgeon was recorded in real-time with an inertia measurement unit system (Mbient, San Francisco, USA) and experiences of the surgeon and assistant were prospectively evaluated with 5-point Likert scales.National Health Service, England.Eleven patients were recruited in whom 12 procedures were performed. Two main surgeons, 3 assistant surgeons, and 3 scrub nurses were recruited into the study.Four procedures were performed with the VITOM<sup>®</sup> 3D exoscope, and as the comparison groups, 5 procedures were performed with normal loupes, 3 with prism loupes, and 2 were done in combination with a microscope and analyzed separately.Neck angle measurements and feedback from surgeons, assistants, and scrub nurses.The VITOM<sup>®</sup> system improved surgeon ergonomics with reduced procedure time in cervical flexion when compared to the other visualization methods (versus loupes, <i>P</i> < .01, and prism, <i>P</i> < .01). The VITOM<sup>®</sup> system also scored favorably in terms of image-related fields, ergonomics, and ease of use.Use of the 3D exoscope in cleft surgery yielded improved experiences for both surgeons, assistants, and nurses in comparison with loupes and microscopes without increasing operating time.",Lee KC; Frearson B; Alagbe BA; ElSafti MGAS; Nightingale C; Cooke J; Panagamuwa C; Echlin K; Khan K,"Birmingham Childrens Hospital, Birmingham, UK.",The Cleft palate-craniofacial journal : official publication of the American Cleft Palate-Craniofacial Association,2025-01-09,10.1177/10556656241305229,2.5,visualization(abstract); visual(abstract),Ergonomics; Cleft; Exoscope; Neck Angle
39792785,"Novel Leech Antimicrobial Peptides, Hirunipins: Real-Time 3D Monitoring of Antimicrobial and Antibiofilm Mechanisms Using Optical Diffraction Tomography.","Antimicrobial peptides (AMPs) are promising agents for treating antibiotic-resistant bacterial infections. Although discovering novel AMPs is crucial for combating multidrug-resistant bacteria and biofilm-related infections, their clinical potential relies on precise, real-time evaluation of efficacy, toxicity, and mechanisms. Optical diffraction tomography (ODT), a label-free imaging technology, enables real-time visualization of bacterial morphological changes, membrane damage, and biofilm formation over time. Here, a computational analysis of the leech transcriptome using an advanced AI-based peptide screening strategy with ODT to identify potential AMPs is employed. Among the 19 potential AMPs identified, hirunipin 2 demonstrates potent antibacterial activity, low mammalian cytotoxicity, and minimal hemolytic effects. It demonstrates efficacy comparable to melittin, resistance to physiological salts and human serum, and a low likelihood of inducing bacterial resistance. Microscopy and 3D-ODT confirm its disruption of bacterial membranes and intracellular aggregation, leading to cell death. Notably, hirunipin 2 effectively inhibits biofilm formation, eradicates preformed biofilms, and synergizes with antibiotics against multidrug-resistant Acinetobacter baumannii (MDRAB) by enhancing membrane permeability. Additionally, hirunipin 2 significantly suppresses pro-inflammatory cytokine expression in LPS-stimulated macrophages, highlighting its anti-inflammatory properties. These findings highlight hirunipin 2 as a strong candidate for developing novel antibacterial, anti-inflammatory, and antibiofilm therapies, particularly against multidrug-resistant bacterial infections.",Kumar SD; Park J; Radhakrishnan NK; Aryal YP; Jeong GH; Pyo IH; Ganbaatar B; Lee CW; Yang S; Shin Y; Subramaniyam S; Lim YJ; Kim SH; Lee S; Shin SY; Cho SJ,"Department of Cellular & Molecular Medicine, School of Medicine, Chosun University, Gwangju, 61452, Republic of Korea.","Advanced science (Weinheim, Baden-Wurttemberg, Germany)",2025-01-10,10.1002/advs.202409803,2.5,visualization(abstract); visual(abstract),Antimicrobial peptide; Leech; Antibiofilm; Hirunipin; Odt Technology
39776470,Endoscopic Flexor Hallucis Longus Tendon Transfer for the Treatment of Chronic Achilles Tendon Defects.,"<h4>Background</h4>An all-inside endoscopic flexor hallucis longus (FHL) tendon transfer is indicated for the treatment of chronic, full-thickness Achilles tendon defects. The aim of this procedure is to restore function of the gastrocnemius-soleus complex while avoiding the wound complications associated with open procedures.<h4>Description</h4>This procedure can be performed through 2 endoscopic portals, a posteromedial portal (the working portal) and a posterolateral portal (the visualization portal). The FHL tendon is identified, and the joint capsule is debrided to identify the subtalar joint. A shaver is utilized to circumferentially debride the FHL at the level of the subtalar joint, allowing for full visualization of the tendon. Care is taken to avoid the posteromedial neurovascular bundle by keeping the shaver against the tendon. An endoscopic suture-passing device is utilized to pierce the FHL tendon and shuttle a nonabsorbable suture through the tendon; this step is done 2 times. The tendon is then cut at its distal-most aspect (adjacent to the subtalar joint) with an endoscopic cutter. The tendon is then brought through the posteromedial portal and prepared for transosseous passage with nonabsorbable suture. Next, the anterior insertion of the Achilles tendon is endoscopically identified and debrided. With use of needle endoscopy-targeted pin placement, a Beath pin is placed at the anterior footprint of the Achilles via the posteromedial portal. The pin is advanced dorsal to plantar and out the bottom of the foot and is confirmed on fluoroscopy. With use of an appropriately sized reamer, the Beath pin is loaded with the 2 grasping sutures and shuttled plantarly. The needle endoscope is then placed in the posterolateral portal to visualize the FHL tendon, advancing into the tunnel with the foot held in 15° of plantar flexion. An appropriately sized interference screw is then placed in the tunnel, using direct endoscopic visualization to confirm placement and depth of the screw.<h4>Alternatives</h4>Chronic Achilles tendon ruptures with symptomatic weakness often necessitate operative treatment; however, high-risk patients may be better managed nonoperatively with an ankle-foot orthosis. These patients often demonstrate improved gait and function with this orthosis<sup>1</sup>. The choice of operative technique for the treatment of chronic Achilles tendon defects is primarily based on tendon gap length; options include end-to-end repair, fascial advancement, and turn-down procedures with or without transferring the FHL, peroneus brevis, or flexor digitorum longus tendons. These techniques require substantial incisions and violation of the posterior compartments and Achilles paratenon, creating substantial postoperative scarring.<h4>Rationale</h4>Chronic Achilles tendon ruptures with defects or gaps leave the patient with weakness and biomechanical loss of the gastrocnemius-soleus complex. The gold standard algorithm in which the gap length determines the type of fascial advancement requires lengthy incisions and violation of the posterior compartments and paratenon. These reconstruction procedures do restore gastrocnemius-soleus complex tension, but also result in diminished gliding and substantial scarring and thickening. These incisions are also prone to wound complications, sural nerve injury, and painful scarring. An all-inside endoscopic FHL tendon transfer has several advantages over the standard approach. The all-inside approach prevents violation of the compartments and the Achilles, avoiding painful scars and hypertrophic tissue changes. The use of an FHL tendon transfer is advantageous as it is an in-phase transfer that maximizes neuromuscular control. The anatomic position of the flexor hallucis longus muscle also creates optimal force vectors allowing for optimal gait propulsion. The FHL also has a robust muscle belly that can hypertrophy and strengthen over time. The endoscopic approach allows for immediate weight-bearing as part of an accelerated rehabilitation, which helps to reduce muscle wasting, deep vein thrombosis, and wound complications, and facilitates an earlier return to work<sup>3</sup>.<h4>Expected outcomes</h4>This procedure provides excellent clinical outcomes with decreased complication rates, as compared with open treatment. In a study of 22 patients with chronic Achilles tendon rupture with a large tendon gap who underwent endoscopic FHL tendon transfer, the mean American Orthopaedic Foot & Ankle Society score improved from 55 preoperatively to 91 at the time of final follow-up<sup>4</sup>. All patients in this cohort returned to daily activities. In another study, a total of 42 patients with chronic Achilles tendon rupture underwent either endoscopic (18 patients) or open treatment (24 patients). Patients in the endoscopic cohort demonstrated better functional outcomes and decreased complication rates compared with the open treatment cohort<sup>3</sup>. Patients undergoing the endoscopic procedure also had a significant increase in American Orthopaedic Foot & Ankle Society scores postoperatively and a lower rate of complications. One patient in the open treatment cohort had a wound dehiscence. There were no wound-healing complications in the endoscopic group.<h4>Important tips</h4>Utilize a low-flow straight-forward viewing endoscope.Utilize an endoscopic suture passer to avoid iatrogenic injury.Visualize the bone tunnel prior to passing the tendon in order to confirm that the wall is intact.Plantar flex the ankle and great toe when performing the tenotomy to allow for adequate tendon length for transfer.If a low-lying FHL muscle belly is present, it can be taken back to the level of the tibial talar joint. We have found that cutting the FHL at the level of the subtalar joint is optimal for transfer.Inadequate visualization of the tendon of the subtalar joint can prevent tenotomy from being distal enough for transfer.Avoid soft-tissue bridging by minimizing utilization of the posteromedial portal and by passing a looped grasper down the suture to confirm that no soft-tissue bridges are present.Failure to utilize both endoscopy and fluoroscopy can lead to inadequate tunnel placement.<h4>Acronyms and abbreviations</h4>FHL = flexor hallucis longusHPI = history of present illnessPMH = past medical historyNSAIDs = nonsteroidal anti-inflammatory drugsPT = physical therapySH = social historyPE = physical examinationMRI = magnetic resonance imagingCAM = controlled ankle motionAOFAS = American Orthopaedic Foot & Ankle Society.",Rust A; Roebke L; Martin KD,"The Ohio State University College of Medicine, Columbus, Ohio.",JBJS essential surgical techniques,2025-01-07,10.2106/jbjs.st.23.00075,2.5,visualization(abstract); visual(abstract),
39791341,"Enhancing the control of respiratory virus spread: a comprehensive approach integrating airborne virus detection, aerological investigations, and airflow modeling for practical implementation.","<h4>Objective</h4>Patients with chronic kidney disease suffer from immune dysfunction, increasing susceptibility to infections. The aim of the study was to investigate air contamination with respiratory viruses in a dialysis unit at a quaternary hospital using molecular detection techniques and to analyze airflow dynamics through computational fluid dynamics (CFD) simulations for a comprehensive assessment of air transmission risks.<h4>Methods</h4>We conducted dialysis unit air sampling using AerosolSense™ samplers. Air and clinical sampling occurred during three periods in 2022: winter, early, and late fall. A technical team maintained the dialysis unit's ventilation system during mid fall. Ventilation system capacity and airflow rates were measured. CFD simulations were used to evaluate airflow dynamics.<h4>Results</h4>The investigation collected 144 air samples, revealing heterogeneous virus detection rates across locations and study periods. Virus positivity correlated with the presence of patients and the effectiveness of the ventilation system. The ratio of virus air positivity to virus patient positivity was 1.84 and 3.35 during the first and the second periods, respectively, and collapsed to 0.64 after maintenance. Airflow rate measurements highlighted a ninefold discrepancy between actual and theoretical airflow (393 m<sup>3</sup>/h <i>vs.</i> 3530 m<sup>3</sup>/h), which was rectified by maintenance actions. Airflow dynamics and particle dispersion visualization through CFD simulations contributed to a better understanding of transmission risks.<h4>Conclusions</h4>Detection of viruses in the air, combined with CFD, revealed deficiencies in air renewal. Maintenance interventions significantly improved airflow dynamics and particle dispersion, reducing airborne virus spread.",Mellon G; Mahjoub N; Metivier F; Osinski N; Gabassi A; Delaugerre C; Vanoli E; Crawford C; Le Goff J,"Infection Prevention and Control Unit, AP-HP, Hôpital Saint-Louis, Paris, France.",Infection control and hospital epidemiology,2025-01-10,10.1017/ice.2024.217,2.5,visualization(abstract); visual(abstract),
39773449,Measuring Bound Attention During Complex Liver Surgery Planning: Feasibility Study.,"<h4>Background</h4>The integration of advanced technologies such as augmented reality (AR) and virtual reality (VR) into surgical procedures has garnered significant attention. However, the introduction of these innovations requires thorough evaluation in the context of human-machine interaction. Despite their potential benefits, new technologies can complicate surgical tasks and increase the cognitive load on surgeons, potentially offsetting their intended advantages. It is crucial to evaluate these technologies not only for their functional improvements but also for their impact on the surgeon's workload in clinical settings. A surgical team today must increasingly navigate advanced technologies such as AR and VR, aiming to reduce surgical trauma and enhance patient safety. However, each innovation needs to be evaluated in terms of human-machine interaction. Even if an innovation appears to bring advancements to the field it is applied in, it may complicate the work and increase the surgeon's workload rather than benefiting the surgeon.<h4>Objective</h4>This study aims to establish a method for objectively determining the additional workload generated using AR or VR glasses in a clinical context for the first time.<h4>Methods</h4>Electroencephalography (EEG) signals were recorded using a passive auditory oddball paradigm while 9 participants performed surgical planning for liver resection across 3 different conditions: (1) using AR glasses, (2) VR glasses, and (3) the conventional planning software on a computer.<h4>Results</h4>The electrophysiological results, that is, the potentials evoked by the auditory stimulus, were compared with the subjectively perceived stress of the participants, as determined by the National Aeronautics and Space Administration-Task Load Index (NASA-TLX) questionnaire. The AR condition had the highest scores for mental demand (median 75, IQR 70-85), effort (median 55, IQR 30-65), and frustration (median 40, IQR 15-75) compared with the VR and PC conditions. The analysis of the EEG revealed a trend toward a lower amplitude of the N1 component as well as for the P3 component at the central electrodes in the AR condition, suggesting a higher workload for participants when using AR glasses. In addition, EEG components in the VR condition did not reveal any noticeable differences compared with the EEG components in the conventional planning condition. For the P1 component, the VR condition elicited significantly earlier latencies at the Fz electrode (mean 75.3 ms, SD 25.8 ms) compared with the PC condition (mean 99.4 ms, SD 28.6 ms).<h4>Conclusions</h4>The results suggest a lower stress level when using VR glasses compared with AR glasses, likely due to the 3D visualization of the liver model. Additionally, the alignment between subjectively determined results and objectively determined results confirms the validity of the study design applied in this research.",Schneider T; Cetin T; Uppenkamp S; Weyhe D; Muender T; Reinschluessel AV; Salzmann D; Uslar V,"University Hospital for Visceral Surgery, PIUS-Hospital, Department for Human Medicine, Faculty VI, University of Oldenburg, Oldenburg, Germany.",JMIR formative research,2025-01-08,10.2196/62740,2.5,visualization(abstract); visual(abstract),Electroencephalography; EEG; Event-related potential; ERP; Virtual reality; AR; Surgical Planning; Augmented Reality; Aep; Auditory Evoked Potential; Nasa-tlx; Vr; Workload Measurement; National Aeronautics And Space Administration Task Load Index; Oddball Experiment
