pmid,title,abstract,authors,first_author_affiliation,journal,pub_date,doi,score,matched_keywords,api_keywords
41219123,Emerging approaches in the management of intracranial hemorrhage: ARISE II consensus recommendations.,"Despite advances in the fundamental understanding of the pathophysiology of intracranial hemorrhage (ICH), many issues related to ICH management remain understudied with discrepancies in management. Given the high disease severity and prevalence, consensus recommendations are urgently needed to guide further research and management strategies. Thus, a group of clinical experts, industry leaders, and government representatives was assembled to examine emerging approaches in ICH management and their future impact on patient care. The timing of intervention within 24 hours and the role of minimally invasive evacuation, particularly for basal ganglia hemorrhage locations, were identified as key research focuses to guide future trial design. Mobile stroke units and artificial intelligence (AI) are promising technologies that streamline preoperative and triaging workflows and improve time to intervention. Efforts to further develop surgical technologies will be crucial to improve ICH visualization and evacuation. Further research, industry collaboration, and investment are needed to advance treatment frontiers and catalyze ICH research.",Bain M; Kellner CP; Hanel RA; Burkhardt JK; Fiorella D; Frosen J; Jankowitz B; Lopes D; Pradilla G; Taussky P; Kashkoush A; Wakhloo AK; Arthur AS; Mocco J; Liebeskind DS; Samaniego EA; Toth G; Strbian D; Linfante I; Nogueira R; Fisher M; ,"Neurological Institute, Cleveland Clinic, Cleveland, Ohio, USA bainm@ccf.org.",Journal of neurointerventional surgery,2025-11-11,10.1136/jnis-2025-023855,3.5,visualization(abstract); visual(abstract); artificial intelligence(abstract),Brain; hemorrhage
41217811,Collaborative Design and Development of a Patient-Centered Digital Health App for Supportive Cancer Care: Participatory Study.,"<h4>Background</h4>Digital health tools such as smartphone apps have the potential to improve supportive cancer care. Although numerous smartphone apps for supportive care are available, few are designed using a user-centered approach. Such an approach is crucial for successful implementation, as it may improve user engagement, usability, and adoption in clinical settings.<h4>Objective</h4>This study aimed to co-design and develop a digital health app for supportive cancer care in collaboration with patients with cancer and health care professionals and to explore factors influencing its future acceptance.<h4>Methods</h4>We conducted a participatory study with the major stakeholders at the University Hospital Zurich. Workshops, individual qualitative interviews, and focus groups were held with health care professionals, survivors of cancer, and patients with cancer. The co-design process was divided into 3 phases: predesign, generative phase, and prototyping. User-centered design methods included scoring cards and think-aloud protocols to co-create design ideas, identify important functionalities, and test usability. Qualitative data were analyzed using thematic analysis.<h4>Results</h4>Patients and health care professionals emphasized the need for a digital health app to improve patient-healthcare professional communication, digitalize supportive care screening and processes, and enhance self-efficacy. The resulting app, OncoSupport+, was co-designed and integrated into the clinical workflow for supportive cancer care. It consists of (1) a patient dashboard to record patient-reported outcome measures and to provide access to personalized supportive care information and contact details, and (2) a nurse dashboard to visualize patient data, which can be used during nursing consultations. Potential facilitators for adoption included ease of use, workflow integration, introduction by health care professionals, and technical support, whereas internet anxiety may be a potential barrier.<h4>Conclusions</h4>Collaborative development with patients and health care professionals is crucial for creating digital health tools that can be implemented successfully. Future research should evaluate the feasibility of long-term implementation and the real-world usability and effectiveness of OncoSupport+ for improving communication, self-efficacy, and quality of life.",Difrancesco S; Bauert MM; Lehmann C; Häsler S; Zhang Y; Hirsch S; Ackermann P; Stockinger K; Reif M; Mathieu S; Götz A; Wicki A; Krauthammer M; Witt CM,"Department of Quantitative Biomedicine, University of Zurich, Zurich, Switzerland.",JMIR human factors,2025-11-11,10.2196/73829,3.0,dashboard(abstract); visual(abstract); data(abstract),Cancer; Supportive Care; Patient-reported Outcome Measures; Mhealth; Digital Health
41069141,Effect of Mobile Augmented Reality Counseling on Improving Shared Decision-Making in Thoracic Surgery: Randomized Clinical Crossover Trial.,"<h4>Background</h4>Augmented reality (AR) superimposes virtual objects onto a real-world environment, allowing users to interact in real time. As AR has become widely used, its integration into smartphones or tablets has enabled mobile augmented reality (MAR) experiences. AR has been adopted in many industries, and the literature has highlighted its applications in academic and clinical settings, particularly in enhancing visualization, communication, and learning.<h4>Objective</h4>This study investigated the potential of MAR as a mobile health tool to enhance shared decision-making (SDM) in thoracic surgery by increasing patient understanding and engagement during medical consultations.<h4>Methods</h4>A randomized crossover clinical trial was conducted at the Tri-Service General Hospital in Taiwan. Participants scheduled for thoracic surgery were enrolled and randomized in a crossover design. The MAR intervention incorporated patient-specific 3D anatomical models that were reconstructed from computed tomography imaging to facilitate understanding and support SDM. The impact of each counseling approach on SDM was evaluated using postintervention questionnaires.<h4>Results</h4>A total of 47 participants were enrolled in this study. After analyzing the data, we found that patients in the MAR group showed significantly higher scores compared to those in the traditional counseling group (P<.001) during the SDM process. Moreover, patients reported higher satisfaction levels and found the visual objects helpful for understanding tumor location and surgical procedures.<h4>Conclusions</h4>This study demonstrated that MAR counseling significantly enhanced patients' comprehension of thoracic conditions and increased their active engagement in the SDM process (P<.001). The integration of patient-specific 3D anatomical models into MAR technology provided an intuitive method for critical medical information. This digital approach not only enhanced personalization in medical communication but also reinforced patient education about their health care conditions. These findings suggest that MAR counseling represents a promising approach for promoting patient-centered care in thoracic surgery and has potential applications across various clinical domains.<h4>Trial registration</h4>ClinicalTrials.gov NCT07062393; https://clinicaltrials.gov/study/NCT07062393.",Chen YS; Hsu YC; Romalee W; Wang DH; Lai J; Huang TW; Lin KH,"School of Medicine, National Defense Medical University, Taipei, Taiwan.",JMIR mHealth and uHealth,2025-11-13,10.2196/79632,3.0,visualization(abstract); visual(abstract); data(abstract),Patient education; Shared Decision-making; Thoracic Surgery; 3D Models; Mobile Augmented Reality
41214522,Capsule endoscopy findings following negative second look endoscopy in patients with suspected small bowel bleeding at a tertiary care center in Sri Lanka.,"<h4>Background and aims</h4>Small bowel bleeding poses a significant diagnostic challenge for clinicians, and capsule endoscopy is currently considered the investigation of choice for evaluating suspected cases. However, evidence regarding the role of second-look endoscopy before capsule endoscopy is limited. This study aimed to evaluate capsule endoscopy findings after a negative second-look endoscopy in patients with suspected small bowel bleeding at a tertiary care center in Sri Lanka.<h4>Method</h4>This retrospective cross-sectional study analyzed data from patients who underwent capsule endoscopy for suspected small bowel bleeding at the National Hospital of Sri Lanka from June 1, 2018, to March 31, 2023. All patients had negative results on second-look endoscopies and abdominal imaging (CT, MRI, Enterography). The principal investigator reassessed all the capsule recordings at 3-6 frames per second in single-image viewing mode. The study primarily evaluated demographic data, capsule endoscopy findings, and mucosal visualization. Continuous variables were presented as mean ± standard deviation or median. Comparisons for continuous variables were performed using independent-sample t-test and categorical variables were compared using the chi-square test. A two-sided p-value < 0.05 was considered statistically significant.<h4>Results</h4>The sample size was 71, with a mean age of 54.41 ± 18.44 years. 60.6% of patients were males. Overt bleeding occurred in 52.1% of patients, while occult bleeding occurred in 47.9%. The mean small intestine transit time was 5:16:30 ± 1:48:01 h. Hemoglobin was significantly lower (p < 0.001) in patients with overt bleeding, with a mean level of 9.27 ± 1.27 g/dL. Capsule endoscopy identified 30 patients (42.3%) with a definite cause for small bowel bleeding and 22 patients (31.0%) with a probable cause, resulting in an overall diagnostic yield of 73.2%. The proximal small intestine was the most commonly affected segment of the small bowel in cases of small bowel bleeding, accounting for 33 patients (46.5%). None of the patients had lesions in the endoscopically accessible sites of the upper or lower gastrointestinal tract. We noted vascular findings in 18 patients (25.4%), with inflammatory findings accounting for the majority (n = 30/42.3%). The predominant treatment option was medical management (71.8%), followed by endoscopic interventions (26.8%) and interventional radiological interventions (2.8%). The number of polyethylene glycol sachets used for bowel preparation did not affect the diagnostic yield or mucosal visualization quality.<h4>Conclusion</h4>Capsule endoscopy demonstrated a high diagnostic yield in Sri Lankan patients with suspected small bowel bleeding who had normal initial and second-look endoscopies. The proximal small intestine was the commonest involved segment, and, contrary to previous studies, inflammatory lesions were the predominant finding. We recommend low-volume bowel preparation as the number of polyethylene glycol sachets did not affect the diagnostic yield or quality of mucosal visualization. This study supports integrating capsule endoscopy into routine clinical practice for evaluating gastrointestinal bleeding and recommends performing a second-look endoscopy before proceeding to capsule endoscopy.",Aponso T; Wanninayake WMDAS; Nawarathne NMM; Peiris R; Fernandopulle N; Wijesinghe IP,"Gastrointestinal and Hepatology Unit, National Hospital of Sri Lanka, Colombo, Sri Lanka. tilan89@gmail.com.",BMC gastroenterology,2025-11-10,10.1186/s12876-025-04410-z,3.0,visualization(abstract); visual(abstract); data(abstract),Capsule endoscopy; Small Bowel Bleeding; Second-look Endoscopy; Obscure Gi Bleeding; Overt Bleeding; Occult Bleeding
41231752,International Mouse Phenotyping Consortium Portal: facilitating investigation of gene function and providing insights into human disease.,"The International Mouse Phenotyping Consortium (IMPC; https://www.mousephenotype.org/) web portal contains phenotype data for mouse protein-coding genes derived from analysis of data obtained in a systematic and high-throughput fashion from knock-out lines produced by IMPC. The project has produced >1400 candidate mouse models of human disease that recapitulate phenotypes observed in patients. Over 8000 papers rely on data or reagents generated by IMPC, demonstrating the impact of the project on the research and clinical communities, and IMPC data is incorporated into other resources, such as MGI, Open Targets, and UniProt. Data release (DR23.0, 2025) contains >100 million data points from 9277 genes and identified 113 803 significant phenotypes. To manage efficient access to this quantity of high dimensional data the IMPC web portal has been rebuilt using a cloud native architecture. The modern user interface retains the look and feel of the original portal with improvements identified through a usability study. New data visualization and training materials for large scale data access through the API have also been developed to make the resource easier to use.",Wilson R; Bülbül Ataç T; Cheng TK; Frost A; Güneş O; Kan M; Keskivali-Bond P; López Gómez F; McLaughlin J; Mucha J; Munava T; Oliveira C; Pava D; Peña Estrada JF; Selkirk E; Vardal B; Wells S; Cacheiro P; Smedley D; Parkinson H,"European Molecular Biology Laboratory, European Bioinformatics Institute, Welcome Genome Campus, Hinxton CB10 1SD, United Kingdom.",Nucleic acids research,2025-11-13,10.1093/nar/gkaf1148,3.0,visualization(abstract); visual(abstract); data(abstract),
41217993,Practical Status of Endoscopic Duodenal Observation and Clinical Relevance of Systematic Photo-Documentation Protocol: A Questionnaire Survey.,"<h4>Introduction</h4>Early detection of duodenal neoplasms is crucial because of the complications associated with their treatment and their increasing recognition. However, standardised protocols for duodenal observation during screening esophagogastroduodenoscopy (EGD) have not been established. This study was performed to survey the current practical status of duodenal observation and to evaluate the clinical relevance of our systematic photo-documentation protocol, known as the Seven Pictures Rule (7PR).<h4>Methods</h4>A cross-sectional survey using a web-based self-administered questionnaire was conducted among endoscopists in a regional area of Japan. The questionnaire included items on respondents' professional background, duodenal observation practices during screening EGD (observed locations, observation time, ampulla visualization, and patient discomfort), as well as awareness, application, and perceived effects of the 7PR, and preferences for future protocols. Data were anonymized and analyzed descriptively.<h4>Results</h4>Of the 99 endoscopists included, 96.7% reported observing the duodenum based on their own individual methods. The intentional observation rates by location were highest in the following order: bulb (99%), ampulla in descending (94%), contralateral ampulla in descending (84%), superior duodenal angle (77%), contralateral superior duodenal angle (79%), and transverse duodenum (33%). However, only 14% of respondents reported successfully observing the ampulla in more than 75% of cases. While 62% were aware of the 7PR, only one-fourth had implemented it in practice. Notably, 43% of respondents familiar with the 7PR felt that it had led to an increased detection of duodenal neoplasms.<h4>Conclusions</h4>Current duodenal observation practices vary among endoscopists. The establishment of a systematic photo-documentation protocol such as the 7PR may serve as a useful strategy for improving the detection of duodenal neoplasms. Further optimisation of the protocol is warranted to support broader adoption in clinical settings.",Matsui T; Kozuka K; Kawanishi R; Nakatani K; Koyama Y; Nishiyama N; Yachida T; Oryu M; Wato M; Kobara H,,Digestion,2025-11-11,10.1159/000549502,3.0,visualization(abstract); visual(abstract); data(abstract),
41217626,"Nonclinical investigations of a novel heart-type fatty acid-binding protein ligand, [&lt;sup&gt;18&lt;/sup&gt;F]LUF: three-lot process validation, safety assessment, and radiation dosimetry.","<h4>Background</h4>Heart-type fatty acid-binding protein (FABP3) mediates the intracellular transport of fatty acids and is highly expressed in the myocardium. During myocardial infarction, FABP3 leaks from the myocardial cytoplasm into the blood; thus, detection of FABP3 using positron emission tomography (PET) is useful in identifying the site of myocardial damage. 4-(4-Fluoro-2-(1-phenyl-5-(2-(trifluoromethyl)phenyl)-1H-pyrazol-3-yl)phenoxy)butanoic acid (LUF) is a small-molecule organic compound that specifically binds FABP3. We confirmed that fluorine-18-labeled LUF enables clear, high-quality visualization of the myocardium as well as lesions associated with myocardial injury. In this study, we performed a process validation of [<sup>18</sup>F]LUF production for clinical use and evaluated its nonclinical toxicity and radiation dosimetry estimates using mouse biodistribution data.<h4>Results</h4>The activity yield of [<sup>18</sup>F]LUF at the end of synthesis was > 8 GBq, with > 99% radiochemical purity, > 500 GBq/μmol molar activity, and < 1.5 μg/185 MBq total chemical content. All process validation batches complied with the product specifications. An extended single-dose intravenous toxicity study in male and female Sprague-Dawley rats indicated a no-observed adverse effect level for LUF and decay-outed [<sup>18</sup>F]LUF injection solution of ≥ 25 μg/kg and ≥ 2.5 mL/kg, respectively. These doses are > 100 times the postulated maximum dose of LUF (0.25 μg/kg) and [<sup>18</sup>F]LUF injection solution (370 MBq). Reverse mutation tests were negative for LUF and the OH form produced after β-decay of [<sup>18</sup>F]LUF. Neither LUF nor the OH form exhibited cardiotoxicity toward cardiomyocytes derived from human induced pluripotent stem cells at > 100 times the postulated maximum dose. Biodistribution study results demonstrated predominantly hepatobiliary excretion of radioactivity. The most critical organ affected was the heart wall (68.6 μGy/MBq). The estimated effective dose was calculated as 10.2 μSv/MBq. These radiation exposure doses are equivalent to 25.4 mGy (heart wall) and 3.78 mSv for a planned maximum dose of 370 MBq.<h4>Conclusions</h4>[<sup>18</sup>F]LUF shows acceptable pharmacological safety at the dose required for adequate PET imaging. The potential risks associated with [<sup>18</sup>F]LUF injection are well within the acceptable dose limits.",Toyohara J; Ito M; Sakata M; Tago T; Komoda T; Yoshino H,"Research Team for Neuroimaging, Tokyo Metropolitan Institute for Geriatrics and Gerontology, 35-2 Sakae-cho, Itabashi-ku, Tokyo, 173-0015, Japan. toyohara@pet.tmig.or.jp.",EJNMMI radiopharmacy and chemistry,2025-11-11,10.1186/s41181-025-00404-0,3.0,visualization(abstract); visual(abstract); data(abstract),Positron emission tomography; toxicology; Dosimetry; Fluorine-18; Heart-type Fatty Acid–binding Protein
41217854,Evaluation of vessel tracking and 3D roadmapping software for endovascular treatment of brain arteriovenous malformations.,"Endovascular treatment of brain arteriovenous malformations (AVMs) is complex due to the intricate angioarchitecture, requiring accurate identification of feeding arteries, draining veins, and the nidus. While 3D digital subtraction angiography (DSA) aids visualization, it lacks vessel-specific segmentation. Embo ASSIST (GE HealthCare, USA) is a software designed to enhance procedural planning and real-time guidance through automatic segmentation and 3D roadmap visualization. This study evaluates the feasibility and clinical utility of Embo ASSIST in brain AVM embolization, focusing on its impact on procedural planning, navigation, radiation exposure, and contrast media use. A retrospective analysis of 19 procedures in 14 patients was conducted between February and August 2021. Images from biplane DSA and cone-beam computed tomography (CBCT) were processed with Embo ASSIST for vascular segmentation. A structured survey, rated by two senior neuroradiologists, assessed the software's effectiveness. Results showed Embo ASSIST improved procedural planning, with a better understanding of angioarchitecture (3.8/5), pedicle definition (3.9/5), and embolization pathway selection (3.9/5). It allows a reduction of contrast media use (3.7/5), radiation exposure (3.8/5), and procedure time (3.8/5) according to the operators. The software was highly rated for ease of use (3.8/5), CBCT processing speed (4.2/5), and integration with fluoroscopic navigation (4.3/5). However, vein segmentation was limited (3.0/5), requiring manual corrections. In conclusion, Embo ASSIST significantly improved AVM embolization procedures, enhancing visualization, navigation, and efficiency. Future advancements in venous segmentation and AI-based dynamic vessel analysis could optimize treatment further.",Loukoul WA; Bracard S; Trousset Y; Jugnon V; Zhu F; Anxionnat R,"Service de Neuroradiologie Diagnostique et Thérapeutique, CHRU de Nancy, Nancy, France.","Interventional neuroradiology : journal of peritherapeutic neuroradiology, surgical procedures and related neurosciences",2025-11-11,10.1177/15910199251348276,2.5,visualization(abstract); visual(abstract),Endovascular treatment; Embolization; Interventional Neuroradiology; Vessel Segmentation; Brain Avm; 3D Digital Subtraction Angiography; Virtual Injection Software
41235636,Global trends in the uptake of specialist diagnostic ultrasound and MRI scans for endometriosis: An international cross-sectional survey.,"Endometriosis affects 1 in 10 women globally. We aimed to determine health provider involvement and preferred methods of obtaining an endometriosis diagnosis across international jurisdictions. A global cross-sectional survey, distributed through formal and informal FIGO Reproductive Medicine, Endocrinology, and Infertility (REI) committee networks from September through October 2024. A total of 445 respondents from 76 countries began the survey, with 360 completions. Of the respondents, 63.9% were female, with most being gynecologists. Academics and/or researchers comprised 6.7%, with 39.2% involved in research in some capacity. Endometriosis was largely diagnosed by gynecologists (95.0%), with most respondents overall describing ultrasound as the most common method of diagnosis (77.8%). Of those surveyed, 93.6% stated clinicians in their country used non-invasive imaging (predominantly ultrasound) to diagnose endometriosis before surgery. One third of respondents did not feel confident distinguishing between routine gynecological scans and specialist endometriosis imaging. Significant barriers for uptake of imaging diagnostics included access to training, cost, and geographical accessibility. Regarding adoption of non-invasive imaging in clinical care, ""game-changing"" effects were described, including improvements in surgical preoperative mapping, and patient-centered care, with concerns that it could increase clinical workloads. Significantly, shifts in endometriosis diagnosis, from visualization of lesions at laparoscopy to non-invasive imaging diagnostics, were observed internationally. Policies should aim to overcome barriers to uptake of imaging-based diagnostics by supporting training initiatives, reducing associated costs, and improving geographical accessibility. Respondents predicted transformative changes in endometriosis care once non-invasive endometriosis diagnostics are effectively adopted.",Avery JC; Fragkoudi A; Deslandes A; Nelson SM; Henry L; Bhardwaj A; Topcu EG; Tulandi T; Malhotra J; Feldberg D; Barnea E; Purandare N; Mocanu E; Leonardi M; Hull ML; ,"Robinson Research Institute, University of Adelaide, Adelaide, South Australia, Australia.",International journal of gynaecology and obstetrics: the official organ of the International Federation of Gynaecology and Obstetrics,2025-11-14,10.1002/ijgo.70666,2.5,visualization(abstract); visual(abstract),Diagnosis; Radiography; Endometriosis; sonography; ultrasound; Magnetic Resonance Imaging; laparoscopy; Gynecology
