pmid,title,abstract,authors,first_author_affiliation,journal,pub_date,doi,score,matched_keywords,api_keywords
41447821,Nanoplatform-Enhanced Photodynamic Therapy in Head and Neck Squamous Cell Carcinoma: Advances and Future Directions.,"<h4>Introduction and aims</h4>Photodynamic therapy (PDT) has become a promising treatment for head and neck squamous cell carcinoma over the past 25 years, with nanotechnology accelerating its development. This study aimed to systematically map research trends, thematic evolutions, and technological advances in nano-enhanced PDT for head and neck squamous cell carcinoma.<h4>Methods</h4>A bibliometric and trend analysis was performed on 736 English-language publications from January 2000 to June 2025, sourced from the Web of Science Core Collection. CiteSpace/VOSviewer, BICOMB, gCLUTO, and related visualization tools were applied to analyse global research contributions, collaboration networks, keyword clusters, and technological breakthroughs.<h4>Results</h4>Annual publications increased from fewer than 30 (2000-2011) to over 50 (2022-2025), with China, the United States, and the United Kingdom as leading contributors. International collaborations have become more multipolar over time. Three major thematic clusters emerged: (1) fundamental PDT mechanisms, (2) nano-enhanced delivery systems and modulation of the tumour microenvironment, and (3) multimodal combination therapies. Recent growth in publications has been driven by nanoplatforms employing passive and active tumour targeting, along with oxygen-generating strategies.<h4>Conclusion</h4>Although nano-enhanced PDT has achieved substantial preclinical progress, its clinical translation remains limited by manufacturing variability, regulatory uncertainty, and cost-effectiveness concerns. Progress will require well-designed multicentre trials, standardized nanomaterial characterization, and early incorporation of health-economic evaluation. By charting the integration of nanotechnology into PDT and identifying opportunities for synergistic and theranostic approaches, this research provides a structured reference to support future clinical translation.<h4>Clinical relevance</h4>Nano-enhanced PDT holds strong potential to improve treatment precision, reduce side effects, and address resistance in HNSCC, offering new strategies for both early-stage lesions and advanced tumours. By clarifying global research patterns and identifying key innovation areas, this study supports more effective clinical translation and evidence-based adoption of nano-enhanced PDT into head and neck cancer care pathways.",Zhang W; Gan M; He Y; Ma W; Liu S; Liu D,"Department of Emergency and Oral Medicine, School and Hospital of Stomatology, China Medical University, Liaoning Provincial Key Laboratory of Oral Diseases, Shenyang, Liaoning, China.",International dental journal,2025-12-24,10.1016/j.identj.2025.109348,2.5,visualization(abstract); visual(abstract),Cancer therapy; Photodynamic therapy; Nanotechnology; Head And Neck Squamous Cell Carcinoma; Tumour Microenvironment
41448444,Cross-modal image generation with uncertainty quantification from echo cardiogram to MRI.,"Medical imaging is fundamental to cardiovascular diagnostics, with modalities such as Transthoracic Echocardiography (TTE) and Cardiac Magnetic Resonance (CMR) offering complementary strengths. TTE provides real-time, non-invasive visualization of cardiac function but is often limited by operator dependency and incomplete views. In contrast, CMR delivers comprehensive, high-resolution structural assessments, although it comes with greater time and cost burdens. To address these limitations, this study explores cross-modal generative modeling techniques for synthesizing CMR-like images directly from TTE. We propose a novel architecture that combines a UNet backbone with a vision transformer, utilizing UNet for feature extraction and the transformer for global attention to improve image synthesis quality. Quantitative and qualitative evaluations demonstrate the model's ability to produce realistic and anatomically consistent CMR images, with strong potential to improve diagnostic accuracy and clinical decision-making with multiple image modalities.",Choudhury ZZ; Dey S; Wang H; Coffey S; Chakraborti T; McCane B,"School of Computing, University of Otago, New Zealand.","Methods (San Diego, Calif.)",2025-12-23,10.1016/j.ymeth.2025.12.012,2.5,visualization(abstract); visual(abstract),MRI; Echocardiography; Generative Ai
41444686,The eye-mind connection: a systematic review of retinal biomarkers and ocular signatures in major psychiatric disorders.,"<h4>Background</h4>Psychiatric disorders such as schizophrenia, bipolar disorder, major depression, and dementia are increasingly associated with specific ocular and retinal abnormalities. These associations may reflect shared neurovascular, inflammatory, and neurodegenerative mechanisms, yet findings remain scattered and understudied. This systematic review synthesizes existing evidence on ocular and retinal pathologies across major psychiatric conditions, highlighting common retinal biomarkers that may inform future screening strategies.<h4>Methods</h4>Following PRISMA 2020 guidelines, a systematic search of PubMed, Scopus, Web of Science, and Embase was conducted. Meta-analysis was initially planned but deemed infeasible due to significant methodological and reporting heterogeneity among eligible studies. Therefore, a structured qualitative synthesis was performed, supported by visual mapping of cross-disorder associations.<h4>Results</h4>Seventeen studies met inclusion criteria, covering major psychiatric conditions including schizophrenia, bipolar disorder, depression, and dementia. Across these disorders, approximately three-quarters of schizophrenia studies (≈75%) reported retinal nerve fiber layer (RNFL) thinning, and two-thirds of dementia studies (≈67%) showed retinal vascular abnormalities or RNFL loss. Glaucoma and dry eye syndrome were the most frequently observed in mood disorders, whereas microvascular dropout was reported in optical coherence tomography angiography (OCT-A) analyses of depression and bipolar disorder. The heatmap visualization highlighted overlapping neuro-ophthalmic signatures, and retinal biomarker analysis identified RNFL thinning and microvascular dropout as potential shared indicators of disease burden.<h4>Conclusion</h4>This review emphasizes the emerging evidence for retinal biomarkers as accessible correlates of neuropsychiatric pathology. Although quantitative synthesis was not feasible, the qualitative patterns highlight the need for large-scale, prospective, and biomarker-validation studies integrating ophthalmology and psychiatry. These findings underscore the clinical potential of the brain-retina axis in mental health diagnostics.",Motamedi R; Hayeri Mehrizi F; Zeinali Ali Abadi M; Mohagheghi M; Nourollahi Fomeshi F; Mousavikhah SE; Ghaffarzadeh A; Yaghmayee S; Arab Bafrani M; Sadat Rafiei SK; Shafiei D; Asadi Anar M; Khosravi F; Faizabadi S; Bozorgi M; Saien S,"Faculty of Medicine, Hamadan University of Medical Sciences, Hamadan, Iran.",European journal of medical research,2025-12-24,10.1186/s40001-025-03664-3,2.5,visualization(abstract); visual(abstract),Schizophrenia; glaucoma; Dementia; Systematic review; Bipolar disorder; Psychiatric Disorder; retinal nerve fiber layer; Ocular Pathology
41424166,Ultrasound Guidance to Augment Needle Electromyography Precision in the Complex Nerve Injury Setting.,"The rise in popularity of nerve transfer surgery in individuals with peripheral nerve and spinal cord injuries has elevated the importance of the preoperative electrodiagnostic examination. Needle electromyography (EMG) provides peripheral nerve surgeons with precise information about donor and recipient muscle health, aiding in decisions regarding surgical options, donor muscle viability, and timing of intervention. However, traditional anatomical landmarks for typical donor and recipient nerve-muscle combinations in nerve transfer surgery are either not well described in the literature or become less dependable in the presence of contracture, spasticity, or muscle atrophy and fibrosis. Ultrasound (US) can be a valuable tool to augment the needle EMG examination. Herein, we describe US approaches to improve the precision of the needle EMG examination for 10 muscles in the upper extremity and two muscles in the lower extremity that are routinely involved as either donors or recipients in nerve transfer surgery. The purpose is to provide a reference guide for the electrodiagnostic medicine specialist in the complex nerve injury setting. This includes information on surrounding anatomical structures for localization and those that should be avoided. Relevant US principles for EMG are discussed including: (1) the advantages and disadvantages of short-axis and long-axis views of the target muscle, emphasizing the predominant use of short-axis for adequate visualization of all surrounding structures and enhancing patient safety, (2) in-plane versus out-of-plane approaches, and (3) enhancing confidence in the precision of the needle EMG via the dynamic capability of US.",Saddler N; Ro H; Bristol S; Khayambashi S; Berger MJ,"Division of Physical Medicine & Rehabilitation, Department of Medicine, University of British Columbia, Vancouver, British Columbia, Canada.",Muscle & nerve,2025-12-22,10.1002/mus.70100,2.5,visualization(abstract); visual(abstract),Spinal cord injury; Peripheral nerve injury; ultrasound; Needle Electromyography; Nerve Transfer Surgery
41450179,Peri-implantitis pathogenesis: Novel insights may guide therapeutic interventions.,"<h4>Background</h4>This narrative review expands on the concept of inflammation created by metal particles and ions that originate from dental implants and suggests preventative and therapeutic approaches to reduce the problem.<h4>Review</h4>A review and discussion of various etiologic factors for peri-implant mucositis and peri-implantitis are presented, including: foreign body response to embedded residual cement or metal particles or ions, corrosion of the titanium oxide (TiO) layer, tribocorrosion, human and animal histology and studies, treatments, prevention, and maintenance.<h4>Conclusions</h4>The understanding of etiologic factors for peri-implant mucositis and peri-implantitis and their effect on treatment is an evolving science. Biofilm remains a primary etiologic factor. However, a foreign body response from residual cement or metal particles or ions (i.e., metallosis) has been implicated in the onset and progression of peri-implantitis. While further elucidation of risk factors is appropriate, the treatment adaptations needed to reduce metallosis are simple and easy to apply and should be considered for inclusion in routine diagnosis, therapy, and maintenance.<h4>Plain language summary</h4>Concepts regarding the etiology and management of inflammatory lesions around dental implants continue to evolve. While bacterial biofilm is widely recognized as the primary etiologic factor, additional contributors such as excess cement and metallic particles acting as foreign bodies have been increasingly emphasized in the literature. These foreign materials act synergistically with biofilm to amplify the inflammatory response. Ions and particles released from implant surfaces can initiate an immunoinflammatory cascade, ultimately resulting in peri-implant bone loss, a process referred to as metallosis. Unlike the removal of excess cement, which can often be mitigated through judicious cementation techniques or, preferably, the use of screw-retained restorations, the reduction of metallic particles presents greater clinical challenges. Such particles may originate from biofilm-induced corrosion, occlusal overload, or even therapeutic interventions aimed at treating peri-implant inflammation. Minimally invasive strategies have been proposed to address these challenges. Approaches such as the careful use of cotton pellets with sterile saline, and when indicated, the application of minimally invasive flaps under enhanced visualization, have shown promise in reducing the burden of foreign particles. Importantly, stringent oral hygiene measures and consistent maintenance therapy remain indispensable in mitigating these risks and maintaining peri-implant health.",Wilson TG Jr,"Private Practice of Periodontics, Dallas, Texas, USA.",Journal of periodontology,2025-12-26,10.1002/jper.70037,2.5,visualization(abstract); visual(abstract),
41450711,Insights and Constraints: Understanding the Boundaries in Investigating Otosclerosis and Endolymphatic Hydrops Interaction.,"Otosclerosis and endolymphatic hydrops (EH) are distinct inner ear pathologies that may coexist within the same temporal bone, creating diagnostic and therapeutic challenges. Their interaction remains controversial, with proposed mechanisms suggesting that otosclerotic involvement of the vestibular aqueduct or cochlear endosteum may obstruct endolymphatic flow, leading to secondary hydrops. This review summarizes current evidence on the coexistence, pathophysiology, diagnostic tools, and clinical implications of otosclerosis-associated EH. Histopathologic studies have demonstrated EH adjacent to otosclerotic foci involving the cochlear endosteum and the vestibular aqueduct, supporting a mechanical or metabolic interaction between both entities. Advances in magnetic resonance imaging, particularly gadolinium-enhanced 3D-fluid-attenuated inversion recovery (FLAIR) sequences, have allowed in vivo visualization of cochlear and vestibular hydrops, improving diagnostic accuracy and enabling earlier detection of mixed pathology. Clinically, affected patients often exhibit mixed or fluctuating hearing loss, tinnitus, and vertigo, suggesting both cochlear and vestibular compromise. Post-stapedectomy EH has also been described, likely secondary to altered perilymphatic pressure or microtrauma. Despite growing evidence supporting an association, the causal relationship remains uncertain - whether EH arises as a secondary consequence of otosclerosis or represents a concurrent process within a shared pathophysiological spectrum. The coexistence of EH and otosclerosis exemplifies the complexity of inner ear disorders, highlighting the need for integrated approaches combining imaging, audiovestibular testing, and histopathologic correlation. Multidisciplinary collaboration and longitudinal studies are essential to clarify underlying mechanisms, refine diagnostic criteria, and optimize management strategies for patients with combined otosclerotic and hydropic pathology.",Castillo-Bustamante M; Guajardo-Vergara C; Armato E,"Otolaryngology, Clinica Universitaria Bolivariana, Medellín, COL.",Cureus,2025-12-23,10.7759/cureus.99962,2.5,visualization(abstract); visual(abstract),Otosclerosis; Peripheral Vertigo; Vestibular Disorders; Vestibular Assessment; Anatomy & Physiology
41431455,Miniaturized device for assessing calcification propensity of biohybrid implants under continuous flow.,"Biohybrid implants are a promising development for cardiovascular disease treatment but suffer from problems like thrombogenesis and calcification. However, testing and validating biohybrid implants can be difficult and expensive due to material handling, fabrication methods and specialty medium components. The devices used to test potential samples can be large and expensive, requiring significant amounts of cell culture medium to operate. Additional, conventional static cell culture conditions do not accurately represent the vascular environment as shear and mechanical forces play key roles in the development of calcification. To address these challenges, a miniaturized, dual-channel flow chamber was designed and validated that allowed for real-time visualization of biohybrid calcification in a physiological environment. Computational fluid dynamics simulations were performed to determine the flow characteristics that generated physiological shear stress homogeneously across the sample surface. Micro particle tracking velocimetry measurements validated the simulated shear stresses near the sample surface. Two implant materials used for biohybrid construction, bovine pericardium and polycarbonate urethane, were inserted in the device and exposed to a flowing calcification medium for 14 days. Fluorescent fetuin-A was introduced into the calcification medium for real-time calcification monitoring. The two materials were compared with matched samples calcified in a large fatigue tester for 14 days. Our results showed similar material calcification for bovine pericardium and no calcification for polycarbonate urethane in the large fatigue tester and in our newly developed device. Biohybrid textile-reinforced fibrin-based scaffold populated with vascular smooth muscle cells started to calcify over 7 days in calcification medium. We conclude that this platform will provide novel insights into the origin and progression of pathological calcification and its potentially harmful health effects, which can occur as a result of tissue or metabolic abnormalities, disease, or implantation of certain biomaterials, by providing the ability to monitor the progression of calcification in biohybrid implants in real time, while also minimizing the cost and size of samples and reagents required for testing.",Morgan AD; Dzhanaev R; Gorgels A; Ritter J; Clauser JC; Stockmeier F; Stüwe L; Böhm C; Jockenhoevel S; Steinseifer U; Jahnen-Dechent W,"Helmholtz Institute for Biomedical Engineering, Biointerface Lab, RWTH Aachen University Hospital, Aachen, Germany. willi.jahnenrwth-aachen.de.",Lab on a chip,2025-12-23,10.1039/d5lc00742a,2.5,visualization(abstract); visual(abstract),
41423523,Occult spinal CSF leak: to patch or not to patch-a case-based update.,"<h4>Purpose</h4>Spontaneous intracranial hypotension (SIH) is a rare condition in the pediatric population with a classic clinical presentation of severe orthostatic headaches that improve when the patient is lying down. The cause of SIH is cerebrospinal fluid (CSF) leakage either around the brain or spinal cord. When working up a patient with suspected SIH, an MRI is done, which aims to visualize the location of the leak. Visualization of the leak on imaging confirms the diagnosis of SIH and can guide localized treatments like epidural blood patch (EBP) or surgery. There has never been a reported case of a pediatric patient that presents with classic symptoms of SIH but shows completely normal findings on brain and spine imaging. Cases of adult occult SIH (oSIH) have been successfully treated with an empiric EBP; however, the use of an empiric EBP in a child with suspected oSIH has not been reported before.<h4>Methods</h4>We describe the clinical features and management of a pediatric patient with an oSIH. A literature review was done for English articles, using PubMed, to identify previously reported cases of SIH and oSIH treated with empiric EBP.<h4>Results</h4>A 9-year-old patient presented with worsening severe orthostatic headaches, nausea, phonophobia, a sensation of ear fullness, slight cognitive changes, and complete resolution of headaches when laying down. She received multiple MRIs of the brain and spine, which all found no abnormalities. She was treated for suspected post-viral syndrome and later for suspected migraines but had brief to no symptomatic relief. Her pain continued to worsen, debilitating her and causing her family distress. After being referred to our clinic, she was diagnosed with an oSIH and was treated with an empiric lumbar EBP. The patient made a profound recovery with a complete and sustained resolution of her symptoms. This shows the first pediatric case of a clinically suspected occult CSF leak with normal brain and spinal imaging, that was treated successfully with an empiric EBP after conservative treatments failed.<h4>Conclusion</h4>While epidural blood patch has become a routine treatment option for SIH and a proven treatment in adult oSIH, its use in pediatric oSIH is still unclear due to the rarity of this disease. This case shows that an empiric EBP is a viable treatment option in pediatric oSIH. In situations where clinical suspicion for oSIH is high, empiric EBPs should be considered, since they have a relatively low procedural risk and can offer sustained and significant symptomatic improvement.",Wang J; Thomé AP; Brook AL; Ronda JC; Kobets AJ,"Albert Einstein College of Medicine, Bronx, NY, USA. jiashu.wang@einsteinmed.edu.",Child's nervous system : ChNS : official journal of the International Society for Pediatric Neurosurgery,2025-12-22,10.1007/s00381-025-07094-8,2.5,visualization(abstract); visual(abstract),Pediatric; Case Report; Cerebrospinal Fluid Leak; Epidural Blood Patch; Spontaneous Intracranial Hypotension
41423759,Radiologic Prevalence of the Round Window Niche Veil in a Japanese Cohort Using Ultra-High-Resolution Photon-Counting Detector CT.,"<h4>Objective</h4>To determine the in vivo radiological prevalence of the round window niche veil (RWNV) using the ultra-high-resolution (UHR) mode of photon-counting detector computed tomography (PCD-CT) and to assess variations in its prevalence across different age groups in a Japanese cohort.<h4>Patients</h4>This retrospective study analyzed temporal bone PCD-CT scans from 191 consecutive patients (382 temporal bones), aged 0 to 79 years. After excluding temporal bones with middle ear opacification or prior surgery, 261 temporal bones were included in the final analysis.<h4>Intervention</h4>All imaging was performed on a clinical dual-source PCD-CT scanner using a standardized, noncontrast UHR protocol.<h4>Main outcome measures</h4>The presence of an RWNV was evaluated based on established radiologic criteria, requiring visualization of the characteristic soft-tissue shadow on both axial and coronal reformatted images. The primary outcome was the radiologic prevalence of the RWNV, calculated for the entire cohort and stratified by decadal age groups.<h4>Results</h4>An RWNV was identified in 66 of 261 temporal bones, yielding an overall prevalence of 25.3% (95% CI: 20.4%-30.9%). Prevalence varied across age groups, ranging from 5.3% (30-39 y) to 33.3% (40-49 y), but no consistent monotonic trend was observed with advancing age.<h4>Conclusions</h4>This study provides the first large-scale, in vivo quantification of RWNV radiologic prevalence using UHR PCD-CT. The findings establish this advanced imaging modality as a valuable tool for noninvasively identifying this anatomic barrier, which has significant implications for predicting and potentially improving the efficacy of intratympanic drug delivery for inner ear disorders.",Sakaida H; Ichikawa Y; Yamazaki A; Sakuma H,Department of Otorhinolaryngology-Head and Neck Surgery.,"Otology & neurotology : official publication of the American Otological Society, American Neurotology Society [and] European Academy of Otology and Neurotology",2025-12-22,10.1097/mao.0000000000004804,2.5,visualization(abstract); visual(abstract),Imaging diagnosis; Photon-counting Detector Computed Tomography; Round Window Niche Veil
41442402,Characteristics of women Veterans with incident breast and gynecologic cancers in the Veterans Health Administration.,"<h4>Background</h4>There is an increase in breast and gynecologic cancer cases treated within Veterans Health Administration (VHA).<h4>Objectives</h4>To describe the age and race of Veteran women diagnosed with breast and gynecologic cancers in VHA and compare with U.S. women broadly.<h4>Design</h4>Retrospective, cross-sectional study.<h4>Methods</h4>We obtained data from January 1, 2021 to March 12, 2024 from the Breast and Gynecologic Oncology System of Excellence (BGSoE) dashboard and for women covered in the 2021 Surveillance, Epidemiology, and End Results (SEER) program.<h4>Results</h4>In the Veteran cohort (<i>n</i> = 6555), the median age is 59 and 58 years for breast and gynecologic cancers, respectively. ~52% (<i>n</i> = 2586) of breast cancers are diagnosed among non-Hispanic Whites, ~30% (<i>n</i> = 1519) among non-Hispanic Blacks, and 6% (<i>n</i> = 301) among Hispanics. For gynecologic cancers, ~58% (<i>n</i> = 897) are diagnosed among non-Hispanic Whites, ~23% (<i>n</i> = 359) among non-Hispanic Blacks, and ~7% (<i>n</i> = 108) among Hispanics.<h4>Conclusions</h4>Compared to SEER, women Veterans are diagnosed at younger ages and have similar racial composition.",Zullig LL; Shepherd-Banigan M; Cummin GL; Berkowitz TS; Melamed A; Weidenbacher H; Bayley EM; Colonna S; Hulen E; Patil V; Halwani A; Kelley MJ; Moss H,"Center of Innovation to Accelerate Discovery and Practice Transformation, Durham VA Health Care System, NC, USA.","Women's health (London, England)",2025-12-24,10.1177/17455057251399013,2.0,dashboard(abstract); data(abstract),Cancer; Women; Veterans
