pmid,title,abstract,authors,first_author_affiliation,journal,pub_date,doi,score,matched_keywords,api_keywords
40764684,User-centered design approach to visualize PROMs for molecular tumor boards.,"Integrating Patient-Reported Outcome Measures (PROMs) into Molecular Tumor Boards (MTBs) remains challenging due to the complexity of data visualization and integration into clinical workflows. This work, as part of the German PM4Onco project, aims to identify visualization requirements for PROMs and develop a prototype for PROMs integration in cBioPortal, facilitating broader application within oncology care. We employed a qualitative research approach, including developing personas for MTB stakeholders, conducting a literature-based requirements analysis, organizing a co-design workshop to create low-fidelity prototypes, and evaluating the highest-rated prototype variant through an online survey distributed to MTB physicians across Germany. Seven specialist groups were identified, with key needs including intuitive visualization, clear axis labeling, and longitudinal symptom tracking. The resulting mid-fidelity mockup incorporated PROMs data within cBioPortal's timeline view and a detailed PROMs tab, featuring trend indicators, line graphs, and customizable health displays. Usability evaluation by MTB members yielded a SUS score of 67, indicating an initial indicator of acceptable usability, with suggestions for improvements like threshold scores and deeper clinical data integration. While PROMs offer critical patient insights, they remain underused in MTBs. Our early-stage prototype demonstrates potential for addressing this gap, with future work focusing on implementation, broader testing, and international validation.",Bäcker S; Sedlmayr B; Goldammer M; Schuler K; Zerlik M; Strantz C; Unberath P; Gräßel L; Sedlmayr M; Wolfien M,"Institute for Medical Informatics and Biometry, Faculty of Medicine and University Hospital Carl Gustav Carus, TUD Dresden University of Technology, Dresden, Germany. sara.baecker@tu-dresden.de.",NPJ precision oncology,2025-08-05,10.1038/s41698-025-01061-x,4.6,"visualization(abstract); visual(title,abstract); data(abstract)",
40779763,Optimizing Cardiovascular Risk Management in Primary Care Using a Personalized eCoach Solution Enhanced by an Artificial Intelligence-Driven Clinical Prediction Model: Protocol from the Coronary Artery Disease Risk Estimation and Early Detection Consortium. ,"Atherosclerotic cardiovascular disease poses a heavy burden on the population's health and health care costs. Identifying apparently healthy individuals at risk of developing cardiovascular diseases using clinical prediction models raises awareness, facilitates shared decision-making, and supports tailored management of disease prevention. In the CARRIER project, a personalized cardiovascular risk management (CVRM) eCoach approach is cocreated, in which identified individuals receive education, guidance, and monitoring to prevent atherosclerotic cardiovascular disease through existing interventions. In this approach, an artificial intelligence-driven clinical prediction model calculates the 10-year risk for atherosclerotic cardiovascular disease, which supports informed decision-making. This study aims to assess the effectiveness of our CVRM eCoach approach through a 10-year risk calculation of atherosclerotic cardiovascular disease, including risk factors contributing to this risk. This pretest-posttest interventional study provides the CVRM eCoach approach for 6 months to 100 apparently healthy individuals eligible for CVRM. The CVRM eCoach approach is a multicomponent eHealth solution, including a clinical prediction under intervention model that not only calculates the 10-year risk of cardiovascular disease through conventional risk factors (smoking, blood pressure, and lipid profile) and individual characteristics (age, gender, socioeconomic status, physical activity, and diet) but also calculates how the risk changes after hypothetical lifestyle or medical interventions. The CVRM eCoach approach includes features that encourage behavior change. Most of these features include goal setting, decision cards to help decide on an intervention, intervention monitoring, remote communication, and education, all accessible from one dashboard. A practice nurse or physician consults the individuals after risk calculation with the clinical prediction model and uses behavior change features, such as the decision cards, to support shared decision-making. Data are primarily collected via the eCoach, after which the 10-year risk for atherosclerotic cardiovascular disease and its components are analyzed using paired-sample analyses. Recruitment began in March 2024 and will continue until 100 participants have been recruited, which is expected in 2025. We anticipate that our CVRM eCoach approach will be valuable in the primary prevention setting. During the crucial initial first months of habit formation, factors such as education, regular check-ups via the eCoach, and clear risk communication could support individuals in sustaining their medical or lifestyle interventions. We hypothesize that there will be a slight to moderate reduction in the 10-year risk of atherosclerotic cardiovascular disease, which over time will lead to significant health improvements on a larger scale. CCMO NL84584.096.23; https://onderzoekmetmensen.nl/nl/trial/56578.",van Mierlo R; Scheenstra B; Verbeek J; Bruninx A; Kalendralis P; Bermejo I; Dekker A; van 't Hof A; Spreeuwenberg M; Hochstenbach L,"Department of Cardiology, Cardiovascular Research Institute Maastricht (CARIM), Maastricht University, Maastricht, The Netherlands.",JMIR research protocols,2025-08-08,10.2196/66068,4.6,"dashboard(abstract); artificial intelligence(title,abstract); data(abstract)",
40773491,StatModPredict: A user-friendly R-Shiny interface for fitting and forecasting with statistical models.,"<h4>Background</h4>Many disciplines, such as public health, rely on statistical time series models for real-time and retrospective forecasting efforts; however, effectively implementing related methods often requires extensive programming knowledge. Therefore, such tools remain largely inaccessible to those with limited programming experience, including students training in modeling, as well as professionals and policymakers seeking to forecast an epidemic's trajectory. To address the need for accessible and intuitive forecasting applications, we present StatModPredict, an R-Shiny dashboard for conducting robust forecasting analysis utilizing auto-regressive integrated moving average (ARIMA), generalized linear models (GLM), generalized additive models (GAM), and Meta's Prophet model.<h4>Methods</h4>StatModPredict supports robust real-time forecasting and retrospective model analysis, including fitting, forecasting, evaluation, visualization, and comparison of results from four popular models. After loading an incident time series data set into the interface, users can easily customize model parameters and forecasting options to obtain the desired output. Additionally, StatModPredict offers multiple editable figures for, but not limited to, the time series data, the forecasts, and model fit and forecast metrics. Users can also upload external forecasts produced elsewhere and evaluate their performance alongside the dashboard's built-in models, thereby enabling direct comparisons. We provide a detailed demonstration of the dashboard's features using publicly available annual HIV case data in the US. A video tutorial is available at https://www.youtube.com/watch?v=zgZOvqhvqw8.<h4>Conclusions</h4>By eliminating programming barriers, StatModPredict facilitates exploration and use by students training in forecasting, as well as professionals and policymakers aiming to forecast epidemic trajectories. Additionally, the flexibility in the required input data structure and parameter specification process extends the application of StatModPredict to any discipline that employs time series data. By offering this open-source interface, we aim to broaden access to forecasting tools, promote hands-on learning, and foster contributions from users across disciplines.",Bleichrodt A; Phan A; Luo R; Kirpich A; Chowell G,"Department of Population Health Sciences, School of Public Health, Georgia State University, Atlanta, Georgia, United States of America.",PloS one,2025-08-07,10.1371/journal.pone.0329791,4.5,visualization(abstract); dashboard(abstract); visual(abstract); data(abstract),
40758607,Exploring research trends in health effects of 5G antennas: a bibliometric analysis.,"To better understand the developments and trends of studies on the health impacts of 5th Generation (5 G) antennas, a bibliometric analysis of the literature published in the Web of Science database from 2012 to 2025 was conducted. Before the analysis, the dosimetric quantities ""specific absorption rate (SAR)"" and ""power density (Sab)"" used in the examination of the health impacts of antennas were thoroughly defined, and their required limits were provided. Subsequently, information visualization technology was utilized to investigate the yearly distribution of literature, author contributions and collaboration, productive and influential institutions and countries/territories, co-citation analysis, and keyword co-occurrence. However, anticipated publication and citation numbers for the coming years (2025-2029) were predicted regarding the potential health impacts of 5 G antennas using artificial intelligence-assisted forecasting methods. There has been a considerable increase in studies related to health impacts measured by SAR and Sab dosimetric quantities over the last five years, in line with the number of articles published on 5 G antennas. Despite this, no bibliometric analysis has been done so far on the health impact of 5 G antennas below and above 6 GHz. The data presented in this bibliometric study to fill the gap on this subject will provide a better understanding of the health impacts and unique insights to offer good research guidance on 5 G antennas and their attributed adverse health impacts.",Turgut A; Korunur Engiz B,"Department of Electrical and Electronics Engineering, Ondokuz Mayis University, Samsun, Turkey.",Electromagnetic biology and medicine,2025-08-04,10.1080/15368378.2025.2539147,4.0,visualization(abstract); visual(abstract); artificial intelligence(abstract); data(abstract),Health Effects; Bibliometric Analysis; Specific Absorption Rate (Sar); 5G Antennas; Absorbed Power Density (Sab); Radiofrequency Dosimetry
40772545,"Organoids and Organoids-on-Chip in Traditional Chinese Medicine Research: Applications, Advantages, and Future Prospects.","Modernizing traditional Chinese medicine (TCM) requires preserving its foundational principles while integrating contemporary innovations and clarifying therapeutic methods. Organoids and organoids-on-chip technologies offer advanced models of human organs, and serve as an excellent platform for investigating TCM theories and complex herbal formulas. To systematically summarize recent progress in using organoids and organoids-on-chip in TCM research, and critically assess their technical advantages and future potential, relevant articles and information were sourced from scientific databases such as PubMed, SpringerLink, Web of Science, ScienceDirect, and VIP. The application of organoids and organoids-on-chip technologies in TCM research encompasses theory interpretation, efficacy evaluation, mechanism elucidation, toxicity assessment, active ingredient screening, and formula optimization. These applications offer significant advantages, such as unveiling holistic effects, deciphering mechanistic bases through dynamic visualization approaches, and demonstrating personalized therapeutic benefits. Enhancing physiological relevance, automation, and intelligent applications are future development directions. Organoids and organoids-on-chip represent transformative tools for the modernization of TCM. Future advancements in vascularization, neural network development, and the integration of artificial intelligence are anticipated to address existing limitations, thereby enhancing physiological relevance and clinical translation. These advancements are expected to promote global acceptance and innovation in TCM.",Li T; Yang Y; Yang F; Li Y; Qiao H; Yan Y; Ding X,"Institute for Chinese Medicine Frontier Interdisciplinary Science and Technology, Shaanxi University of Chinese Medicine, Xianyang, China.",Cell biology international,2025-08-07,10.1002/cbin.70067,4.0,visualization(abstract); visual(abstract); artificial intelligence(abstract); data(abstract),Traditional Chinese medicine; Organoids; Personalized Medicine; Multi‐omics; Organoids‐on‐chip
40758206,Model-Informed Precision Dosing of Infliximab in Korean Inflammatory Bowel Disease Patients: External Validation of Population Pharmacokinetic Models.,"Underexposure to infliximab often leads to loss of response in patients with inflammatory bowel disease (IBD). Model-informed precision dosing (MIPD) offers a superior approach to maintaining target infliximab concentrations compared to empirical dosage adjustment. This study aims to externally validate the population pharmacokinetic (PK) models implemented in TDMx, an online MIPD dashboard system, for adult and pediatric Korean IBD patients before clinical use. This retrospective study included 199 IBD patients (142 adults, 57 children) treated with intravenous infliximab at Seoul National University Hospital (Seoul, Republic of Korea) from 2019 to 2023. Three adult and seven pediatric models were evaluated based on accuracy, precision, goodness of fit plots, prediction-corrected visual predictive checks, and normalized prediction distribution errors. For adults, the Passot model showed the best fit (mean percentage error (MPE) 26.4%, mean absolute error (MAE) 1.1 mg/L, relative root-mean square error (rRMSE) 159.0%), whereas all pediatric models were unsuitable for clinical use (MPE 30.4%-143.4%, MAE 1.4-2.6 mg/L, rRMSE 96.3%-564.0%). Predictive performance was compared between datasets with or without accurate information on antibodies-toward-infliximab (ATI), as well as with and without previous concentrations. Assuming all patients were ATI positive improved predictive performance, likely due to the inherent positive bias of the population PK models. Incorporating previous concentrations improved predictions for adult models, achieving acceptable accuracy and precision (Passot model: MPE 17.5%, MAE 1.8 mg/L, rRMSE 80.3% with one concentration). However, pediatric models remained clinically unacceptable, highlighting the need to develop models specifically tailored for this population.",Kim Y; Baek SH; Jang IJ; Chung JY,"Department of Clinical Pharmacology and Therapeutics, Seoul National University College of Medicine and Hospital, Seoul, Korea.",CPT: pharmacometrics & systems pharmacology,2025-08-04,10.1002/psp4.70089,3.0,dashboard(abstract); visual(abstract); data(abstract),Model evaluation; therapeutic drug monitoring; Population Pharmacokinetics; Individualization
40779024,MRI-based 3D models of cranial nerves in clinical care: a systematic review.,"<h4>Background</h4>Technical advances in magnetic resonance imaging (MRI) acquisition and reconstruction have improved the visualization of anatomical structures such as cranial nerves (CNs) and enabled subsequent three-dimensional (3D) models for use in clinical care. However, a comprehensive overview of indications and techniques is lacking. The current study aimed to comprehensively describe and assess the techniques and applications used in MRI-based 3D modeling of CNs.<h4>Methods</h4>We conducted a systematic review of articles published in Medline, Embase, and Scopus databases on clinically applied MRI-based 3D models of CNs up to December 2023. We modified the Quality Assessment Tool for Diagnostic Accuracy Studies to assess the risk of bias.<h4>Results</h4>We analyzed 37 studies presenting virtual 3D models of CNs II, III, and V-X in proximity to pathologies in the head and neck area and intracranial, including vestibular schwannoma, skull base tumors, cerebellopontine angle tumors, and neurovascular compression syndrome. Certain studies explored alternative visualization modalities, including printed and augmented reality models. The creation of these 3D models involved the utilization of several MRI sequences and segmentation tools. The models demonstrate potential benefits for preoperative planning, intraoperative decision-making, and patient counseling.<h4>Conclusion</h4>MRI-specific sequences and segmentation techniques render CNs in 3D models, helping before and during surgery.<h4>Relevance statement</h4>MRI-based 3D models of cranial nerves help surgeons before and during surgery and enhance patient understanding of the procedure and its risks. Wider clinical adoption requires an established workflow, technical expertise, and collaboration to ensure accessibility and knowledge sharing.<h4>Key points</h4>3D modeling of cranial nerves is a promising tool for preoperative planning, surgery, and patient-doctor communication. Data heterogeneity and small sample sizes hinder definitive conclusions about the best MRI techniques and segmentation protocols for 3D visualization of cranial nerves. Adopting MRI-based 3D models widely needs a set workflow, technical skills, and team collaboration.",Moll MCM; Karssemakers LHE; Baarsma M; Braun LMM; Ter Beek LC; van der Mierden S; Karakullukcu B; Smeele LE; van Alphen MJA; Valstar MH,"Department of Head and Neck Surgery and Oncology, The Netherlands Cancer Institute, Antoni van Leeuwenhoek, Plesmanlaan 121 1066 CX, Amsterdam, The Netherlands. man.moll@nki.nl.",European radiology experimental,2025-08-08,10.1186/s41747-025-00608-8,3.0,visualization(abstract); visual(abstract); data(abstract),Surgical procedures; Cranial nerves; Magnetic Resonance Imaging; Augmented Reality; Imaging (Three-dimensional)
40770361,Clinical information prompt-driven retinal fundus image for brain health evaluation.,"<h4>Background</h4>Brain volume measurement serves as a critical approach for assessing brain health status. Considering the close biological connection between the eyes and brain, this study aims to investigate the feasibility of estimating brain volume through retinal fundus imaging integrated with clinical metadata, and to offer a cost-effective approach for assessing brain health.<h4>Methods</h4>Based on clinical information, retinal fundus images, and neuroimaging data derived from a multicenter, population-based cohort study, the KaiLuan Study, we proposed a cross-modal correlation representation (CMCR) network to elucidate the intricate co-degenerative relationships between the eyes and brain for 755 subjects. Specifically, individual clinical information, which has been followed up for as long as 12 years, was encoded as a prompt to enhance the accuracy of brain volume estimation. Independent internal validation and external validation were performed to assess the robustness of the proposed model. Root mean square error (RMSE), peak signal-to-noise ratio (PSNR), and structural similarity index measure (SSIM) metrics were employed to quantitatively evaluate the quality of synthetic brain images derived from retinal imaging data.<h4>Results</h4>The proposed framework yielded average RMSE, PSNR, and SSIM values of 98.23, 35.78 dB, and 0.64, respectively, which significantly outperformed 5 other methods: multi-channel Variational Autoencoder (mcVAE), Pixel-to-Pixel (Pixel2pixel), transformer-based U-Net (TransUNet), multi-scale transformer network (MT-Net), and residual vision transformer (ResViT). The two- (2D) and three-dimensional (3D) visualization results showed that the shape and texture of the synthetic brain images generated by the proposed method most closely resembled those of actual brain images. Thus, the CMCR framework accurately captured the latent structural correlations between the fundus and the brain. The average difference between predicted and actual brain volumes was 61.36 cm<sup>3</sup>, with a relative error of 4.54%. When all of the clinical information (including age and sex, daily habits, cardiovascular factors, metabolic factors, and inflammatory factors) was encoded, the difference was decreased to 53.89 cm<sup>3</sup>, with a relative error of 3.98%. Based on the synthesized brain MR images from retinal fundus images, the volumes of brain tissues could be estimated with high accuracy.<h4>Conclusions</h4>This study provides an innovative, accurate, and cost-effective approach to characterize brain health status through readily accessible retinal fundus images.<h4>Trial registration no</h4>NCT05453877 ( https://clinicaltrials.gov/ ).",Tong N; Hui Y; Gou SP; Chen LX; Wang XH; Chen SH; Li J; Li XS; Wu YT; Wu SL; Wang ZC; Sun J; Lv H,"Key Laboratory of Intelligent Perception and Image Understanding of the Ministry of Education, School of Artificial Intelligence, Xidian University, Xi'an, 710071, China.",Military Medical Research,2025-08-06,10.1186/s40779-025-00630-2,3.0,visualization(abstract); visual(abstract); data(abstract),Magnetic Resonance Imaging; Brain Volume; Brain Health; Deep Learning; Retinal Fundus Image; Eye And Brain Connection
40763084,Augmented Reality in Airway Management: A Scoping Review.,"Augmented reality, which overlays virtual information onto the physical environment, is an emerging technology in health care with promising applications in education, diagnostics, and procedural support. Its use in airway management-an essential aspect of anesthesiology and critical care-remains underexplored. This scoping review evaluates the current literature on augmented reality in airway management, with the aim of identifying its benefits, limitations, and future potential. A systematic literature search was conducted using PubMed, Embase, and IEEE databases, after PRISMA-ScR guidelines. Studies were included if they focused on augmented reality-assisted airway training or procedures and excluded if they centered on virtual reality or lacked procedural relevance. Ten studies met inclusion criteria, including 8 observational studies and 2 randomized controlled trials. Most utilized head-mounted displays to support simulation-based training or procedural guidance across pediatric and adult populations. Outcomes assessed included objective measures-such as intubation success, timing, and procedural accuracy-and subjective metrics like user confidence, perceived usability, and educational value. Results varied across studies. Several reported enhanced anatomical visualization, improved procedural success, and increased realism in training. One randomized controlled trial demonstrated higher intubation success rates and reduced procedure times when augmented reality-assisted video laryngoscopy was compared to standard methods. Another randomized controlled trial using a head-mounted display to deliver a procedural checklist found greater checklist adherence but also longer intubation times. Subjective feedback from participants noted challenges including device complexity, learning curve, and equipment limitations. Despite these encouraging findings, the current evidence base is limited by small sample sizes, variability in study design, and a lack of standardized evaluation protocols. Importantly, no study directly assessed the safety profile of augmented reality in airway management or its impact on patient-centered outcomes. In conclusion, augmented reality has the potential to improve anatomical understanding, procedural accuracy, and educational engagement in airway management. However, its integration into clinical practice is still in early stages. More rigorous, large-scale clinical trials are needed to determine its efficacy, optimize usability, and clarify its role in enhancing patient safety and provider training in anesthesiology and critical care.",Hart A; Zemel M; Henson L; Beard L; Arora V,"From the University of Washington, School of Medicine, Seattle, Washington.",Anesthesia and analgesia,2025-08-05,10.1213/ane.0000000000007633,3.0,visualization(abstract); visual(abstract); data(abstract),
