pmid,title,abstract,authors,first_author_affiliation,journal,pub_date,doi,score,matched_keywords,api_keywords
40295909,Development and validation of a prediction model for post-induction hypotension in elderly patients undergoing non-cardiac surgery: a prospective cohort study.,"<h4>Backgrounds</h4>Post-induction hypotension (PIH) is prevalent in elderly surgical patients and associated with adverse outcomes; however, predicting PIH remains challenging. We aimed to develop a feasible and practical PIH prediction model for elderly patients undergoing non-cardiac surgery.<h4>Methods</h4>In this single-center prospective cohort study, 938 elderly patients undergoing non-cardiac surgery were enrolled from December 2022 to May 2023 (n = 657 in the development cohort) and from June 2023 to August 2023 (n = 281 in the temporal validation cohort), respectively. The study outcome was the occurrence of PIH, defined as hypotension during the first 15 min after anesthesia induction or until skin incision (whichever occurred first). Predictors were determined based on LASSO and logistic regression analyses. A nomogram and a dynamic application were used for model visualization. The internal and temporal validation were performed to evaluate the discriminability, calibration and clinical utility.<h4>Results</h4>The median age was 71 years in both cohorts. The incidence of PIH was 51.6% and 50.5% in the development and validation cohorts, respectively. Cardiac function, baseline mean arterial pressure in the ward, etomidate use, and pre-induction mean arterial pressure were determined as predictors. The PIH prediction model was visualized as a nomogram and a dynamic application. The area under the receiver operating characteristic curve was 0.680 (95% confidence interval [CI]: 0.639 to 0.720) in internal validation and 0.697 (95% CI: 0.635 to 0.759) in temporal validation. The mean absolute errors were 0.012 and 0.029 for the internal and temporal validation calibration curves, respectively. The Brier score was 0.223. The decision curve analysis indicated that the model had a gain in predicting PIH.<h4>Conclusion</h4>A PIH prediction model with four predictors was developed and validated for elderly patients undergoing non-cardiac surgery. This model provides a foundation for future refinements to enhance its value of assisting clinical decision-making across diverse healthcare settings.<h4>Trial registration</h4>This study was registered at the Chinese Clinical Trial Registry (ChiCTR2200066201).",Bian Z; Dou W; Ying Y; Shi H; Ji F; Hu J; Peng K,"Department of Anesthesiology, First Affiliated Hospital of Soochow University, Suzhou, Jiangsu, 215006, China.",BMC anesthesiology,2025-04-28,10.1186/s12871-025-03090-2,2.5,visualization(abstract); visual(abstract),Prediction model; Elderly patients; Non-cardiac Surgery; Post-induction Hypotension
40298856,Magnetic Resonance Imaging Sequences and Technologies in Adaptive Radiation Therapy.,"Radiation therapy is essential in both curative and palliative treatments for most cancers. However, traditional radiation therapy workflows using computed tomography (CT) simulation-based planning and cone beam CT image guidance face several technical challenges, including limited tumor visibility and daily fluctuations in tumor size and shape. Magnetic resonance imaging (MRI) guided linear accelerators (MR-Linacs) address these issues by enabling precise visualization of changes in tumor position and morphologic changes, as well as changes in surrounding organs-at-risk. The hybrid MR-Linac systems combine MRI with linear accelerator technology, offering enhanced soft tissue visualization and the potential for adaptive radiation therapy (ART). This narrative review provides a comprehensive introduction to MR guided ART technologies, covering protocol optimization with appropriate pulse sequence selection and parameter adjustment for clinical implementations on various disease sites.",Ghafarian M; Cao M; Kirby KM; Schneider CW; Deng J; Mellon EA; Kishan AU; Maziero D; Wu TC,"Department of Radiation Oncology, University of California Los Angeles, Los Angeles, California. Electronic address: Mghafarian@mednet.ucla.edu.","International journal of radiation oncology, biology, physics",2025-04-29,10.1016/j.ijrobp.2025.04.017,2.5,visualization(abstract); visual(abstract),
40308181,A near-infrared fluorescent probe selectively recognizing cysteine to release H&lt;sub&gt;2&lt;/sub&gt;S and its applications.,"Cysteine, a pivotal biothiol vital for human health, exhibits strong associations with various diseases, yet its concentration assessment is often confounded by structurally and functionally similar biothiols. Hydrogen sulfide (H<sub>2</sub>S), an endogenous gasotransmitter with therapeutic potential, faces challenges in achieving pharmacological effects due to the unpredictable presence of inorganic H<sub>2</sub>S donors. To address these issues, we developed TMN-ONCS, a near-infrared fluorescent probe that integrates a <i>p</i>-tolyl isothiocyanate with a dicyanoisophorone fluorophore through a self-immolative spacer. TMN-ONCS demonstrates high selectivity and analytical performance for cysteine, avoids the generation of multiple fluorophores seen in conventional isothiocyanate probes, and functions as a cysteine-activated fluorescent H<sub>2</sub>S donor with concurrent visualization. Furthermore, it mitigates lipopolysaccharide-induced inflammation in RAW 264.7 cells, highlighting its potential for treating inflammation.",Wang X; Wang N; Ren Y; Wang J; Bai J; Hua H; Li D,"Key Laboratory of Structure-Based Drug Design & Discovery, Ministry of Education, and School of Traditional Chinese Materia Medica, Shenyang Pharmaceutical University, 103 Wenhua Road, Shenyang 110016, P. R. China. lidahong0203@163.com.",The Analyst,2025-05-01,10.1039/d5an00316d,2.5,visualization(abstract); visual(abstract),
40317890,DNA-Programmed Reaction to Evaluate Specific IgE for Allergy Point-of-Care Testing. ,"A DNA-programmed reaction to evaluate non-nucleic acids inputs with computation speed (≈30 min) and sensitivity (sub-picomolar) suitable for analyzing physiologically relevant biomarkers in a one-pot format and point-of-care testing setting is reported. Specifically, a DNA programme based on the proximity-activation exponential amplification reaction (PEAR) is designed to evaluate specific IgE (sIgE) against Der p 2 implicated in dust mite allergy which affects millions worldwide. In this work, we tailored the molecular components of the input-to-oligo barcode conversion module as an AND gate to detect inputs with binding specificity to Der p 2 antigen and is of an IgE isotype. In addition, an in situ biotinylation method is developed to generate amplified oligo barcodes amendable for direct visualization on a lateral flow format. As a proof-of-concept demonstration of its potential clinical utility, 21 clinical samples are evaluated by the as-developed sIgE PEAR programme using the dual readout modality of real-time fluorescence measurement for precise input quantification and simple lateral flow yes/no answer.",Ang YS; Low DKX; Yung LL,"Department of Chemical & Biomolecular Engineering, National University of Singapore, Singapore, 117585, Singapore.","Small (Weinheim an der Bergstrasse, Germany)",2025-05-03,10.1002/smll.202500575,2.5,visualization(abstract); visual(abstract),
40309042,A UK single-center pilot experience using a novel robotic inchworm colonoscopy system.,"<h4>Introduction</h4>Colonoscopy is the gold standard investigation in the lower gastrointestinal tract. However, 75% of patients can experience pain with moderate sedation. The application of robotic technology aims to overcome difficulties faced including better utilization of rooms for advanced procedures and to achieve a complete colonoscopy in patients restricted by pain and technical challenges.<h4>Methods</h4>This pilot study, the first at a UK-National Health Service Hospital between January 2023 to August 2024 with one expert endoscopist performing the robotic colonoscopy (RC). Patients with failed previous standard colonoscopy (SC) along with index diagnostic procedures deemed potentially difficult were recruited. Procedures were performed outside the endoscopy unit similar to an outpatient clinical room.<h4>Results</h4>Ninety-three patients were recruited (41 men:52 women), mean age of 53.8 years over 20 months. The commonest indications for RC were rectal bleeding (26.9%), failed SC (22.6%), and change in bowel habits (17.2%). Twenty-one patients had failed the previous SC with 14 patients achieving completion with subsequent RC (66% improvement). The average cecal intubation time of 41.07 min with an average total procedure time of 76.48 min. A significant improvement in patient discomfort score was reported (4.71 SC vs. 1.71 RC; <i>p</i> < 0.001).<h4>Conclusions</h4>RC provides a significantly more comfortable colonoscopy and has great potential to improve safety in colonoscopy from this early cohort of patients. Direct visualization, biopsy, and polypectomy are still possible with RC. This study has demonstrated a viable alternative to SC. With no sedation it allows procedures to be conducted outside the traditional endoscopy unit such as outpatients. The study highlights a learning curve to reduce cecal intubation time.",Ahmed JF; Coda S; Premchand P; Banerjee S; Patel N,The Hamlyn Center Imperial College London London UK.,DEN open,2025-04-29,10.1002/deo2.70123,2.5,visualization(abstract); visual(abstract),Pain; Colonoscopy; Robotics; Discomfort; Outpatients
40317604,The Evolution of Fluorescein into a Potential Theranostic Tool. ,"Recent advances in drug discovery and development have been marked by the emergence of new modalities, including small molecule theranostic agents. While initial results from clinical trials have been promising, modern detectable inhibitors are still in an early stage of development. In this study, we present a strategy for chemically evolving a fluorescent imaging agent into a potent therapeutic entity, which not only retains its properties but also enhances its inhibition and detection applicability. By utilizing 15-LOX-1 as a model system, we leverage prior knowledge of its inhibitors to rationally functionalize fluorescein, enabling the targeted and highly efficient synthesis of over 20 derivatives across four different scaffolds. This approach ultimately led to the development of a potent, cell-permeable inhibitor that effectively engages its target in live cells and enables real-time visualization. These findings validate our new strategy for the development of small molecule diagnostic modulators, paving the way for application in other targets as well.",Neochoritis C; Adamis KS; Georgoulakis M; Angelonidis I; Korovesis D; Papadopoulos C; Kapsalis M; Tavernarakis N; Eleftheriadis N,"University of Crete: Panepistemio Kretes, Chemistry, Voutes, 70013, Heraklion, GREECE.","Chemistry (Weinheim an der Bergstrasse, Germany)",2025-05-02,10.1002/chem.202501513,2.5,visualization(abstract); visual(abstract),
40301683,"Advancing precision, safety, and education in D3 lymph node dissection for right hemicolectomy using mixed reality technology.","Right hemicolectomy (RHC) is an important treatment for colorectal cancer. The superior mesenteric artery and superior mesenteric vein are known for their significant vascular variations. This study evaluated the short-term outcomes of integrating Mixed Reality (MR) technology into RHC for the treatment of colorectal cancer. Patients who underwent RHC for clinical stage II or III colon cancer between January 2015 and August 2024 were included. Patients were divided into two groups: the MR (+) group (n = 47), in which MR was used, and the MR (-) group (n = 145), in which MR was not used. MR using SYNAPSE VINCENT, Holoeyes MD, and HoloLens2 was utilized for detailed 3D visualization of the vascular anatomy preoperatively and intraoperatively. Forty-four patients per group were matched via propensity score matching and surgical outcomes were compared. In both groups, approximately 70% of the surgeries were performed by the training surgeon. Compared with the MR (-) group, intraoperative blood loss and hospital stay were decreased, and the number of lymph nodes harvested around the middle colic artery/vein were increased without prolonging the operative time in the MR (+) group. MR in RHC offers surgical precision, safety, enhanced patient recovery, and educational value.",Ryu S; Imaizumi Y; Nakashima S; Goto K; Kawakubo H; Kawai H; Kobayashi T; Ito R; Nakabayashi Y,"Department of Digestive Surgery, Kawaguchi Municipal Medical Center, 180, Nishiaraijuku, Kawaguchi City, Saitama, 333-0833, Japan. systematic.ryu1121@gmail.com.",Scientific reports,2025-04-29,10.1038/s41598-025-99961-2,2.5,visualization(abstract); visual(abstract),Surgery; Colon cancer; Right Hemicolectomy; Mixed Reality; Intraoperative Navigation
40299981,Imaging-Based Approach to Venous-Origin Chronic Pelvic Pain.,"Chronic pelvic pain (CPP) is a debilitating condition affecting up to 26% of women worldwide. Among its many causes, pelvic venous disorders (PeVD) is increasingly recognized as an underdiagnosed contributor, often overlooked due to its non-specific presentation. PeVD results from venous reflux, or obstruction, leading to venous hypertension, congestion, and chronic pain. Advanced imaging techniques play a pivotal role in diagnosing PeVD, differentiating it from other etiologies of CPP. Ultrasound, particularly Doppler imaging, serves as the firstline modality for assessing venous reflux and dilation. Computed tomography and magnetic resonance venography provide detailed anatomical and haemodynamic evaluations, aiding in the identification of compressive syndromes and collateral pathways. Selective venography remains the gold standard, offering real-time visualization of reflux severity and guiding minimally invasive interventions such as venous embolization. Despite these advances, PeVD remains underrecognized in clinical practice, leading to delays in diagnosis and management. Increased awareness and standardized diagnostic criteria are crucial for improving patient outcomes. A multidisciplinary approach incorporating radiologists, gynecologists, and vascular specialists is essential for the comprehensive evaluation and treatment of PeVD. Emerging therapies, including endovascular techniques, offer promising options for symptom relief, reducing the need for invasive surgical procedures. This review highlights the pathophysiology, imaging modalities, and evolving management strategies for PeVD, emphasizing the importance of early recognition and intervention in patients with CPP.",Moosa V; Ni T; Friedman I; Brown AD,"Department of Medicine, University of Calgary, Calgary, AB, Canada.",Canadian Association of Radiologists journal = Journal l'Association canadienne des radiologistes,2025-04-29,10.1177/08465371251336121,2.5,visualization(abstract); visual(abstract),Venous Disease; Pelvic Pain; Diagnostic Imaging; Pelvic Venous Congestion; Pelvic Venous Disorder
40295627,Identification and quantification of muscular cocontraction for ankle rehabilitation through variational mode decomposition in surface electromyography.,"The ankle joint plays important role in performing fundamental activities such as walking and other essential daily tasks. Ankle stabilization and muscle co-contraction are crucial for rehabilitating gait abnormalities, as impaired ankle function disrupts gait, causes pain and inflammation, and hampers recovery. Accurate assessment of muscle co-contraction is crucial for developing effective non-pharmacological interventions. This paper introduces a novel approach using Variational Mode Decomposition (VMD) combined with scalogram visualization technique to analyze surface electromyographic (sEMG) signals from antagonist muscles of the lower limb and assesses muscular co-contraction using the coscalogram function. The present study compares VMD with the Continuous Wavelet Transform (CWT) approach and shows that VMD outperforms CWT in terms of both SNR and RMSE. On average, the increase in SNR in case of VMD (-17.65 ± 8.1dB to 2.98 ± 2.2dB) was greater than that of CWT (-17.65 ± 3.7dB to 1.34 ± 1.5dB). Similarly, the reduction in RMSE with VMD (0.023 ± 0.0029 to 0.017 ± 0.0015) surpassed that achieved with CWT (0.023 ± 0.0027 to 0.020 ± 0.0025). This enhanced accuracy in identifying co-contraction events has the potential to significantly improve clinical assessment and rehabilitation strategies for patients with ankle joint pathologies. To further validate VMD's effectiveness, we quantitatively assessed co-contraction events by comparing mean peak amplitudes identified using VMD and CWT. Our analysis, which revealed that VMD consistently captured stronger co-contraction events (higher mean peak amplitudes), supports VMD's superiority in accurately identifying and quantifying ankle muscle co-contraction. These results have significant implications for clinical practice, offering the potential for more precise assessments of ankle joint function and the development of more targeted and effective rehabilitation interventions.",Yasmeen S; Waris A; Amin F; Iqbal J; Gilani SO; Khan MJ; Hazzazi F; Imran A; Shah UH; Ijaz MA,"Department of Biomedical Engineering and Sciences, School of Mechanical and Manufacturing Engineering, National University of Sciences and Technology (NUST), Islamabad, Pakistan.",Scientific reports,2025-04-28,10.1038/s41598-025-96334-7,2.5,visualization(abstract); visual(abstract),Co-contraction; Continuous Wavelet Transform; Semg; Ankle Rehabilitation; Scalogram; Variational Mode Decomposition
40314842,Widespread distribution of α-synuclein oligomers in LRRK2-related Parkinson's disease.,"Mutations in leucine-rich repeat kinase 2 (LRRK2) are the most common cause of familial and sporadic Parkinson's disease (PD). While the clinical features of patients with LRRK2-PD resemble those of typical PD, there are significant differences in the pathological findings. The pathological hallmark of definite PD is the presence of α-synuclein (αSYN)-positive Lewy-related pathology; however, approximately half of patients with LRRK2-PD do not have Lewy-related pathology. Lewy-related pathology is a late-stage αSYN aggregation that can be visualized with hematoxylin and eosin stains or conventional immunohistochemistry (IHC). Increasing evidence has indicated that αSYN oligomers, which represent the early-stage of αSYN aggregation, may have neurotoxicity. Visualization of αSYN oligomers requires specialized staining techniques, such as αSYN-proximity ligation assay (PLA). Distribution and severity of αSYN oligomers in the brain of patients with LRRK2-PD remain unknown. In this study, we performed phosphorylated αSYN-IHC and αSYN-PLA staining on postmortem brain sections of patients with three pathogenic LRRK2 mutants: p.G2019S (n = 5), p.I2020T (n = 5), and p.R1441C (n = 4). The severity of Lewy-related pathology and αSYN oligomers was assessed semi-quantitatively in the brainstem, limbic lobe, basal ganglia, and cerebral cortex. αSYN oligomers were detected in patients with LRRK2-PD even in those without Lewy-related pathology; a negative correlation was observed between Lewy-related pathology and αSYN oligomers (r = - 0.26 [- 0.39, - 0.12]; P < 0.0001). Our findings suggest that αSYN oligomers may represent a common pathological feature of LRRK2-PD. Notably, patients harboring p.G2019S and p.I2020T had significantly higher levels of αSYN oligomers in those without Lewy-related pathology compared to those with Lewy-related pathology. These patients also had a trend toward shorter disease duration. These results imply that in LRRK2-PD, αSYN oligomers may initially accumulate in the brain but do not progress to form Lewy-related pathology. The present study suggests that targeting αSYN oligomers may be a therapeutic strategy for LRRK2-PD even if there is no Lewy-related pathology.",Sekiya H; Franke L; Hashimoto Y; Takata M; Nishida K; Futamura N; Hasegawa K; Kowa H; Ross OA; McLean PJ; Toda T; Wszolek ZK; Dickson DW,"Department of Neuroscience, Mayo Clinic, 4500 San Pablo Road, Jacksonville, FL, 32224, USA. sekiya.hiroaki@mayo.edu.",Acta neuropathologica,2025-05-02,10.1007/s00401-025-02872-9,2.5,visualization(abstract); visual(abstract),Pathogenesis; Parkinson disease; Oligomers; Lewy bodies; alpha-Synuclein; Lrrk2
40307987,Image Quality Improvement in MRI of Cochlear Implants and Auditory Brainstem Implants After Metal Artifact Reduction Techniques.,"<h4>Objective</h4>Observe if metal artifact reduction (MAR) techniques applied to magnetic resonance imaging (MRI) performed on patients with cochlear implants (CI) or auditory brainstem implants (ABI) improves image quality.<h4>Study design</h4>Retrospective review.<h4>Setting</h4>Tertiary care center.<h4>Patients</h4>Patients with auditory implants who underwent clinical MRI before and after the application of MAR techniques previously described.<h4>Interventions</h4>From September 2022 to March 2023, patients who underwent brain or internal auditory canal (IAC) MRI with and without MAR were identified. Sequences included T1 and T2 weighted with turbo-spin-echo (TSE) correction and fluid-attenuation inversion recovery (FLAIR). Images were analyzed for visualization of intracranial structures by two neuroradiologists.<h4>Main outcome measures</h4>Visibility of 14 structures graded on a four-point Likert scale. Average scores per structure and sequence were compared using paired two-tailed t-tests and change in mode score.<h4>Results</h4>Ten patients underwent pre- and post-MAR MRI. Six had a unilateral CI, three had a unilateral ABI, and one had an ABI and CI. Three patients had four devices with the internal magnet removed for both scans. All structures had significantly improved visibility on post-MAR scan except ipsilateral parietal and occipital lobes and contralateral inner ear. Mode score increased from 2 to 4 for the ipsilateral occipital lobe and from 3 to 4 for the ipsilateral semicircular canals, brainstem, and cerebellar peduncles. Significant improvement was seen in all sequences except for ipsilateral structures on T1w axial precontrast and contralateral structures on T1w coronal postcontrast. ABIs did not improve as much as CIs because they scored better on the pre-MAR scan.<h4>Conclusions</h4>MAR techniques improve image quality for patients with MRI-compatible implants with magnets. Benefits may be more evident in CIs than ABIs.",Winchester A; Cottrell J; Kay-Rivest E; Friedmann D; McMenomey S; Thomas Roland J Jr; Bruno M; Hagiwara M; Moonis G; Jethanamest D,"Department of Otolaryngology-Head and Neck Surgery, New York University Grossman School of Medicine, New York, New York.","Otology & neurotology : official publication of the American Otological Society, American Neurotology Society [and] European Academy of Otology and Neurotology",2025-05-01,10.1097/mao.0000000000004517,2.5,visualization(abstract); visual(abstract),Cochlear Implants; Artifact Reduction; Mri Imaging
