pmid,title,abstract,authors,first_author_affiliation,journal,pub_date,doi,score,matched_keywords,api_keywords
41034781,Radiomics analysis using machine learning to predict perineural invasion in pancreatic cancer.,"<h4>Background</h4>Pancreatic cancer is one of the most aggressive and lethal malignancies of the digestive system and is characterized by an extremely low five-year survival rate. The perineural invasion (PNI) status in patients with pancreatic cancer is positively correlated with adverse prognoses, including overall survival and recurrence-free survival. Emerging radiomic methods can reveal subtle variations in tumor structure by analyzing preoperative contrast-enhanced computed tomography (CECT) imaging data. Therefore, we propose the development of a preoperative CECT-based radiomic model to predict the risk of PNI in patients with pancreatic cancer.<h4>Patients and methods</h4>This study enrolled patients with pancreatic malignancies who underwent radical resection. Computerized tools were employed to extract radiomic features from tumor regions of interest (ROIs). The optimal radiomic features associated with PNI were selected to construct a radiomic score (RadScore). The model's reliability was comprehensively evaluated by integrating clinical and follow-up information, with SHapley Additive exPlanations (SHAP)-based visualization to interpret the decision-making processes.<h4>Results</h4>A total of 167 patients with pancreatic malignancies were included. From the CECT images, 851 radiomic features were extracted, 22 of which were identified as most strongly correlated with PNI. These 22 features were evaluated using seven machine learning methods. We ultimately selected the Gaussian naive Bayes model, which demonstrated robust predictive performance in both the training and validation cohorts, and achieved area under the ROC curve (AUC) values of 0.899 and 0.813, respectively. Among the clinical features, maximum tumor diameter, CA-199 level, blood glucose concentration, and lymph node metastasis were found to be independent risk factors for PNI. The integrated model yielded AUCs of 0.945 (training cohort) and 0.881 (validation cohort). Decision curve analysis confirmed the clinical utility of the ensemble model to predict perineural invasion.<h4>Conclusion</h4>The combined model integrating clinical and radiomic features exhibited excellent performance in predicting the probability of perineural invasion in patients with pancreatic cancer. This approach has significant potential to optimize therapeutic decision-making and prognostic evaluation in patients with PNI.",Sun Y; Li Y; Li M; Hu T; Wang J,"Department of Hepatobiliary Surgery, The First Affiliated Hospital of Chongqing Medical University, Chongqing, China.",BMC cancer,2025-09-30,10.1186/s12885-025-14806-5,5.6,"visualization(abstract); visual(abstract); machine learning(title,abstract); data(abstract)",Prediction model; Pancreatic cancer; Contrast-enhanced Computed Tomography; Perineural Invasion; Radiomics
41039687,AI-Driven CBCT Analysis for Surgical Decision-Making and Mucosal Damage Prediction in Sinus Lift Surgery for patients with low RBH.,"<h4>Background</h4>Decision-making for maxillary sinus floor elevation (MSFE) surgery in patients with low residual bone height (<4 mm) presents significant challenges, particularly in selecting surgical approaches and predicting intraoperative mucosal perforation. Traditional methods rely heavily on physician experience, lack standardization and objectivity, and often fail to meet the demands of precision medicine. This study aims to build an intelligent decision-making system based on deep learning to optimize surgical selection and predict the risk of mucosal perforation, providing clinicians with a reliable auxiliary tool.<h4>Methods</h4>This study retrospectively analysed the cone-beam computed tomography imaging data of 79 patients who underwent MSFE and constructed a three-dimensional (3D) deep-learning model based on the overall CT data of the patients for surgical procedure selection and prediction of mucosal perforation. The model innovatively introduced the Convolutional Block Attention Module mechanism and depthwise separable convolution technology to enhance the model's ability to capture spatial features and computational efficiency. The model was rigorously trained and validated on multiple datasets, with visualization achieved through attention heatmaps to improve interpretability.<h4>Results</h4>The modified EfficientNet model achieved an F1 score of 0.6 in the procedure decision task of MSFE. For predicting mucosal perforation, the improved ResNet model achieved an accuracy of 0.8485 and an F1-score of 0.7273 on the mixed dataset. In the experimental group, the improved ResNet model achieved an accuracy of 0.8235, a recall of 0.7619, and an F1-score of 0.7302. In the control group, the model also maintained stable performance, with an F1-score of 0.6483. Overall, the 3D convolutional model enhanced the accuracy and stability of mucosal perforation prediction by leveraging the spatial features of cone-beam computed tomography imaging, demonstrating a certain degree of generalization capability.<h4>Conclusion</h4>This study is the first to construct a deep learning-based 3D intelligent decision-making model for MSFE. These findings confirm the model's effectiveness in surgical decision-making and in predicting the risk of mucosal perforation. The system provides an objective decision-making basis for clinicians, improves the standardization level of complex case management, and demonstrates potential for clinical application.",Deng Y; He Y; Liu C; Gao Z; Yu S; Cao S; Li C; Zhu Q; Ma P,"Dental Implant Center, Beijing Stomatological Hospital, School of Stomatology, Capital Medical University, Beijing, China; Department of Stomatology, Beijing Hospital of Integrated Traditional Chinese and Western Medicine, Beijing, China.",International dental journal,2025-10-01,10.1016/j.identj.2025.103931,5.0,visualization(abstract); visual(abstract); artificial intelligence(kw); data(abstract),Maxillary sinus; Sinus Floor Augmentation; Cone-beam Computed Tomography; Deep Learning; Artificial Intelligence. Oral Surgical Procedures
41024084,Association rule mining of time-based patterns in diabetes-related comorbidities on imbalanced data: a pre- and post-diagnosis study.,"Type 2 diabetes mellitus (T2DM) is affecting over 529 million adults and anticipated to impact 1.3 billion by 2050. This disease often coexists with multiple comorbidities, which can complicate its management. These comorbidities not only increase morbidity and mortality but also challenge the effectiveness of interventions designed to manage diabetes and improve patient outcomes. We analysed imbalanced data of 25.065 patients deriving from the Clinical Centre of the University of Debrecen, Hungary. The aim of the study was to explore the prevalence and temporal patterns of comorbidities before and after the diagnosis of T2DM using Association Rule Mining (ARM) and network visualization. The initial five years following T2DM diagnosis mark a spike in newly emerging health conditions. Hypertension frequently occurs at an earlier stage, while pneumonia, eye-related disorders, and ischemic heart disease consistently appear throughout the progression of the disease. The ARM analysis showed that both acute and chronic kidney diseases, as well as respiratory disorders are common after T2DM diagnosis. Certain gender-specific trends, such as higher instances of heart failure and acute kidney injury in males, are also notable. The study highlights how ARM techniques reveal complex patterns in chronic disease management, suggesting potential pathways for targeted treatments.",Bata R; Ghanem AS; Vargáné Faludi E; Sztanek F; Nagy AC,"Department of Epidemiology, Faculty of Health Sciences, University of Debrecen, Debrecen, Hungary.",BMC medical informatics and decision making,2025-09-29,10.1186/s12911-025-03206-1,4.8,"visualization(abstract); visual(abstract); data(kw,title,abstract)",Type 2 diabetes; T2DM; Icd; Comorbidities; Association Rule Mining; Clinical Data; Imbalanced Data
41029413,CPMOAD: comprehensive preeclampsia multi-omics analysis database.,"<h4>Background</h4>Preeclampsia (PE) is a pregnancy-specific syndrome that poses serious risks to both maternal and fetal health globally. Despite the accumulation of multi-omics datasets from various studies, a unified platform that integrates these resources for comprehensive analysis remains unavailable.<h4>Methods</h4>We developed CPMOAD (Comprehensive Preeclampsia Multi-Omics Analysis Database), an online platform designed to integrate RNA-seq, DNA methylation, and literature-curated data related to PE. All datasets were uniformly processed to generate differential expression profiles, methylation data, and curated molecular interaction records. The database is equipped with interactive visualization tools and customizable analysis modules.<h4>Results</h4>CPMOAD offers access to a broad spectrum of PE-relevant data, including gene expression and methylation profiles. Users can perform differential expression analysis, methylation analysis, and pathway enrichment analysis directly through the web interface. The platform also enables the exploration of validated molecular signatures associated with PE.<h4>Conclusions</h4>CPMOAD serves as a comprehensive and user-friendly resource for integrated multi-omics analysis in preeclampsia research. By consolidating diverse datasets and providing powerful analytical tools, CPMOAD aims to accelerate the discovery of molecular mechanisms and potential biomarkers for PE. The database is freely accessible at http://nscc.zzu.edu.cn/CPMOAD/ .",Fang Y; Fan M; Li H; Xu H; Du H; Guo Y; Gao J; Yuan E; Song L; Wang Y; Shi Q; Yu H; Yuan E; Zhao X; Zhang L,"Department of Laboratory Medicine, The Third Affiliated Hospital of Zhengzhou University, 7 Kangfu Qian Street, Zhengzhou, 450052, Henan, People's Republic of China. yangfangscu@gmail.com.",Journal of translational medicine,2025-09-30,10.1186/s12967-025-07094-x,4.8,"visualization(abstract); visual(abstract); data(kw,title,abstract)",Database; Preeclampsia; Multi-omics; Interactive Analysis
41037820,A Radiofluorinated Nanobody PET Tracer to Dynamically Visualize Differential Nectin4 Expression &lt;i&gt;In Vivo&lt;/i&gt;.,"Nectin4 is a potential therapeutic target for multiple cancer types. To develop a diagnostic radiotracer for nectin4, a nanobody-based PET tracer was selected from several candidate sequences and prepared via [<sup>18</sup>F]AlF radiolabeling. The radiochemical quality was assessed, and tracer uptake was evaluated in cell lines and tumor models with varying nectin4 expression levels. <i>In vitro</i> and <i>in vivo</i> studies showed that the tracer exhibited a specific affinity for nectin4, with a binding affinity (<i>K</i><sub>D</sub>) of 6.77 nM in cell lines. The tracer enabled clear visualization of nectin4-expressing lesions, and its uptake profile and pharmacokinetic behavior were characterized using dynamic PET imaging and kinetic analysis. A correlation between PET signal intensity and histological nectin4 expression was also observed in tumor models. Thus, it may have the potential to become a nectin4 tracer for clinical applications.",Zheng D; Huang Y; Li C; Lu Y; Xie Z; Ren Q; Liang Y; Meng X,"Department of Biomedical Engineering, College of Future Technology, Peking University, Beijing 100871, China.",Journal of medicinal chemistry,2025-10-02,10.1021/acs.jmedchem.5c01260,4.1,"visualization(abstract); visual(title,abstract)",
41038065,Guidance to undertaking systematic evidence maps.,"Systematic Evidence Maps (SEMs) are a form of evidence synthesis offering structured approaches to categorizing and organizing scientific evidence by identifying trends and gaps. SEMs support researchers and policymakers in navigating complex evidence landscapes. By synthesizing evidence, they lay the foundation for targeted systematic reviews and primary research, supporting evidence-informed decision-making. These outputs can be hosted on websites, providing an interactive tool. In environmental health, SEMs are systematically used to categorize evidence on topics such as pollution control measures, climate change impacts, and health disparities. The methodological framework for conducting SEMs involves defining the research scope, employing a systematic search strategy, screening studies systematically, optionally conducting critical appraisal (risk of bias assessment) when studies are categorized by effect direction or intended to inform subsequent syntheses, and coding data for synthesis and visualization. Narrative synthesis, heatmaps and network diagrams enhance SEMs usability. However, challenges remain, including methodological inconsistencies and the need for standardization. Advances in automation, machine learning, and stakeholder engagement can further refine SEMs methodologies. This commentary situates SEMs within the broader family of evidence synthesis, emphasizing their role in environmental health science. By enhancing methodological clarity and leveraging innovative tools, SEMs can support researchers and decision-makers in navigating complex evidence ecosystems and implementing evidence-based solutions for environmental scientists.",Khalil H; Welsh V; Grainger M; Campbell F,"School of Psychology and Public Health, Department of Public Health, La Trobe University, Melbourne, Australia. Electronic address: h.khalil@latrobe.edu.au.",Environment international,2025-09-29,10.1016/j.envint.2025.109827,4.0,visualization(abstract); visual(abstract); machine learning(abstract); data(abstract),Methodology; Reviews; Public Health; Environmental Health; Systematic Evidence Map
41028301,Reconstruction of three-dimensional retinal shape from refractive topography data.,"A three-dimensional retinal shape was reconstructed by refractive topography (RT).<h4>Methods</h4>The personalized optical models of the human eye were reconstructed based on geometric parameters from clinical measurements. The expected refraction distribution on the fundus was calculated for each model. Subsequently, the refraction-position conversion function (RPF) was derived by fitting the data sets, which included the field of view (FOV), vitreous thickness (VT), and refraction. Additionally, the coordinates on the fundus of the human eye were calculated from RT data through the RPF. Ultimately, a three-dimensional retinal shape was reconstructed.<h4>Results</h4>The expected refraction was calculated on 6 subjects. The results demonstrate that the expected refraction decreased as the VT increased. However, when the FOV was greater than 8°, the expected refraction increased with increasing FOV. A polynomial was applied to fit the 656 data points, resulting in the formation of the RPF. The fitting results demonstrated that the relationship tended to be similar in general for different human eyes, but there were individual differences. This reconstructed method provided good agreement between the reconstructed three-dimensional retina shape and the OCT measurements.<h4>Conclusion</h4>The reconstructed three-dimensional retinal shape from RT data enables new imaging protocols that improve visualization of retinal shape.",Ma Z; Fang L; Ma C; Liu Y; Guo Z; Wang Y,"Key Laboratory for Optoelectronic Information Perception and Instrumentation of Jiangxi Province, Nanchang Hangkong University, Nanchang, 330063, China.",Scientific reports,2025-09-30,10.1038/s41598-025-98650-4,3.8,"visualization(abstract); visual(abstract); data(title,abstract)",
41042457,"Robotic adrenalectomy: a comprehensive review of perioperative outcomes, comparative efficacy, and technological advancements.","The adrenal glands are small but vital endocrine organs responsible for hormone production, which is essential for stress response, fluid balance, and blood pressure regulation. Adrenalectomy, the surgical removal of one or both adrenal glands, is indicated in various benign and malignant conditions such as pheochromocytomas, aldosterone-producing adenomas, and adrenocortical carcinoma. Historically performed via open surgery, adrenalectomy has evolved significantly with the introduction of laparoscopic adrenalectomy in the 1990s and more recently, robotic adrenalectomy. Robotic adrenalectomy enhances surgical precision through 3D visualization, articulated instruments, and improved ergonomics, thereby addressing the limitations inherent to laparoscopic adrenalectomy. This narrative review synthesises the findings from pivotal studies that compare the perioperative outcomes of robotic adrenalectomy and laparoscopic adrenalectomy. Robotic adrenalectomy demonstrates favourable outcomes in terms of operative precision, reduced estimated blood loss, and comparable or shorter hospital stay, especially in complex scenarios involving obesity, large tumours, or altered anatomy. Complication rates remain low, and R0 resection rates exceed 95% in well-selected malignancies, supporting the oncological adequacy of robotic adrenalectomies. While robotic adrenalectomy offers superior surgeon ergonomics and a relatively short learning curve, its high initial costs and lack of tactile feedback present notable limitations. Technological advancements, including high-definition 3D optics, fluorescence imaging, and artificial intelligence integration, have further refined the potential of robotic adrenalectomies. However, the evidence remains largely retrospective, with limited prospective randomised trials evaluating long-term outcomes and cost-effectiveness. Robotic adrenalectomy appears to be particularly advantageous in complex adrenal cases, offering a safe, minimally invasive option with the potential for improved recovery and surgical outcomes. Future research should focus on the long-term oncologic efficacy, patient-reported outcomes, and economic sustainability of robotic adrenalectomy in diverse clinical settings. Robotic adrenalectomy represents a significant milestone in adrenal surgery, with growing evidence supporting its selective use as a preferred approach in experienced centres and in appropriately chosen patients.",Coco D; Leanza S,"Department of General, Robotic, Oncologic Surgery, Giglio Hospital Foundation, Cefalù, Italy. webcostruction@msn.com.",Journal of robotic surgery,2025-10-03,10.1007/s11701-025-02843-y,3.5,visualization(abstract); visual(abstract); artificial intelligence(abstract),Laparoscopic Adrenalectomy; Endocrine Surgery; Perioperative Outcomes; Robotic Adrenalectomy
41041623,Automated phenotyping of congenital heart disease for dynamic patient aggregation and outcome reporting.,"<h4>Objectives</h4>Accurate characterization of patients with congenital heart disease is fundamental to research, outcomes reporting, quality improvement, and clinical decision-making. Here we present an approach to computing the anatomy of patients with congenital heart disease based on the whole of their diagnostic and surgical codes.<h4>Materials and methods</h4>All diagnostic and procedure codes for patients cared for between 1981 and 2020 at Boston Children's Hospital were extracted from a database containing diagnostic codes from echocardiograms, and procedural codes from surgical and catheterization procedures. The pipeline sequentially (1) mapped each of the 7500 native codes to algorithm codes; (2) computed the parent anatomy for each study using a pre-defined hierarchy; (3) computed the parent anatomy for the patient, based on highest ranking parent anatomy; and (4) computed the subcategories and mandatory co-variate findings for each patient. Thereafter, diagnostic accuracy of 500 unseen patients was adjudicated against clinical documentation by clinical experts.<h4>Results</h4>A total of 514 541 echocardiograms on 161 735 patients were available for this study. Phenotypes of congenital cardiac diseases were assigned in 84 285 patients (52%), and the remainder were computed to have normal anatomy. Clinicians agreed with algorithm assignments in 96.4% (482 of 500 patients), with disagreements most often representing definitional differences. An interactive dashboard enabled by the output of this algorithm is presented.<h4>Conclusions</h4>The computation of detailed congenital heart defect phenotypes from raw diagnostic and procedure codes is possible with a high degree of accuracy and efficiency. This framework may enable tools to support interactive outcomes reporting and clinical decision support.",Toba S; Smith TM; Sperotto F; Carreon CK; Saengsin K; Casella S; Delgado M; Zeng P; Sanders SP; Dionne A; Feins EN; Colan SD; Mayer JE; Kheir JN,"Department of Cardiology, Boston Children's Hospital, Boston, MA 02115, United States.",JAMIA open,2025-10-01,10.1093/jamiaopen/ooaf106,3.0,dashboard(abstract); clinical decision support(abstract); data(abstract),Classification; Phenotype; Congenital heart disease; Echocardiography; Outcomes
41023909,"In search of pragmatic measures and models from routinely collected electronic records to inform continuous optimization of antibiotics stewardship at primary care settings: preliminary findings from Anhui, China.","<h4>Background</h4>Antimicrobial resistance caused by inappropriate antibiotic use has become a global public health crisis. The majority of antibiotics are prescribed at primary care settings which often lack sufficient capacity and surveillance. This study aimed at identifying and testing pragmatic measures and models derived from routinely collected electronic records of primary care encounters to inform continuous antibiotics stewardship.<h4>Methods</h4>We first extracted a total of 7.097 million records of primary care visits over 25 months from Anhui, China, through stratified random cluster sampling and a minimum set of data about related communities. We then identified pragmatic measures and models for examining antibiotic prescribing at primary care settings through repeated cycles of measure/model identification and relevance analysis. The 'identification' used multidisciplinary group meetings while the analysis adopted hybrid methodologies, including descriptive analysis, random forest classification modeling, and data visualization.<h4>Results</h4>The study revealed that: (a) antibiotic prescribing rates ranged from 36.82 to 86.25% for the 7 categories of diagnoses studied, including respiratory diseases (RD), digestive diseases (DD), urogenital diseases (UD), skin infections (SI), injuries (IJ), eye infections (EI), and oral and dental diseases (OD); (b) although overall antibiotic prescribing decreased from 67.80 to 47.11% over the study period, the proportion of broad-spectrum added up to 78.96%; (c) the top 10% and 20% clinicians prescribed 59.9% and 80.0% of all the antibiotic prescriptions; (d) 50.8% of the antibiotic recipients received 2 or more antibiotic prescriptions within the 25-months; (e) the AUC of models of antibiotic prescribing ranged from 0.92 to 0.97 for the 7-category- diagnoses, in which the patient, clinician and spatiotemporal variables contributed 0.08 ~ 0.27, 0.30 ~ 0.70 and 0.16 ~ 0.62 respectively.<h4>Conclusion</h4>The measures and models derived out of routinely collected electronic records of primary healthcare encounters in this study are both feasible and useful.",Xiao D; Yang X; Zheng Y; Xu J; Yang N; Li Y; Wang Y; Cui R; Li N; Liu R; Lu M; Wang D; Shen X,"School of Health Service Management, Anhui Medical University, Hefei Anhui, 230032, China.",BMC infectious diseases,2025-09-29,10.1186/s12879-025-11646-3,3.0,visualization(abstract); visual(abstract); data(abstract),China; Primary Care; Electronic Records; Antibiotic Prescribing; Antibiotics Stewardship
