pmid,title,abstract,authors,first_author_affiliation,journal,pub_date,doi,score,matched_keywords,api_keywords
40770453,"MoB QDs/N, F-CDs for ratiometric fluorescence sensing of perfluorooctanoic acid based on fluorine‑fluorine interaction.","A dual-emission ratiometric fluorescence probe was constructed for detection of perfluorooctanoic acid (PFOA) by hybridizing MoB quantum dots (MoB QDs) and nitrogen, fluorine co-doped carbon dots (N, F-CDs). As the concentration of PFOA increased, the fluorescence emission of MoB QDs/N, F-CDs at 560 nm was quenched due to fluorine-fluorine interaction, while the fluorescence emission at 440 nm kept unchanged, resulting in the fluorescence color changing from yellow to green. A good linear relationship was observed between I<sub>440</sub>/I<sub>560</sub> and the concentration of PFOA in the range 0.01-90 μM and 90-450 μM, with a detection limit as low as 0.01 μM. The test strips for PFOA were prepared for on-site visualization and quantitative determination. The fluorescence images of the test strips were acquired using the camera in the smartphone, and the signals were converted into RGB values by color recognition software. The obtained G/R value had a good linear relationship with the concentration of PFOA ranging from 0.5 to 200 μM. The deep learning model of YOLOv5 algorithm was utilized for data analysis to make the fluorescence detection more accurate. Therefore, the ratiometric fluorescence sensing system is established with easy operation, short response time, and low cost for on-site detection of PFOA in real water samples and textiles, which is of practical significance for environmental water monitoring and human health.",Wang J; Wan X; Li W; Song C; Gao Q; Pan Q; He Y,"Ministry-of-Education Key Laboratory for the Synthesis and Application of Organic Functional Molecules, Hubei Province Key Laboratory for Precision Manufacturing of Small Molecular Active Pharmaceutical Ingredients, College of Chemistry and Chemical Engineering, Hubei University, Wuhan, 430062, China.",Mikrochimica acta,2025-08-06,10.1007/s00604-025-07431-3,3.0,visualization(abstract); visual(abstract); data(abstract),Perfluorooctanoic Acid; Deep Learning; Ratiometric Fluorescence; Nitrogen And Fluorine Co-doped Carbon Dots; Mob Quantum Dots
40775758,Longitudinal graphics of patient-reported physical function in patients treated for hematologic malignancies.,"<h4>Background</h4>The US Food and Drug Administration (FDA) released a draft guidance document detailing core patient-reported outcomes in cancer clinical trials, including physical function (PF). The objectives of this study were to develop analytic methods and visualizations of patient-reported PF in patients with cancer.<h4>Methods</h4>We applied an estimand framework to a patient-reported tolerability endpoint to develop data summaries cross-sectionally and over time, along with visualizations. We accomplished this through iterative feedback with clinicians, statisticians, and FDA stakeholders using three clinical trial datasets in hematologic malignancies. Graphical approaches were applied to three datasets in hematologic malignancies: (1) patients with myeloproliferative neoplasms enrolled in MPN-RC 111/112 trials completed EORTC QLQ-C30 over 12 months; (2) patients with hematologic malignancies undergoing CAR-T cell therapy or autologous transplant who completed FACT questionnaires over 6 months; and (3) patients with multiple myeloma or amyloidosis who completed the PROMIS-29 questionnaire over 6 months. Zoom polls were administered to two stakeholder groups (clinicians/clinical investigators and patient advocates) to elicit feedback.<h4>Results</h4>Visualizations included stacked bar charts, line plots of arithmetic mean changes from baseline, pie charts, waffle plots, and waterfall plots of PF data. Graphics considered scaled scores and individual items and included delineation of PRO completion rate at each time point. Confidence intervals and reference lines were included as applicable, and colorblind accessible colors were implemented to ensure inclusivity of all visualizations. Data summaries over time reporting ""worst"" change were difficult to interpret. In terms of stakeholders' preference, patients preferred stacked bar charts while clinicians equally favored stacked bar charts and line plots; both patients and clinicians preferred waterfall plots to pie charts. Patient feedback highlighted the need for various graphics to convey group level trends and granular individual-patient level information.<h4>Conclusion</h4>Patient-reported PF informs the evaluation of treatment tolerability in cancer trials. Data summaries and visualizations of physical function developed through an iterative process were reviewed favorably by patients, clinicians and FDA stakeholders in this study. Future work to systematically assess accuracy of interpretation of the various analytic and visualization methods is a necessary next step across clinical, regulatory, payer and patient stakeholders.<h4>Trial registration</h4>NCT01259817, NCT01259856.",Thanarajasingam G; Bhatnagar V; Noble BN; Chen TY; Fiero MH; Hoffman R; Jeffery M; Mazza GL; Mascarenhas J; Mesa R; Murugappan M; Ross J; Sidana S; Warsame R; Kluetz PG; Dueck AC,"Division of Hematology, Mayo Clinic, 200 First Street SW, Rochester, MN, USA. thanarajasingam.gita@mayo.edu.",BMC medical research methodology,2025-08-07,10.1186/s12874-025-02617-y,3.0,visualization(abstract); visual(abstract); data(abstract),Cancer; Graphics; Physical Function; Longitudinal Analysis; Treatment Tolerability
40768467,Improving 3D Thin Vessel Segmentation in Brain TOF-MRA via a Dual-space Context-Aware Network.,"3D cerebrovascular segmentation poses a significant challenge, akin to locating a line within a vast 3D environment. This complexity can be substantially reduced by projecting the vessels onto a 2D plane, enabling easier segmentation. In this paper, we create a vessel-segmentation-friendly space using a clinical visualization technique called maximum intensity projection (MIP). Leveraging this, we propose a Dual-space Context-Aware Network (DCANet) for 3D vessel segmentation, designed to capture even the finest vessel structures accurately. DCANet begins by transforming a magnetic resonance angiography (MRA) volume into a 3D Regional-MIP volume, where each Regional-MIP slice is constructed by projecting adjacent MRA slices. This transformation highlights vessels as prominent continuous curves rather than the small circular or ellipsoidal cross-sections seen in MRA slices. DCANet encodes vessels separately in the MRA and the projected Regional-MIP spaces and introduces the Regional-MIP Image Fusion Block (MIFB) between these dual spaces to selectively integrate contextual features from Regional-MIP into MRA. Following dual-space encoding, DCANet employs a Dual-mask Spatial Guidance TransFormer (DSGFormer) decoder to focus on vessel regions while effectively excluding background areas, which reduces the learning burden and improves segmentation accuracy. We benchmark DCANet on four datasets: two public datasets, TubeTK and IXI-IOP, and two in-house datasets, Xiehe and IXI-HH. The results demonstrate that DCANet achieves superior performance, with improvements in average DSC values of at least 2.26%, 2.17%, 2.62%, and 2.58% for thin vessels, respectively. Codes are available at: https://github.com/shanwq/DCANet.",Shan W; Li X; Wang X; Li Q; Wang Z,,IEEE journal of biomedical and health informatics,2025-08-06,10.1109/jbhi.2025.3595640,3.0,visualization(abstract); visual(abstract); data(abstract),
40769376,Intelligent microfluidic device for multiplex detection and prompt warning of upper and lower respiratory tract infections.,"<h4>Introduction</h4>The increasing incidence and co-infection rates of multiple respiratory diseases have emphasized the necessity for efficient and reliable multiplex diagnostic methods for respiratory pathogens.<h4>Objective</h4>This study aims to develop a multiplex diagnostic tool for monitoring and early warning of respiratory infections.<h4>Methods</h4>A portable, centrifugal and highly integrated microfluidic device based on real-time recombinase-aided amplification (RAA) assays capable of specifically identifying 15 common respiratory pathogens was developed. Its point-of-care application was validated using simulated swabs and sputum spiked with 15 pathogens. A total of 427 collected samples were employed to assess its clinical performance, in parallel with traditional extraction kits and RT-qPCR/qPCR assays. Additionally, the feasibility of its connected monitoring and early warning platform was validated across 22 scenarios in 8 cities of mainland China.<h4>Results</h4>This device successfully facilitated sample-to-answer diagnostics by automating nucleic acid extraction, real-time RAA, fluorescence detection and wireless data transmission. Compared with conventional methods, this device has obvious advantages in the turnaround time (30 min for swabs and 60 min for sputum) and the detectable targets/types in a single test. The lowest detection limits of this device were 0.1 TCID<sub>50</sub>/mL for viral targets and 10 CFU/mL for bacterial or fungal targets. This newly developed device has good versatility in detecting various types of pathogens (viruses, bacteria, and fungi) in clinical samples, achieving an AUC above 0.99 for all targets and an accuracy of 99.30 % in the analysis of 345 swab and 82 sputum samples. Moreover, this device achieved seamless data interaction with the intelligent monitoring and early warning system across 22 scenarios, enabling the successful visualization of data statistics and early warning analyses for uploaded information.<h4>Conclusion</h4>This device provides an intelligent, portable, rapid, and sensitive platform for early diagnosis of multiple pathogens, particularly in resource-limited settings.",Gao S; Wang L; Zhao M; Xiang Y; Yang X; Xiong Y; Bai J; Han T; Yang Z; Li H; Lyu X; Zhao L; Sun Y; Wu X; Shen X; Ma X,"National Key Laboratory of Intelligent Tracking and Forecasting for Infectious Diseases, NHC Key Laboratory of Medical Virology and Viral Diseases, National Institute for Viral Disease Control and Prevention, Chinese Center for Disease Control and Prevention, Beijing 102206, China.",Journal of advanced research,2025-08-04,10.1016/j.jare.2025.08.005,3.0,visualization(abstract); visual(abstract); data(abstract),microfluidic chip; Respiratory Pathogens; Nucleic Acid Extraction; Multiplexed Detection; Recombinase-aided Amplification
40762971,Exploring the Time to Onset and Early Predictors of Poststroke Spasticity Combined With Surface Electromyography: Protocol for a Nested Case-Control Study.,"<h4>Background</h4>Poststroke spasticity (PSS) is a frequent sequela in patients who have experienced stroke. This form of paralysis is more prevalent compared to other poststroke sequelae and is among the most challenging and complex symptoms to manage. Surface electromyography (sEMG) can reflect the physiological information of muscles in real time and is highly beneficial in diagnosing neuromuscular diseases in clinical medicine.<h4>Objective</h4>This study aimed to investigate the timing of poststroke limb spasms using a nested case-control study combined with sEMG and to identify and predict factors of PSS at an early stage.<h4>Methods</h4>This was a nested case-control study. Participants were assessed within 24 hours of the onset of hospitalization using a standardized case report form to evaluate general patient information and clinical data related to cerebral infarction and imaging. Upon inclusion, patients were assessed after 1, 2, 4, 8, and 12 weeks, using the Modified Ashworth Scale (MAS) for spasticity severity, root mean square values from sEMG for limb spasm severity, and the simplified Fugl-Meyer (S-FM) Assessment for limb motor function. Patients who experienced spasticity within 12 weeks were assigned to the spasticity group, whereas those who did not experience spasticity were assigned to the control group. Unmatched case grouping was implemented. Data with normal distribution were analyzed using the t test, while data with nonnormal distribution were analyzed using the rank-sum test; categorical data were analyzed using the chi-square test, rank-sum test, or Fisher exact test. Logistic regression analysis was used to investigate factors affecting treatment outcomes. Data processing, analysis, and visualization were conducted using Statistical Package for the Social Sciences software (version 26.0; IBM Corp).<h4>Results</h4>This study is funded by the Chinese Association of Ethnic Medicine and began participant recruitment and registration in November 2023. The study is currently ongoing, with 66 participants enrolled as of March 2025.<h4>Conclusions</h4>This study selected a diagnostic method combining sEMG and subjective scales to determine PSS, aiming to eliminate diagnostic errors caused by subjective assessments. This study adopted a nested case-control study method, which has minimal information bias, allowing for the inference of causal relationships between exposure and disease.<h4>Trial registration</h4>Chinese Clinical Trial Registry ChiCTR2300077121; https://www.chictr.org.cn/showproj.html?proj=205037.<h4>International registered report identifier (irrid)</h4>DERR1-10.2196/65829.",Song S; Wang S; Zeng S; Wu W; Wu L; Tang X; Sun X; Wu D; Xie L,"Graduate School, Hunan University of Traditional Chinese Medicine, Changsha, China.",JMIR research protocols,2025-08-05,10.2196/65829,3.0,visualization(abstract); visual(abstract); data(abstract),Stroke; Surface electromyography; Nested Case-control Study; Early Predictor; Poststroke Spasticity
40758488,"Automated Mapping the Pathways of Cranial Nerve II, III, V, and VII/VIII: A Multi-Parametric Multi-Stage Diffusion Tractography Atlas.","<h4>Objective</h4>Cranial nerves (CNs) play a crucial role in various essential functions of the human brain, and mapping their pathways from diffusion MRI (dMRI) provides valuable preoperative insights into the spatial relationships between individual CNs and key tissues. However, mapping a comprehensive and detailed CN atlas is challenging because of the unique anatomical structures of each CN pair and the complexity of the skull base environment.<h4>Method</h4>In this work, we present what we believe to be the first study to develop a comprehensive diffusion tractography atlas for automated mapping of CN pathways in the human brain. The CN atlas is generated by fiber clustering by using the streamlines generated by multi-parametric fiber tractography for each pair of CNs. Instead of disposable clustering, we explore a new strategy of multi-stage fiber clustering for multiple analysis of approximately 1,000,000 streamlines generated from the 50 subjects from the Human Connectome Project (HCP).<h4>Results</h4>Quantitative and visual experiments demonstrate that our CN atlas achieves high spatial correspondence with expert manual annotations on multiple acquisition sites, including the HCP dataset, the Multi-shell Diffusion MRI (MDM) dataset and two clinical cases of pituitary adenoma patients.<h4>Conclusion</h4>The proposed CN atlas can automatically identify 8 fiber bundles associated with 5 pairs of CNs, including the optic nerve CN II, oculomotor nerve CN III, trigeminal nerve CN V and facial-vestibulocochlear nerve CN VII/VIII, and its robustness is demonstrated experimentally.<h4>Significance</h4>This work contributes to the field of diffusion imaging by facilitating more efficient and automated mapping the pathways of multiple pairs of CNs, thereby enhancing the analysis and understanding of complex brain structures through visualization of their spatial relationships with nearby anatomy.",Xie L; Huang J; Zhang J; He J; Pan Y; Xie G; Li M; Zeng Q; Li M; Feng Y,,IEEE transactions on bio-medical engineering,2025-08-04,10.1109/tbme.2025.3595182,3.0,visualization(abstract); visual(abstract); data(abstract),
40759733,Bibliometric analysis of research trends in early orthodontic treatment: a two-decade perspective (2000-2025).,"<h4>Background</h4>Early orthodontic treatment has evolved significantly over the past decades, with advances in diagnostic techniques, treatment methodologies, and interdisciplinary approaches. Despite its importance in pediatric dental care, a comprehensive bibliometric evaluation of research trends in this field has been lacking.<h4>Objective</h4>To conduct a systematic bibliometric analysis of the research landscape and developmental trends in early orthodontic intervention for children and adolescents from 2000-2025.<h4>Methods</h4>Literature data were retrieved from Web of Science Core Collection and Scopus databases using comprehensive search strategies targeting early orthodontic treatment research. The final dataset of 906 articles was analyzed using VOSviewer 1.6.20 and CiteSpace 6.1R6 visualization software to examine publication trends, author and institutional collaboration networks, journal distributions, geographical contributions, and keyword co-occurrence patterns.<h4>Results</h4>Research output demonstrated consistent growth from 6 publications in 2000 to 85 in 2023. Lorenzo Franchi emerged as the most productive author (12 publications), while the University of Milan led institutional contributions (28 publications). The American Journal of Orthodontics and Dentofacial Orthopedics was the primary publication venue (88 articles). Italy (161 publications) and the USA (144 publications) were the leading contributors. Keyword analysis revealed ""children"" as the most frequent term (270 occurrences), followed by ""orthodontic treatment"" (125 occurrences) and ""prevalence"" (106 occurrences), with distinct evolution patterns showing a transition from fundamental concepts like ""growth"" (appearing in 2000) to specialized terms such as ""obstructive sleep apnea"" (2015) and ""quality of life"" (2020), while citation burst analysis identified ""quality of life"" with the strongest recent burst strength (5.92).<h4>Conclusion</h4>Early orthodontic treatment research has evolved from foundational concepts to patient-centered outcomes and technological applications, with increasing interdisciplinary focus and internationalization requiring sustained collaborative efforts to address emerging clinical priorities.",Li S; Zhao D; Chen J; He L; Hu S; Zhang W,"Stomatological Hospital, School of Stomatology, Southern Medical University, Guangzhou, China, S366 Jiangnan Boulevard, Haizhu District, Guangdong Province, 510280.",Journal of orofacial orthopedics = Fortschritte der Kieferorthopadie : Organ/official journal Deutsche Gesellschaft fur Kieferorthopadie,2025-08-04,10.1007/s00056-025-00604-y,3.0,visualization(abstract); visual(abstract); data(abstract),Citation Analysis; Vosviewer; Research Trends; Citespace; Dental Journalism
40767072,Seeing inside the Body Using Wearable Sensing and Imaging Technologies.,"The growing demand for personalized and real-time health assessment has driven rapid advancements in wearable health monitoring technologies. A critical shift is underway from reactive, treatment-centered care toward proactive, preventive healthcare models, motivating efforts to observe internal physiological states more accurately from outside the body. This review presents wearable monitoring technologies for evaluating internal organ function, focusing on two principal approaches: indirect sensing-based methods and direct imaging-based methods. Indirect methods utilize surrogate signals-including electrophysiological activity, physical responses, and biochemical markers-to infer physiological states. To address the limitations of single-modality sensing, recent developments in multimodal systems that integrate electrical, chemical, and physical signals are also highlighted. However, indirect approaches based on biomarkers are often insufficient for diagnostic applications that require direct visualization of organ structure and function. Therefore, this review further explores direct imaging technologies, such as wearable ultrasound and electrical impedance tomography (EIT), which offer more immediate insights into internal biological conditions. By combining indirect and direct strategies, wearable systems are evolving beyond surface-level monitoring to enable internal visualization and functional assessment of organs. This review outlines the key enabling technologies and discusses their potential to advance participatory, personalized, and precision healthcare through continuous and context-aware monitoring platforms.",Kim S; Han S; Park S; Koo J,"School of Biomedical Engineering, Korea University, Seoul, 02841, Republic of Korea.",Advanced healthcare materials,2025-08-06,10.1002/adhm.202502480,2.5,visualization(abstract); visual(abstract),Multimodal Sensing; Direct Imaging; Wearable Health Monitoring; Indirect Sensing; Real‐time Continuous Monitoring
40755171,Needle-scope guided surgical correction of pectus excavatum in a kitten.,"<h4>Objective</h4>To describe the practicality and utility of performing corrective surgery for pectus excavatum (PE) while guided by a minimally invasive small gauge needle-scope in a kitten.<h4>Study design</h4>Case report.<h4>Animal</h4>An 8-week-old, 0.8 kg, male intact, domestic short hair cat.<h4>Methods</h4>Bloodwork, radiography, surgical report, and postoperative records of a kitten severely affected with PE were reviewed and reported. The kitten underwent thoracoscopic guided surgical correction of PE using a small gauge needle-scope to aid in visualization. Surgical treatment of this kitten included the use of a small gauge needle-scope for video-assisted thoracoscopy which provided direct visualization for passage of sutures into the thoracic cavity and around sternebrae which were then secured to an external splinting device.<h4>Results</h4>The patient recovered uneventfully with clinical improvements at both 2- and 6-weeks postoperatively. Five month postoperative follow-up with the owner revealed no evidence of respiratory signs.<h4>Conclusion</h4>The use of a small gauge needle-scope provided excellent visualization for safe suture passage for external splinting in a pediatric feline patient with severe PE.<h4>Clinical significance</h4>For small pediatric felines, a small gauge needle-scope can be used for thoracoscopic visualization of suture passage for external splinting for PE. Direct visualization of suture placement may minimize the risk of intraoperative complications in animals with moderate to severe PE with limited working space.",Backman A; Marvel SJ,"Department of Clinical Sciences, College of Veterinary Medicine and Biomedical Sciences, Colorado State University, Fort Collins, Colorado, USA.",Veterinary surgery : VS,2025-08-04,10.1111/vsu.14323,2.5,visualization(abstract); visual(abstract),
40767363,Three-dimensional versus two-dimensional laparoscopy: What is the evidence?,"<h4>Background</h4>Minimally invasive surgery has made tremendous progress in the last two decades thanks to the more sophisticated instrumentation, new entry ports, vessel sealant devices, and ultrasound dissectors. Cameras and monitors are now high-definition or 4 K, increasing the clarity of the image available to the surgeon. Those progresses have made minimally invasive surgery safer. However, the biggest challenge of minimally invasive surgery is the lack of depth perception, which requires the surgeon's brain to recreate a three-dimensional (3D) image using cues in the field. The development of 3D cameras enable surgeons to have a more realistic depth perception. The development of the third generation of 3D cameras, combined with light-polarizing glasses, resolved the problem of dizziness experienced by surgeons during long and complicated procedures.<h4>Aims</h4>To review the evidence from human and veterinary surgery regarding the benefits of 3D visualization during laparoscopy.<h4>Conclusions and implications</h4>The evidence suggests that 3D visualization enhances depth perception, safety, a smoother learning curve, and overall wellness for surgeons. Some controversies persist on the clinical benefit of 3D visualization, even if most of the studies showed statistically significant reduction of operating time, estimated blood loss, operating errors, and shorten hospital stay in human patients.",Monnet E,"Department of Clinical Sciences, College of Veterinary Medicine, Colorado State University, Fort Collins, Colorado, USA.",Veterinary surgery : VS,2025-08-06,10.1111/vsu.14329,2.5,visualization(abstract); visual(abstract),
